Lens ID,Title,Date Published,Publication Year,Publication Type,Source Title,ISSNs,Publisher,Source Country,Author/s,Abstract,Volume,Issue Number,Start Page,End Page,Fields of Study,Keywords,MeSH Terms,Chemicals,Funding,Source URLs,External URL,PMID,DOI,Microsoft Academic ID,PMCID,Citing Patents Count,References,Citing Works Count,Is Open Access,Open Access License,Open Access Colour
020-677-339-480-630,Robust adaptive optimization for sustainable water demand prediction in water distribution systems.,2025-02-03,2025,journal article,Scientific reports,20452322,Springer Science and Business Media LLC,United Kingdom,Ke Wang; Jiayang Meng; Zhangquan Wang; Kehua Zhao; Banteng Liu,"The advancement of the Internet of Things has positioned intelligent water demand forecasting as a critical component in the quest for sustainable water resource management. Despite the potential benefits, the inherent non-stationarity of water consumption data poses significant hurdles to the predictive accuracy of forecasting models. This study introduces a novel approach, the Robust Adaptive Optimization Decomposition (RAOD) strategy, which integrates a deep neural network to address these challenges. The RAOD strategy leverages the Complete Ensemble Empirical Mode Decomposition (CEEMD) to preprocess the water demand series, mitigating the effects of non-stationarity and non-linearity. To further enhance the model's robustness, an innovative optimization algorithm is incorporated within the CEEMD process to minimize the variance in multi-scale arrangement entropy among the decomposed components, thereby improving the model's generalization capabilities. The predictive power of the proposed model is harnessed through the construction of deep neural networks that utilize the decomposed data to forecast minutely water demand. To validate the effectiveness of the RAOD strategy, real-world datasets from four distinct geographical regions are employed for multi-step ahead predictions. The experimental outcomes demonstrate that the RAOD model outperforms existing models across all considered metrics, highlighting its suitability for accurate and reliable water demand forecasting in the context of sustainable energy management.",15,1,4039,4039,Computer science; Distribution (mathematics); Mathematics; Mathematical analysis,Long short-term memory network; Permutation entropy; Sequence decomposition; Smart water management; Water demand prediction,,,Zhejiang Natural Science Foundation Project (LQ23F030002); Open Research Project of the State Key Laboratory of Industrial Control Technology (ICT2022B34); 'Ling Yan' Research and Development Project of Science and Technology Department of Zhejiang Province (2022C03122); 'Ling Yan' Research and Development Project of Science and Technology Department of Zhejiang Province (2023C03189); 'Ling Yan' Research and Development Project of Science and Technology Department of Zhejiang Province (2023C03161),https://www.nature.com/articles/s41598-025-88628-7.pdf https://doi.org/10.1038/s41598-025-88628-7 https://pmc.ncbi.nlm.nih.gov/articles/PMC11791205/pdf/41598_2025_Article_88628.pdf https://www.ncbi.nlm.nih.gov/pmc/articles/11791205,http://dx.doi.org/10.1038/s41598-025-88628-7,39901018,10.1038/s41598-025-88628-7,,PMC11791205,0,000-267-578-938-189; 001-388-932-092-997; 003-901-498-479-941; 006-754-714-974-499; 008-723-278-730-754; 009-047-170-363-96X; 011-601-613-632-67X; 014-510-602-426-630; 019-011-473-457-603; 021-877-084-251-686; 026-700-803-294-542; 027-328-713-030-787; 028-595-866-325-829; 028-862-351-890-945; 031-481-555-417-307; 032-687-404-798-448; 033-326-857-003-882; 036-093-794-866-553; 036-547-044-191-052; 037-101-021-382-454; 039-991-141-207-466; 041-498-547-401-86X; 041-659-409-380-903; 052-811-275-261-679; 053-888-196-747-672; 059-020-297-059-723; 068-832-626-953-540; 069-381-203-823-310; 070-200-761-267-216; 071-556-541-979-91X; 072-802-954-816-075; 073-432-876-726-509; 075-507-154-614-237; 086-131-894-877-186; 092-446-846-988-23X; 098-327-673-883-443; 099-876-139-401-836; 108-959-202-595-978; 115-571-175-722-62X; 134-677-153-022-74X; 135-892-486-579-608; 137-198-851-770-287; 141-542-313-965-962; 141-790-935-024-342; 171-860-462-797-052; 181-882-883-837-964,2,true,"CC BY, CC BY-NC-ND",gold
026-197-201-205-412,Practical Skills Demand Forecasting via Representation Learning of Temporal Dynamics,2022-07-26,2022,conference proceedings article,"Proceedings of the 2022 AAAI/ACM Conference on AI, Ethics, and Society",,ACM,,Maysa Malfiza Garcia de Macedo; Wyatt Clarke; Eli Lucherini; Tyler Baldwin; Dilermando Queiroz Neto; Rogerio Abreu de Paula; Subhro Das,"Rapid technological innovation threatens to leave much of the global workforce behind. Today's economy juxtaposes white-hot demand for skilled labor against stagnant employment prospects for workers unprepared to participate in a digital economy. It is a moment of peril and opportunity for every country, with outcomes measured in long-term capital allocation and the life satisfaction of billions of workers. To meet the moment, governments and markets must find ways to quicken the rate at which the supply of skills reacts to changes in demand. More fully and quickly understanding labor market intelligence is one route. In this work, we explore the utility of time series forecasts to enhance the value of skill demand data gathered from online job advertisements. This paper presents a pipeline which makes one-shot multi-step forecasts into the future using a decade of monthly skill demand observations based on a set of recurrent neural network methods. We compare the performance of a multivariate model versus a univariate one, analyze how correlation between skills can influence multivariate model results, and present predictions of demand for a selection of skills practiced by workers in the information technology industry.",,,285,294,Univariate; Supply and demand; Workforce; Computer science; Work (physics); Moment (physics); Multivariate statistics; Labour economics; Economics; Microeconomics; Engineering; Machine learning; Mechanical engineering; Classical mechanics; Economic growth; Physics,skill representation; demand forecasting; neural networks; labor economics,,,,https://arxiv.org/pdf/2205.09508 http://arxiv.org/abs/2205.09508,http://dx.doi.org/10.1145/3514094.3534183,,10.1145/3514094.3534183,,,0,000-566-764-315-719; 003-914-072-470-379; 004-354-297-930-966; 005-609-733-141-209; 025-362-615-805-805; 025-816-514-018-523; 030-633-424-429-66X; 036-665-842-111-878; 053-094-537-530-97X; 057-386-561-697-323; 063-976-946-206-932; 074-741-430-928-048; 083-368-266-683-328; 100-462-552-209-016; 108-216-986-449-946; 112-705-069-209-103; 141-723-003-727-400; 193-794-825-380-412,6,true,,green
046-646-230-865-555,Kernel Methods and Hybrid Evolutionary Algorithms in Energy Forecasting,2018-10-18,2018,book,,,MDPI,,Wei-Chiang Hong,,,,,,Spiking neural network; Kernel method; Artificial intelligence; Evolutionary algorithm; Wavelet transform; Hilbert–Huang transform; Energy forecasting; Extreme learning machine; Computer science,,,,,https://directory.doabooks.org/handle/20.500.12854/51077,http://dx.doi.org/10.3390/books978-3-03897-293-8,,10.3390/books978-3-03897-293-8,3132092974,,0,,0,true,cc-by-nc-nd,green
051-521-564-050-753,"IoT Authentication in Federated Learning: Methods, Challenges, and Future Directions.",2025-12-16,2025,journal article,"Sensors (Basel, Switzerland)",14248220; 14243210,Multidisciplinary Digital Publishing Institute (MDPI),Switzerland,Arwa Badhib; Suhair Alshehri; Asma Cherif,"The Internet of Things (IoT) has established an exceptional ecosystem of interconnected devices where a vast multitude of heterogeneous devices can communicate, collect, and share data for enhanced decision-making processes. To effectively analyze this immense volume of data, researchers have deployed advanced machine learning algorithms and deep neural networks. However, these approaches typically rely on centralized data storage for training, which raises significant privacy concerns. Federated Learning (FL) addresses this issue by allowing devices to train local models on their own data and share only model updates. Despite this advantage, FL remains vulnerable to several security threats, including model poisoning, data manipulation, and Byzantine attacks. Therefore, robust and scalable authentication mechanisms are essential to ensure secure participation in FL environments. This study provides a comprehensive survey of authentication in FL. We examine the authentication process, discuss the associated key challenges, and analyze architectural considerations relevant to securing FL deployments. Existing authentication schemes are reviewed and evaluated in terms of their effectiveness, limitations, and practicality. To provide deeper insight, we classify these schemes along two dimensions as follows: their underlying enabling technologies, such as blockchain, cryptography, and AI-based methods, and the system contexts in which FL operates. Furthermore, we analyze the datasets and experimental environments used in current research, identify open research challenges, and highlight future research directions. To the best of our knowledge, this study presents the first structured and comprehensive analysis of authentication mechanisms in FL, offering a foundational reference for advancing secure and trustworthy federated learning systems.",25,24,7619,7619,,IoT; authentication; behavior; biometric; blockchain; cryptography; federated learning,,,KAU Endowment (WAQF) King Abdulaziz University (0000),https://www.mdpi.com/1424-8220/25/24/7619/pdf?version=1765878030 https://doi.org/10.3390/s25247619,http://dx.doi.org/10.3390/s25247619,41471613,10.3390/s25247619,,PMC12736949,0,000-243-652-593-734; 000-462-220-570-993; 001-799-469-979-727; 002-403-371-756-616; 006-810-109-663-186; 007-200-965-400-010; 007-891-546-074-121; 009-023-297-475-129; 009-791-483-278-593; 010-609-143-495-26X; 011-073-876-345-967; 011-731-966-931-531; 013-593-983-704-410; 015-067-455-076-222; 015-230-898-752-960; 018-553-338-494-639; 018-568-590-734-499; 019-234-607-024-060; 020-104-103-402-603; 020-155-301-218-356; 024-676-589-115-709; 025-698-255-179-722; 026-341-606-040-365; 028-343-990-954-437; 030-682-441-981-123; 030-713-410-955-829; 032-467-005-864-052; 033-299-791-900-298; 034-903-531-517-852; 036-997-121-920-369; 040-181-257-353-773; 042-746-266-025-374; 045-521-231-032-744; 045-745-014-570-389; 048-463-419-254-687; 049-205-111-260-233; 050-733-831-843-669; 051-972-279-661-400; 052-743-851-767-140; 054-554-133-021-627; 055-571-201-491-737; 055-732-428-115-669; 057-297-101-534-588; 058-258-776-859-131; 058-305-558-645-222; 058-377-880-988-728; 060-683-965-181-840; 061-401-955-558-462; 065-423-571-457-921; 065-813-536-198-155; 069-919-501-663-724; 070-220-720-516-210; 070-693-574-706-795; 073-305-140-018-364; 073-523-278-902-393; 077-104-668-926-461; 077-829-126-652-855; 086-783-072-343-904; 086-966-484-135-345; 087-706-471-384-364; 088-058-235-730-847; 088-518-669-788-880; 088-625-515-217-966; 088-711-894-431-663; 091-459-332-080-802; 100-415-146-730-269; 100-582-366-364-975; 100-855-380-166-861; 103-509-536-772-911; 104-707-517-228-797; 106-644-756-826-249; 112-465-732-895-956; 114-386-550-175-920; 117-254-510-518-647; 121-752-114-104-940; 122-949-322-514-720; 123-802-134-269-369; 126-736-675-326-561; 127-677-557-916-279; 129-768-599-576-678; 136-365-271-056-625; 138-686-621-740-989; 139-934-213-564-089; 140-642-528-065-453; 140-852-692-021-810; 143-719-640-712-173; 143-789-587-223-074; 144-200-165-631-539; 144-821-141-024-437; 145-176-295-843-184; 146-012-205-147-149; 146-521-669-804-237; 147-650-616-033-368; 149-114-403-933-817; 155-061-427-382-950; 155-188-543-879-911; 155-496-917-236-801; 157-592-760-825-685; 160-546-401-233-144; 163-356-718-796-449; 164-331-830-123-557; 164-597-423-259-324; 169-832-697-209-649; 171-750-050-947-459; 171-838-154-608-562; 173-027-782-493-392; 177-604-140-276-081; 180-836-388-183-20X; 181-100-600-586-44X; 186-191-225-478-41X; 186-691-608-655-875; 188-008-382-750-354; 188-173-472-023-870; 189-558-214-880-777; 189-878-032-248-546; 190-436-959-864-384,1,true,cc-by,gold
058-660-675-809-130,A parameter-free discrete particle swarm algorithm and its application to multi-objective pavement maintenance schemes,,2018,journal article,Swarm and Evolutionary Computation,22106502,Elsevier BV,Netherlands,Maher Mahmood; Senthan Mathavan; Mahbubur Rahman,"Abstract Regular maintenance is paramount for a healthy road network, the arteries of any economy. As the resources for maintenance are limited, optimization is necessary. A number of conflicting objectives exist with many influencing variables. Although many methods have been proposed, the related research is very active, due to difficulties in adoption to the actual practice owing to reasons such high-dimensional problems even for small road networks. Literature survey tells that particle swarms have not been exploited much, mainly due to unavailability of many techniques in this domain for multi-objective discrete problems like this. In this work, a novel particle swarm algorithm is proposed for a general, discrete, multi-objective problem. In contrast to the standard particle swarm, the bare-bones technique has a clear advantage in that it is a parameter-free technique, hence the end users need not be optimization experts. However, the existing barebones algorithm is available only for continuous domains, sans any particle velocity terms. For discrete domains, the proposed method introduces a parameter-free velocity term to the standard bare-bones algorithm. Based on the peak velocities observed by the different dimensions of a particle, its new position is calculated. A number of benchmark test functions are also solved. The results show that the proposed algorithm is highly competitive and able to obtain much better spread of solutions compared to three other existing PSO and genetic algorithms. The method is benchmarked against a number of other algorithms on an actual pavement maintenance problem. When compared against another particle swarm algorithm, it not only shows better performance, but also significant reduction in run-time compared to other POS algorithm. Hence, for large road network maintenance, the proposed method shows a lot of promise in terms of analysis time, while improving on the quality of solutions.",43,,69,87,Algorithm; Benchmark (computing); Discrete optimization; Swarm behaviour; Unavailability; Literature survey; Computer science; Multi-objective optimization; Particle swarm optimization; Reduction (complexity),,,,,https://www.sciencedirect.com/science/article/pii/S2210650217306004 https://dblp.uni-trier.de/db/journals/swevo/swevo43.html#MahmoodMR18 https://bura.brunel.ac.uk/handle/2438/16633 https://research.aston.ac.uk/en/publications/a-parameter-free-discrete-particle-swarm-algorithm-and-its-applic https://bura.brunel.ac.uk/bitstream/2438/16633/4/FullText.pdf https://doi.org/10.1016/j.swevo.2018.03.013,http://dx.doi.org/10.1016/j.swevo.2018.03.013,,10.1016/j.swevo.2018.03.013,2794658055,,0,002-263-156-478-519; 002-975-412-845-53X; 005-161-056-601-024; 006-696-617-906-264; 007-742-363-463-221; 008-193-696-517-459; 009-351-787-509-232; 010-945-975-693-966; 011-185-561-917-736; 012-984-355-911-939; 013-686-724-707-978; 013-840-272-952-683; 016-871-900-476-659; 017-483-676-509-525; 020-040-719-483-341; 020-444-041-885-814; 024-162-713-773-154; 028-271-480-179-143; 028-524-781-104-447; 029-006-810-366-507; 029-040-729-612-562; 030-325-495-706-201; 030-849-846-731-677; 030-900-306-715-394; 031-977-575-094-727; 038-574-218-965-676; 038-677-287-169-966; 043-550-694-312-11X; 044-124-467-120-50X; 044-160-052-430-459; 044-960-106-374-057; 052-958-484-927-242; 053-885-178-288-798; 056-023-943-699-763; 059-521-887-236-393; 060-997-502-396-134; 063-062-832-978-44X; 065-251-575-792-649; 066-496-904-125-479; 066-611-919-172-367; 079-687-964-708-442; 081-279-973-478-596; 084-429-568-898-749; 086-299-409-293-371; 086-653-181-613-752; 087-204-144-249-704; 093-300-617-689-10X; 096-984-792-053-597; 101-406-753-094-403; 106-425-346-367-22X; 106-430-239-573-606; 107-541-978-018-68X; 108-011-328-297-646; 111-018-890-276-092; 113-562-919-596-498; 115-375-037-606-77X; 118-234-527-471-580; 119-136-311-873-553; 120-615-968-630-461; 122-875-568-570-889; 123-873-316-578-101; 128-435-885-495-420; 130-370-923-046-210; 134-084-295-412-037; 141-521-423-486-046; 147-457-174-029-956; 154-478-300-225-031; 156-253-974-350-192; 156-456-234-511-966; 157-627-536-186-775; 159-076-077-783-97X; 160-110-999-495-378; 171-740-346-255-575,23,true,,green
062-630-346-350-637,Exploring Quantum Neural Networks for Demand Forecasting.,2025-05-01,2025,journal article,"Entropy (Basel, Switzerland)",10994300,Multidisciplinary Digital Publishing Institute (MDPI),Switzerland,Gleydson Fernandes de Jesus; Maria Heloísa Fraga da Silva; Otto Menegasso Pires; Lucas Cruz da Silva; Clebson Dos Santos Cruz; Valéria Loureiro da Silva,"Forecasting demand for assets and services can be addressed in various markets, providing a competitive advantage when the predictive models used demonstrate high accuracy. However, the training of machine learning models incurs high computational costs, which may limit the training of prediction models based on available computational capacity. In this context, this paper presents an approach for training demand prediction models using quantum neural networks. For this purpose, a quantum neural network was used to forecast demand for vehicle financing. A classical recurrent neural network was used to compare the results, and they show a similar predictive capacity between the classical and quantum models, with the advantage of using a lower number of training parameters and also converging in fewer steps. Utilizing quantum computing techniques offers a promising solution to overcome the limitations of traditional machine learning approaches in training predictive models for complex market dynamics.",27,5,490,490,Computer science; Artificial neural network; Context (archaeology); Artificial intelligence; Demand forecasting; Quantum; Machine learning; Limit (mathematics); Predictive modelling; Operations research; Mathematics; Mathematical analysis; Biology; Paleontology; Quantum mechanics; Physics,demand forecasting; predictive modeling; quantum finance; quantum machine learning; vehicle financing,,,EMBRAPII/MCTI (053/2023); FAPESB (APP0041/2023); FAPESB (PPP0006/2024),https://www.mdpi.com/1099-4300/27/5/490/pdf?version=1746089177 https://doi.org/10.3390/e27050490,http://dx.doi.org/10.3390/e27050490,40422445,10.3390/e27050490,,PMC12110249,0,004-924-916-521-216; 010-418-641-779-896; 015-610-270-783-942; 017-296-092-624-358; 021-855-768-052-154; 028-752-542-793-374; 031-732-568-490-259; 032-517-217-507-56X; 033-202-440-209-063; 038-082-769-618-151; 045-428-592-345-192; 047-327-162-609-071; 059-750-368-827-166; 063-990-484-885-694; 068-752-733-488-154; 081-922-116-927-529; 090-355-722-261-489; 096-624-163-962-457; 097-210-613-531-213; 110-560-766-872-958; 113-175-093-045-517; 113-232-282-041-871; 116-965-461-942-808; 129-686-009-700-669; 148-192-988-229-67X; 155-836-005-066-094; 191-103-960-270-250,5,true,cc-by,gold
065-486-880-223-473,"Radiology AI and sustainability paradox: environmental, economic, and social dimensions.",2025-04-17,2025,journal article,Insights into imaging,18694101,Springer Science and Business Media LLC,Germany,Burak Kocak; Andrea Ponsiglione; Valeria Romeo; Lorenzo Ugga; Merel Huisman; Renato Cuocolo,"Artificial intelligence (AI) is transforming radiology by improving diagnostic accuracy, streamlining workflows, and enhancing operational efficiency. However, these advancements come with significant sustainability challenges across environmental, economic, and social dimensions. AI systems, particularly deep learning models, require substantial computational resources, leading to high energy consumption, increased carbon emissions, and hardware waste. Data storage and cloud computing further exacerbate the environmental impact. Economically, the high costs of implementing AI tools often outweigh the demonstrated clinical benefits, raising concerns about their long-term viability and equity in healthcare systems. Socially, AI risks perpetuating healthcare disparities through biases in algorithms and unequal access to technology. On the other hand, AI has the potential to improve sustainability in healthcare by reducing low-value imaging, optimizing resource allocation, and improving energy efficiency in radiology departments. This review addresses the sustainability paradox of AI from a radiological perspective, exploring its environmental footprint, economic feasibility, and social implications. Strategies to mitigate these challenges are also discussed, alongside a call for action and directions for future research. CRITICAL RELEVANCE STATEMENT: By adopting an informed and holistic approach, the radiology community can ensure that AI's benefits are realized responsibly, balancing innovation with sustainability. This effort is essential to align technological advancements with environmental preservation, economic sustainability, and social equity. KEY POINTS: AI has an ambivalent potential, capable of both exacerbating global sustainability issues and offering increased productivity and accessibility. Addressing AI sustainability requires a broad perspective accounting for environmental impact, economic feasibility, and social implications. By embracing the duality of AI, the radiology community can adopt informed strategies at individual, institutional, and collective levels to maximize its benefits while minimizing negative impacts.",16,1,88,88,Sustainability; Carbon footprint; Health care; Environmental economics; Business; Economics; Greenhouse gas; Economic growth; Biology; Ecology,Artificial intelligence; Environmental health; Health equity; Radiology; Sustainability,,,,https://insightsimaging.springeropen.com/counter/pdf/10.1186/s13244-025-01962-2 https://doi.org/10.1186/s13244-025-01962-2 https://repository.ubn.ru.nl/bitstream/handle/2066/318865/1/318865.pdf https://hdl.handle.net/2066/318865,http://dx.doi.org/10.1186/s13244-025-01962-2,40244301,10.1186/s13244-025-01962-2,,PMC12006592,0,005-005-103-531-133; 005-559-526-040-381; 005-925-589-689-097; 009-002-116-191-045; 009-662-081-416-833; 010-609-143-495-26X; 012-323-484-681-043; 012-816-270-748-586; 013-061-078-739-800; 015-882-188-481-741; 018-288-557-605-998; 020-965-549-040-680; 022-126-977-905-105; 022-756-424-597-567; 022-771-708-167-871; 027-570-208-945-084; 027-724-879-296-58X; 029-225-928-662-686; 030-581-075-905-282; 031-036-362-331-210; 033-459-660-431-647; 034-148-366-446-221; 036-156-729-639-747; 036-549-177-863-157; 036-592-894-353-962; 037-492-264-977-517; 039-578-774-489-724; 040-954-000-855-374; 041-946-207-275-402; 042-509-267-974-046; 042-717-487-126-221; 043-979-271-567-964; 046-583-820-550-216; 050-728-382-080-910; 051-120-271-623-477; 051-839-160-156-113; 052-731-273-279-496; 054-583-761-595-544; 055-635-826-171-397; 064-244-200-897-290; 065-322-483-126-142; 067-091-860-614-916; 067-422-182-402-773; 071-332-673-859-730; 071-364-252-241-613; 071-932-164-058-993; 075-069-031-382-926; 078-625-119-402-366; 079-374-541-969-790; 082-352-577-497-597; 094-479-705-986-04X; 099-515-830-187-981; 104-834-958-597-899; 107-203-677-168-527; 108-954-582-806-227; 117-111-294-917-468; 117-861-779-240-777; 121-682-725-611-721; 122-092-863-546-055; 123-129-712-949-386; 124-590-621-322-408; 127-772-771-060-737; 128-049-680-332-622; 134-078-519-766-846; 137-181-099-458-496; 139-665-539-086-141; 145-447-565-678-345; 152-732-980-270-407; 154-874-563-834-837; 155-707-768-105-142; 156-548-466-075-663; 157-061-531-472-975; 157-738-315-677-660; 158-469-362-619-31X; 159-689-741-272-927; 162-988-457-725-499; 163-402-259-798-190; 167-418-115-397-680; 177-197-191-500-914; 178-497-736-999-980; 183-539-614-798-850; 187-058-602-820-369; 187-715-892-680-743; 188-576-807-584-618; 190-410-271-117-836; 193-858-581-705-638,26,true,cc-by,gold
