Lens ID,Title,Date Published,Publication Year,Publication Type,Source Title,ISSNs,Publisher,Source Country,Author/s,Abstract,Volume,Issue Number,Start Page,End Page,Fields of Study,Keywords,MeSH Terms,Chemicals,Funding,Source URLs,External URL,PMID,DOI,Microsoft Academic ID,PMCID,Citing Patents Count,References,Citing Works Count,Is Open Access,Open Access License,Open Access Colour
066-460-872-697-960,Overcoming the Limits of Cross-Sensitivity: Pattern Recognition Methods for Chemiresistive Gas Sensor Array.,2024-08-14,2024,journal article,Nano-micro letters,21505551; 23116706,Springer Science and Business Media LLC,United States,Haixia Mei; Jingyi Peng; Tao Wang; Tingting Zhou; Hongran Zhao; Tong Zhang; Zhi Yang,"As information acquisition terminals for artificial olfaction, chemiresistive gas sensors are often troubled by their cross-sensitivity, and reducing their cross-response to ambient gases has always been a difficult and important point in the gas sensing area. Pattern recognition based on sensor array is the most conspicuous way to overcome the cross-sensitivity of gas sensors. It is crucial to choose an appropriate pattern recognition method for enhancing data analysis, reducing errors and improving system reliability, obtaining better classification or gas concentration prediction results. In this review, we analyze the sensing mechanism of cross-sensitivity for chemiresistive gas sensors. We further examine the types, working principles, characteristics, and applicable gas detection range of pattern recognition algorithms utilized in gas-sensing arrays. Additionally, we report, summarize, and evaluate the outstanding and novel advancements in pattern recognition methods for gas identification. At the same time, this work showcases the recent advancements in utilizing these methods for gas identification, particularly within three crucial domains: ensuring food safety, monitoring the environment, and aiding in medical diagnosis. In conclusion, this study anticipates future research prospects by considering the existing landscape and challenges. It is hoped that this work will make a positive contribution towards mitigating cross-sensitivity in gas-sensitive devices and offer valuable insights for algorithm selection in gas recognition applications.",16,1,269,269,Sensitivity (control systems); Computer science; Identification (biology); Reliability (semiconductor); Artificial intelligence; Sensor array; Machine learning; Data mining; Pattern recognition (psychology); Engineering; Electronic engineering; Botany; Power (physics); Physics; Quantum mechanics; Biology,Artificial olfactory; Chemiresistive gas sensor; Cross-sensitivity; Pattern recognition; Sensor array,,,,https://link.springer.com/content/pdf/10.1007/s40820-024-01489-z.pdf https://doi.org/10.1007/s40820-024-01489-z https://pmc.ncbi.nlm.nih.gov/articles/PMC11324646/pdf/40820_2024_Article_1489.pdf https://www.ncbi.nlm.nih.gov/pmc/articles/11324646,http://dx.doi.org/10.1007/s40820-024-01489-z,39141168,10.1007/s40820-024-01489-z,,PMC11324646,0,000-356-638-577-560; 000-512-265-660-258; 000-868-393-592-445; 000-972-571-826-364; 001-858-085-811-965; 002-006-544-034-322; 002-085-875-252-509; 002-411-816-358-582; 003-252-718-494-610; 004-334-466-069-495; 005-153-716-942-917; 007-049-359-898-040; 007-979-851-360-024; 008-697-769-338-013; 008-872-970-947-019; 009-802-915-223-555; 010-455-522-126-297; 010-598-894-223-256; 010-733-021-630-10X; 010-820-618-090-877; 011-267-765-057-247; 011-500-814-837-046; 012-012-628-153-840; 012-166-697-446-593; 012-379-481-142-936; 012-792-203-388-855; 012-861-543-636-057; 013-159-636-157-115; 013-400-732-959-060; 013-627-109-638-528; 013-812-264-839-914; 014-055-753-952-513; 014-489-653-535-438; 014-495-687-642-689; 015-061-632-604-763; 015-067-731-835-441; 015-721-478-129-933; 015-924-347-754-501; 016-257-374-725-378; 016-596-303-676-720; 016-903-628-962-634; 016-924-086-417-174; 016-982-819-401-053; 017-095-319-147-234; 017-762-433-442-487; 017-948-386-173-16X; 018-996-153-835-583; 019-059-725-496-362; 019-669-005-391-835; 019-678-783-924-057; 020-040-207-013-506; 020-433-629-168-804; 021-137-311-125-441; 021-161-149-128-539; 021-575-688-452-768; 021-744-123-659-491; 021-749-981-725-611; 022-517-336-224-017; 022-541-051-551-663; 023-176-075-620-110; 023-232-171-651-041; 023-403-835-183-548; 023-425-261-950-521; 023-482-817-956-576; 024-057-479-945-16X; 024-161-612-739-972; 024-283-306-327-764; 024-722-363-058-574; 024-853-284-101-95X; 024-988-626-413-805; 025-702-757-142-46X; 026-734-392-655-133; 027-282-239-473-087; 027-322-682-374-976; 027-325-429-657-132; 027-988-733-914-882; 028-440-488-989-831; 028-598-925-952-958; 028-905-554-146-312; 028-951-878-107-27X; 029-001-230-359-869; 029-602-025-693-992; 029-708-098-162-485; 029-860-664-307-535; 030-444-829-015-163; 030-602-008-282-927; 031-137-889-221-088; 031-351-493-243-210; 032-232-153-982-919; 032-267-287-896-741; 032-303-359-284-513; 032-411-104-190-804; 032-448-147-278-08X; 032-680-261-996-241; 032-754-398-038-801; 033-063-946-251-018; 033-490-001-191-083; 034-262-717-412-509; 034-490-871-183-729; 034-774-908-758-915; 035-839-759-359-830; 036-686-102-287-07X; 036-946-002-689-66X; 037-146-716-294-847; 037-315-718-839-796; 037-878-776-708-46X; 037-968-519-332-181; 040-896-656-707-021; 041-137-963-158-64X; 041-291-263-704-422; 042-251-157-585-319; 042-467-293-991-461; 043-091-802-426-588; 043-199-024-934-475; 043-696-595-178-578; 043-897-594-781-595; 044-052-981-562-562; 045-004-084-349-77X; 045-833-472-644-656; 046-098-295-846-131; 046-299-341-482-756; 046-624-833-541-771; 046-679-984-819-994; 046-739-502-192-634; 047-261-657-621-225; 047-698-272-025-344; 048-269-478-308-340; 049-859-781-981-796; 050-202-305-642-717; 050-665-732-459-010; 051-392-271-982-524; 051-636-076-796-644; 052-492-416-493-17X; 052-639-287-937-339; 052-768-658-963-423; 053-094-537-530-97X; 053-195-498-510-61X; 054-665-974-499-811; 055-166-323-308-532; 055-493-629-175-240; 055-783-761-748-398; 055-955-906-861-681; 055-966-120-524-003; 056-387-652-940-331; 056-498-250-305-572; 056-548-192-440-33X; 057-111-381-261-511; 057-265-125-341-362; 058-609-181-676-258; 059-112-984-491-161; 059-149-073-001-124; 059-375-218-314-363; 059-506-522-337-196; 059-713-738-707-098; 060-532-780-538-841; 060-589-003-774-062; 060-700-219-106-488; 061-154-187-991-179; 061-380-298-103-280; 061-934-062-150-840; 062-272-333-057-821; 062-811-213-356-341; 063-609-899-131-047; 063-808-326-213-872; 064-248-499-216-952; 064-513-280-377-422; 064-877-835-071-281; 065-167-885-594-646; 065-262-076-160-261; 065-383-095-751-244; 067-019-173-937-24X; 067-356-125-885-980; 067-938-733-422-058; 068-406-807-069-189; 068-408-865-262-55X; 068-580-763-529-676; 069-887-562-300-851; 069-938-097-057-709; 070-076-254-314-465; 070-304-702-307-253; 070-822-333-963-182; 071-045-639-623-562; 071-569-723-602-593; 071-763-714-873-323; 072-200-047-576-049; 072-746-489-380-451; 072-789-058-517-049; 073-316-124-031-140; 074-281-672-794-500; 074-826-965-780-476; 075-088-338-982-188; 075-478-619-046-867; 075-697-384-903-202; 075-953-402-614-675; 076-525-940-202-104; 076-950-681-527-39X; 077-791-553-241-62X; 077-945-517-360-807; 078-485-016-633-151; 079-411-433-021-062; 079-499-999-961-968; 080-536-084-931-109; 081-098-136-479-476; 081-212-649-251-465; 081-732-393-825-478; 081-818-364-245-746; 082-126-283-391-265; 082-500-694-367-363; 082-665-990-200-23X; 083-008-726-760-621; 083-644-597-950-935; 083-925-493-192-800; 084-222-587-456-008; 085-287-497-018-702; 086-574-303-424-904; 086-737-539-346-221; 088-327-408-864-900; 089-003-870-216-351; 089-217-673-912-175; 090-317-670-162-245; 090-982-003-454-842; 091-307-072-889-783; 093-334-077-003-773; 094-045-492-552-388; 094-227-582-169-371; 094-574-426-854-373; 095-968-009-750-432; 096-100-836-611-33X; 098-723-697-675-061; 098-991-416-158-254; 099-062-206-124-793; 101-172-140-650-906; 104-820-002-124-096; 104-881-716-233-015; 105-585-177-238-967; 105-809-470-472-613; 106-544-781-780-731; 107-805-387-430-222; 107-866-210-883-989; 108-338-842-842-410; 108-983-051-822-87X; 109-128-157-135-065; 110-911-742-536-337; 112-930-112-870-193; 113-015-575-192-437; 113-023-440-448-626; 113-457-323-777-234; 113-551-064-593-967; 114-982-753-614-437; 115-109-992-497-717; 115-790-662-505-198; 116-251-941-456-812; 116-539-448-592-696; 118-172-724-710-295; 118-349-105-865-985; 121-707-574-802-675; 122-541-561-909-421; 122-949-274-471-913; 123-401-770-237-774; 123-498-859-171-509; 124-640-318-087-049; 126-394-290-103-060; 127-346-117-177-533; 131-358-763-878-177; 131-581-010-479-763; 134-348-923-238-305; 135-507-157-586-424; 138-798-342-779-166; 140-209-378-445-057; 141-694-501-836-001; 144-581-091-027-620; 144-750-922-243-346; 145-733-967-445-461; 147-775-025-034-683; 149-086-834-345-683; 150-044-529-459-393; 150-939-431-794-908; 151-374-013-752-001; 152-295-868-905-107; 152-995-569-802-164; 153-927-975-823-632; 154-008-656-715-051; 154-399-282-361-201; 155-903-778-941-337; 156-771-427-171-873; 156-936-423-023-606; 157-272-065-344-190; 158-341-109-425-332; 158-484-204-312-684; 158-486-413-465-133; 160-417-118-901-396; 162-894-975-460-905; 166-751-001-203-14X; 167-573-919-118-202; 168-410-586-561-416; 168-410-833-778-488; 170-576-101-402-84X; 171-123-508-975-96X; 172-016-641-055-700; 177-659-155-024-731; 177-796-513-173-835; 178-095-834-975-657; 179-985-465-003-537; 181-783-903-001-336; 183-318-624-189-187; 184-841-678-171-700; 185-816-044-462-479; 186-174-587-829-809; 186-881-143-721-488; 191-711-075-819-123; 194-110-678-151-770; 197-233-699-031-590,115,true,cc-by,gold
072-466-714-198-765,Exploring the Vulnerabilities of Machine Learning and Quantum Machine Learning to Adversarial Attacks using a Malware Dataset: A Comparative Analysis,2023-05-31,2023,preprint,arXiv (Cornell University),,,,Mst Shapna Akter; Hossain Shahriar; Iysa Iqbal; MD Hossain; M. A. Karim; Victor Clincy; Razvan Voicu,"The burgeoning fields of machine learning (ML) and quantum machine learning (QML) have shown remarkable potential in tackling complex problems across various domains. However, their susceptibility to adversarial attacks raises concerns when deploying these systems in security sensitive applications. In this study, we present a comparative analysis of the vulnerability of ML and QML models, specifically conventional neural networks (NN) and quantum neural networks (QNN), to adversarial attacks using a malware dataset. We utilize a software supply chain attack dataset known as ClaMP and develop two distinct models for QNN and NN, employing Pennylane for quantum implementations and TensorFlow and Keras for traditional implementations. Our methodology involves crafting adversarial samples by introducing random noise to a small portion of the dataset and evaluating the impact on the models performance using accuracy, precision, recall, and F1 score metrics. Based on our observations, both ML and QML models exhibit vulnerability to adversarial attacks. While the QNNs accuracy decreases more significantly compared to the NN after the attack, it demonstrates better performance in terms of precision and recall, indicating higher resilience in detecting true positives under adversarial conditions. We also find that adversarial samples crafted for one model type can impair the performance of the other, highlighting the need for robust defense mechanisms. Our study serves as a foundation for future research focused on enhancing the security and resilience of ML and QML models, particularly QNN, given its recent advancements. A more extensive range of experiments will be conducted to better understand the performance and robustness of both models in the face of adversarial attacks.",,,,,Computer science; Adversarial system; Artificial intelligence; Implementation; Machine learning; Robustness (evolution); Malware; Deep learning; Vulnerability (computing); Resilience (materials science); Artificial neural network; False positive paradox; Software; Computer security; Software engineering; Programming language; Chemistry; Physics; Gene; Biochemistry; Thermodynamics,,,,,https://arxiv.org/abs/2305.19593,http://dx.doi.org/10.48550/arxiv.2305.19593,,10.48550/arxiv.2305.19593,,,0,,0,true,cc-by,green
075-834-477-016-15X,"Big data in healthcare: management, analysis and future prospects",2019-06-19,2019,journal article,Journal of Big Data,21961115,Springer Science and Business Media LLC,United Kingdom,Sabyasachi Dash; Sushil Kumar Shakyawar; Mohit Sharma; Sandeep Kaushik,"‘Big data’ is massive amounts of information that can work wonders. It has become a topic of special interest for the past two decades because of a great potential that is hidden in it. Various public and private sector industries generate, store, and analyze big data with an aim to improve the services they provide. In the healthcare industry, various sources for big data include hospital records, medical records of patients, results of medical examinations, and devices that are a part of internet of things. Biomedical research also generates a significant portion of big data relevant to public healthcare. This data requires proper management and analysis in order to derive meaningful information. Otherwise, seeking solution by analyzing big data quickly becomes comparable to finding a needle in the haystack. There are various challenges associated with each step of handling big data which can only be surpassed by using high-end computing solutions for big data analysis. That is why, to provide relevant solutions for improving public health, healthcare providers are required to be fully equipped with appropriate infrastructure to systematically generate and analyze big data. An efficient management, analysis, and interpretation of big data can change the game by opening new avenues for modern healthcare. That is exactly why various industries, including the healthcare industry, are taking vigorous steps to convert this potential into better services and financial advantages. With a strong integration of biomedical and healthcare data, modern healthcare organizations can possibly revolutionize the medical therapies and personalized medicine.",6,1,1,25,Private sector; Special Interest Group; Haystack; Health administration; Health care; Work (electrical); Order (exchange); Data science; Computer science; Big data,Healthcare; Biomedical research; Big data analytics; Internet of things; Personalized medicine; Quantum computing,,,,https://doi.org/10.1186%2Fs40537-019-0217-0 http://repositorium.sdum.uminho.pt/handle/1822/60775 https://journalofbigdata.springeropen.com/articles/10.1186/s40537-019-0217-0 https://dblp.uni-trier.de/db/journals/jbd/jbd6.html#DashSSK19 https://link.springer.com/content/pdf/10.1186/s40537-019-0217-0.pdf https://repositorium.sdum.uminho.pt/bitstream/1822/60775/1/document_51785_1.pdf https://doaj.org/article/80aa3f4842db4cbab51d8aa8568a29d1 https://www.mendeley.com/catalogue/18e08896-acb5-3bab-b90d-03937997ceff/ https://link.springer.com/article/10.1186/s40537-019-0217-0,http://dx.doi.org/10.1186/s40537-019-0217-0,,10.1186/s40537-019-0217-0,2951635356,,3,000-734-986-042-568; 007-017-542-903-972; 008-124-206-643-913; 012-593-613-502-276; 013-661-734-491-647; 019-074-104-738-862; 019-777-570-145-571; 022-254-617-460-719; 022-529-996-450-667; 023-723-970-807-897; 024-405-567-347-870; 025-335-467-875-524; 027-786-919-783-58X; 027-817-643-212-688; 030-175-448-682-955; 030-761-004-980-224; 033-564-024-255-851; 034-718-083-957-728; 037-393-845-762-916; 038-138-561-292-244; 041-071-425-754-509; 045-864-979-817-79X; 052-812-909-562-639; 056-630-844-182-587; 061-033-869-892-660; 066-734-917-515-733; 067-143-751-739-367; 067-554-756-330-276; 069-646-300-100-860; 069-714-583-517-261; 087-446-197-113-968; 093-497-076-621-47X; 118-977-651-731-754; 122-175-583-541-421; 122-303-442-871-279; 124-956-907-404-20X; 130-490-453-154-618; 137-292-579-653-532; 137-586-336-320-745; 147-378-220-829-095; 153-753-714-494-095; 154-530-303-370-766; 155-325-256-828-212; 164-029-481-873-503; 171-844-304-804-448; 186-265-523-687-155,1329,true,"CC BY, CC BY-NC-ND",gold
079-850-833-120-582,Quantum technology for military applications,2021-11-06,2021,journal article,EPJ Quantum Technology,26624400; 21960763,Springer Science and Business Media LLC,,Michal Krelina,"Quantum technology is an emergent and potentially disruptive discipline, with the ability to affect many human activities. Quantum technologies are dual-use technologies, and as such are of interest to the defence and security industry and military and governmental actors. This report reviews and maps the possible quantum technology military applications, serving as an entry point for international peace and security assessment, ethics research, military and governmental policy, strategy and decision making. Quantum technologies for military applications introduce new capabilities, improving effectiveness and increasing precision, thus leading to ‘quantum warfare’, wherein new military strategies, doctrines, policies and ethics should be established. This report provides a basic overview of quantum technologies under development, also estimating the expected time scale of delivery or the utilisation impact. Particular military applications of quantum technology are described for various warfare domains (e.g. land, air, space, electronic, cyber and underwater warfare and ISTAR—intelligence, surveillance, target acquisition and reconnaissance), and related issues and challenges are articulated.",8,1,24,,Engineering; Research ethics; Quantum network; Quantum technology; Quantum imaging; Quantum radar; Dual-use technology; Computer security; Quantum computer; Quantum sensor,Quantum warfare; Quantum technology; Quantum computing; Quantum sensing; Quantum network; Quantum radar; Quantum imaging; Military applications; Quantum security; Dual-use technology,,,,https://epjqt.epj.org/articles/epjqt/abs/2021/01/40507_2021_Article_113/40507_2021_Article_113.html https://dspace.cvut.cz/handle/10467/98541 https://epjquantumtechnology.springeropen.com/articles/10.1140/epjqt/s40507-021-00113-y,http://dx.doi.org/10.1140/epjqt/s40507-021-00113-y,,10.1140/epjqt/s40507-021-00113-y,3211557186,,1,000-256-991-056-514; 000-573-377-570-205; 000-594-838-228-828; 000-701-698-278-321; 001-171-952-487-788; 001-575-536-461-82X; 002-191-739-916-04X; 002-820-573-199-27X; 003-331-295-195-779; 004-503-667-406-35X; 004-526-432-993-117; 005-256-259-443-451; 005-308-793-418-450; 005-464-843-145-986; 005-711-543-665-969; 006-426-946-966-532; 006-461-257-402-583; 006-718-080-947-81X; 007-561-517-550-190; 007-576-350-879-841; 007-652-637-682-642; 007-946-766-568-399; 008-468-343-915-662; 008-655-419-340-978; 008-672-841-703-118; 009-483-983-217-338; 009-641-701-719-876; 010-503-112-944-135; 010-822-333-317-694; 011-184-745-243-057; 011-237-102-230-224; 011-494-552-742-996; 011-670-904-414-604; 012-622-168-666-028; 012-628-917-012-214; 012-828-020-596-952; 013-194-563-319-294; 013-237-679-440-624; 013-241-129-340-719; 013-274-746-775-284; 013-838-276-074-862; 013-996-297-125-191; 014-005-608-022-509; 014-947-212-798-932; 015-143-455-963-309; 015-432-016-884-255; 015-462-628-133-783; 015-764-810-736-728; 015-765-044-177-852; 016-802-606-325-164; 016-870-981-117-783; 017-055-386-865-563; 017-055-466-070-55X; 017-188-994-683-180; 017-506-809-548-747; 017-645-822-447-721; 018-768-878-260-380; 021-353-480-190-208; 021-636-198-841-468; 022-252-552-303-683; 022-378-102-235-568; 023-789-927-339-145; 023-952-992-938-600; 024-369-901-838-873; 024-403-788-719-122; 024-785-122-936-194; 025-146-054-055-322; 025-561-143-144-640; 026-792-354-949-814; 027-120-114-407-666; 029-542-939-715-834; 030-522-438-718-137; 030-589-504-330-533; 031-081-952-042-307; 031-167-711-976-819; 031-802-490-708-588; 032-479-722-236-698; 032-879-282-531-038; 033-463-047-802-288; 033-601-579-822-696; 034-141-045-288-486; 034-610-176-682-327; 035-115-874-518-039; 035-188-577-940-118; 035-355-490-369-962; 035-441-171-936-991; 035-594-470-003-70X; 035-601-619-826-513; 035-622-865-709-390; 035-762-388-486-546; 036-528-168-189-284; 037-233-096-986-281; 037-492-463-071-339; 038-268-643-571-509; 039-209-268-217-44X; 039-529-594-735-245; 039-749-215-482-829; 039-906-266-603-631; 042-016-276-583-324; 042-403-238-102-534; 042-414-470-279-928; 043-379-840-856-805; 043-450-472-512-900; 044-266-531-024-023; 044-863-100-830-627; 045-075-685-414-82X; 045-256-457-376-561; 045-425-270-443-255; 045-706-121-986-337; 045-771-309-338-965; 045-804-672-684-377; 046-119-785-406-470; 046-349-876-792-147; 047-038-451-880-035; 047-540-661-691-471; 048-298-047-889-49X; 048-553-966-196-446; 049-415-190-582-403; 051-340-336-101-587; 051-752-726-850-402; 051-778-430-026-671; 054-797-802-044-479; 054-867-305-449-935; 055-051-943-116-574; 055-068-616-597-391; 055-336-350-781-99X; 055-385-178-502-848; 055-884-243-020-754; 056-195-577-854-583; 056-888-350-772-980; 057-306-284-745-418; 057-965-243-937-21X; 058-418-193-248-398; 058-957-864-593-25X; 059-868-357-195-929; 061-183-422-827-655; 061-577-746-765-94X; 063-563-230-603-208; 066-888-004-222-006; 067-400-704-427-103; 067-793-290-649-354; 068-108-396-184-370; 068-123-062-164-64X; 068-230-523-544-885; 070-800-253-737-727; 070-838-553-463-40X; 072-164-697-064-015; 072-656-099-476-889; 072-782-340-414-797; 073-102-687-538-742; 073-302-342-161-499; 074-076-924-473-736; 076-236-478-980-158; 076-928-198-193-229; 077-651-832-433-988; 078-102-890-744-076; 078-579-617-399-636; 078-858-371-344-273; 079-794-668-307-074; 080-073-761-478-885; 081-591-815-045-118; 083-046-984-467-396; 083-091-650-045-68X; 084-578-233-613-86X; 084-710-456-064-525; 084-871-868-938-88X; 085-775-593-144-760; 086-959-198-192-335; 087-440-945-756-09X; 088-152-533-373-519; 089-260-635-395-799; 091-240-804-917-900; 091-379-175-531-939; 091-452-244-485-04X; 092-804-757-669-840; 092-931-304-382-419; 093-211-598-564-234; 093-811-824-187-377; 095-024-338-859-297; 095-799-702-095-902; 096-320-053-330-536; 096-833-595-183-116; 097-458-656-734-327; 097-476-890-487-140; 097-533-331-589-886; 099-847-535-104-873; 100-177-524-556-536; 100-782-142-164-735; 101-040-669-997-198; 102-590-277-398-789; 103-393-898-370-096; 104-746-444-035-557; 106-899-070-512-223; 108-477-522-547-455; 109-668-519-553-799; 109-850-246-547-342; 110-651-560-625-138; 112-134-741-262-29X; 112-538-407-865-58X; 112-797-098-546-281; 113-636-944-557-676; 114-581-606-822-167; 117-158-497-005-90X; 117-475-341-081-737; 118-922-729-024-657; 122-666-175-857-095; 123-319-235-692-799; 123-636-516-417-426; 124-776-060-850-029; 127-584-728-208-523; 128-270-622-740-671; 130-341-777-403-511; 131-878-683-481-101; 131-909-732-973-620; 134-194-977-298-750; 134-589-047-401-420; 138-827-614-058-822; 138-974-232-441-738; 141-628-767-995-872; 142-170-584-435-340; 147-026-593-452-789; 147-931-547-138-051; 153-862-524-979-123; 154-546-919-567-758; 155-175-573-896-699; 155-617-591-310-853; 156-703-619-190-96X; 162-831-393-506-565; 165-016-119-449-308; 176-395-712-797-962; 179-386-420-045-413; 190-073-906-005-842; 194-260-781-427-708,113,true,"CC BY, CC BY-NC-ND",gold
