Lens ID,Title,Date Published,Publication Year,Publication Type,Source Title,ISSNs,Publisher,Source Country,Author/s,Abstract,Volume,Issue Number,Start Page,End Page,Fields of Study,Keywords,MeSH Terms,Chemicals,Funding,Source URLs,External URL,PMID,DOI,Microsoft Academic ID,PMCID,Citing Patents Count,References,Citing Works Count,Is Open Access,Open Access License,Open Access Colour
126-104-828-417-902,"Towards the Smart Circular Economy Paradigm: A Definition, Conceptualization, and Research Agenda",2022-04-20,2022,journal article,Sustainability,20711050,MDPI AG,Switzerland,Gianmarco Bressanelli; Federico Adrodegari; Daniela C. A. Pigosso; Vinit Parida,"<jats:p>The digital age we live in offers companies many opportunities to jointly advance sustainability and competitiveness. New digital technologies can, in fact, support the incorporation of circular economy principles into businesses, enabling new business models and facilitating the redesign of products and value chains. Despite this considerable potential, the convergence between the circular economy and these technologies is still underinvestigated. By reviewing the literature, this paper aims to provide a definition and a conceptual framework, which systematize the smart circular economy paradigm as an industrial system that uses digital technologies during the product life-cycle phases to implement circular strategies and practices aimed at value creation. Following this conceptualization, the classical, underlying circular economy principle, ‘waste equals food’, is reshaped into an equation more fitting for the digital age—that is to say, ‘waste + data = resource’. Lastly, this paper provides promising research directions to further develop this field. To advance knowledge on the smart circular economy paradigm, researchers and practitioners are advised to: (i) develop research from exploratory and descriptive to confirmatory and prescriptive purposes, relying on a wide spectrum of research methodologies; (ii) move the focus from single organizations to the entire ecosystem and value chain of stakeholders; (iii) combine different enabling digital technologies to leverage their synergistic potential; and (iv) assess the environmental impact of digital technologies to prevent potential rebound effects.</jats:p>",14,9,4960,4960,Circular economy; Conceptualization; Digital economy; Leverage (statistics); Sustainability; Business model; Knowledge management; Business; Marketing; Computer science; Machine learning; Ecology; World Wide Web; Biology; Artificial intelligence,circular economy; digitalization; industry 4.0; literature review; business models; sustainability,,,The Research Council of Norway; Formas; Swedish Energy Agency,https://www.mdpi.com/2071-1050/14/9/4960/pdf?version=1650521889 https://doi.org/10.3390/su14094960,http://dx.doi.org/10.3390/su14094960,,10.3390/su14094960,,,0,001-546-988-608-033; 005-923-985-815-340; 008-092-872-335-265; 009-714-635-830-692; 012-711-719-412-484; 014-895-661-160-254; 018-996-103-248-663; 020-581-472-422-02X; 023-551-656-771-71X; 025-168-011-385-919; 028-827-563-101-051; 030-696-044-917-387; 031-865-492-142-088; 032-333-029-070-130; 034-328-673-210-751; 037-838-232-065-99X; 037-940-845-538-666; 039-933-235-957-246; 041-517-238-144-426; 044-442-988-820-425; 048-872-880-871-621; 052-234-185-277-119; 054-550-126-577-522; 055-440-355-374-103; 055-824-854-848-687; 057-064-738-775-509; 058-230-056-733-050; 058-692-073-081-206; 060-555-630-845-805; 065-708-535-813-094; 069-444-616-515-872; 070-047-008-873-090; 070-694-964-750-489; 072-102-632-250-972; 073-280-360-624-544; 075-237-093-063-242; 076-303-271-715-610; 079-928-195-279-966; 083-540-564-259-682; 083-802-371-447-588; 085-039-487-580-977; 087-250-869-796-948; 087-800-300-867-59X; 089-476-021-281-458; 093-713-982-180-235; 095-684-849-672-479; 096-150-451-983-840; 097-989-897-134-608; 099-676-003-852-658; 107-553-368-208-791; 108-478-101-879-616; 109-080-300-124-642; 115-036-954-585-201; 116-271-301-330-697; 117-565-282-854-064; 124-006-582-410-441; 125-114-573-179-078; 129-461-000-946-008; 133-255-951-610-048; 143-498-557-538-825; 147-205-562-995-709; 149-269-099-266-71X; 156-181-115-278-436; 157-505-867-811-939; 160-771-916-898-197; 160-882-307-196-677; 172-360-293-248-575; 187-510-610-165-630,110,true,cc-by,gold
126-531-607-356-807,Energy Oriented Concepts and Other SMART WORLD Trends as Game Changers of Co-Production—Reality or Future?,2022-06-03,2022,journal article,Energies,19961073,MDPI AG,Switzerland,Anna Adamik; Michał Nowicki; Andrius Puksas,"<jats:p>The aim of the study is to identify, map and assess the maturity and impact level of the specific energy-oriented economy and other SMART management concepts and social, technological, finance (economical), environmental, and communication (S.T.F.E.C.) trends which arose from the dynamic development and spread of the Industry 4.0 revolution on processes of effective competitiveness and the creation of modern enterprises. The article presents data and information obtained thanks to an in-depth review of the literature (extensive desk research), as well as that obtained as part of the conducted CAWI pilot study. The authors aim to search for answers to three specific research questions, concluding that recently, special attention is paid to such issues as co-creation and co-production, energy-oriented and circular economy, eco-energy, and sustainability. The findings of this study clearly show that in the SMART WORLD era, there is a growing interest in cooperation, co-creation, co-production issues, and usage of modern technologies and SMART management concepts typical of the Industry 4.0 era. The main reason for this is that enterprises strive to optimize and maximize their efficiency in the processes of competitiveness creation. Researched data allows us to conclude that openness to social, environmental, and technological trends and issues, with an approach based on sustainable and eco-energy-oriented development, play an increasingly important role. However, the level of their importance, implementation level, and maturity differ depending on the type of organization or industry. For example, service and trade companies more often than production companies use and rate the usefulness of social trends higher (reality = mainstream orientation for S&amp;T companies and a future orientation for production companies), while production companies apply a more balanced approach, showing greater commitment to economic technological, environmental and financial trends (reality = mainstream orientation for production companies and a future orientation for trade and services companies). Given that the study shows and describes preliminary research results (pilot studies), the authors plan to undertake further efforts in the in-depth scientific exploration of the issues concerned, including, which is particularly important, conducting full-scale research.</jats:p>",15,11,4112,4112,Maturity (psychological); Sustainability; Openness to experience; Production (economics); Business; Circular economy; Industry 4.0; Service (business); Environmental economics; Marketing; Economics; Engineering; Political science; Law; Ecology; Social psychology; Biology; Macroeconomics; Psychology; Embedded system,Adamik  A.; Nowicki  M.; Puksas  A. Energy Oriented Concepts energy-oriented economy; SMART management concepts and trends; Industry 4.0; co-creation; co-production; sustainability; competitiveness,,,,https://www.mdpi.com/1996-1073/15/11/4112/pdf?version=1654410939 https://doi.org/10.3390/en15114112,http://dx.doi.org/10.3390/en15114112,,10.3390/en15114112,,,0,000-337-881-589-920; 001-012-328-807-129; 001-176-949-317-166; 001-253-077-127-109; 004-411-027-676-759; 005-980-029-960-100; 007-522-330-782-926; 008-092-872-335-265; 009-146-056-724-526; 010-035-872-690-671; 011-025-043-884-126; 012-215-326-533-311; 013-404-821-714-813; 014-563-199-723-035; 016-666-344-670-051; 018-665-487-222-000; 019-373-212-232-893; 019-626-907-213-077; 020-856-922-231-926; 022-003-921-364-768; 022-713-144-061-442; 023-964-864-644-120; 024-138-660-110-436; 024-460-585-257-125; 024-920-582-562-188; 025-111-295-042-100; 027-682-558-172-305; 028-015-065-553-289; 028-028-892-088-002; 028-782-255-031-323; 029-114-794-449-270; 029-617-287-752-261; 030-629-968-184-152; 031-235-778-832-782; 031-275-639-663-356; 031-734-786-091-933; 032-113-742-538-611; 032-826-376-400-929; 033-129-826-897-980; 033-370-108-700-101; 034-013-116-573-959; 034-640-825-009-341; 035-546-565-325-481; 035-679-565-460-391; 035-864-096-956-304; 036-601-600-371-463; 039-185-048-065-145; 039-811-044-705-489; 040-778-348-220-273; 041-437-717-635-476; 041-950-002-747-236; 042-301-500-263-783; 043-591-936-980-93X; 044-292-715-122-487; 046-953-061-337-689; 048-296-900-110-633; 048-792-616-397-035; 049-303-457-250-349; 050-089-676-804-867; 050-317-784-182-200; 050-427-248-113-305; 050-524-853-208-104; 052-445-419-373-710; 052-774-150-404-912; 052-975-240-408-918; 053-182-444-809-146; 053-831-220-519-446; 055-272-736-924-578; 055-330-617-269-446; 056-549-681-921-315; 056-676-810-255-673; 057-182-468-997-853; 057-214-042-880-707; 058-120-012-252-477; 058-306-800-719-811; 060-317-465-188-456; 060-699-927-237-790; 061-612-787-395-173; 062-440-631-435-595; 062-599-869-638-493; 063-449-682-371-402; 064-907-481-786-857; 066-181-830-062-455; 068-253-847-007-674; 072-102-632-250-972; 072-678-386-211-91X; 073-151-197-627-25X; 074-008-673-725-26X; 074-911-812-225-259; 075-553-124-852-24X; 078-313-359-890-706; 078-407-023-029-477; 079-224-211-261-69X; 081-365-052-727-317; 082-093-169-349-743; 082-139-121-064-651; 082-140-051-993-161; 082-472-554-456-107; 082-576-491-804-106; 084-249-962-919-116; 084-301-138-358-854; 085-314-492-915-19X; 086-035-228-781-182; 086-057-800-072-502; 087-019-900-120-785; 087-798-939-569-382; 089-251-649-481-300; 090-218-470-242-562; 098-535-088-426-416; 099-525-058-823-266; 100-891-688-805-138; 102-861-736-374-631; 107-058-100-491-903; 107-356-710-637-186; 112-846-039-500-740; 113-107-454-885-18X; 113-830-545-572-413; 119-537-499-451-316; 121-656-341-912-091; 122-199-851-225-983; 130-419-256-137-411; 132-272-310-221-833; 133-731-560-527-313; 134-540-444-052-888; 138-380-710-778-645; 139-759-040-963-94X; 141-386-217-172-573; 145-217-077-032-066; 149-059-412-278-405; 149-287-650-946-530; 151-494-345-090-215; 152-088-293-235-066; 154-602-705-758-35X; 156-183-562-934-30X; 156-412-419-149-372; 169-692-053-059-508; 170-783-607-461-70X; 180-603-051-924-714,10,true,cc-by,gold
135-515-782-173-107,Tides of Blockchain in IoT Cybersecurity.,2024-05-14,2024,journal article,"Sensors (Basel, Switzerland)",14248220; 14243210,Multidisciplinary Digital Publishing Institute (MDPI),Switzerland,Love Allen Chijioke Ahakonye; Cosmas Ifeanyi Nwakanma; Dong-Seong Kim,"This paper surveys the implementation of blockchain technology in cybersecurity in Internet of Things (IoT) networks, presenting a comprehensive framework that integrates blockchain technology with intrusion detection systems (IDS) to enhance IDS performance. This paper reviews articles from various domains, including AI, blockchain, IDS, IoT, and Industrial IoT (IIoT), to identify emerging trends and challenges in this field. An analysis of various approaches incorporating AI and blockchain demonstrates the potentiality of integrating AI and blockchain to transform IDS. This paper's structure establishes the foundation for further investigation and provides a blueprint for the development of IDS that is accessible, scalable, transparent, immutable, and decentralized. A demonstration from case studies integrating AI and blockchain shows the viability of combining the duo to enhance performance. Despite the challenges posed by resource constraints and privacy concerns, it is notable that blockchain is the key to securing IoT networks and that continued innovation in this area is necessary. Further research into lightweight cryptography, efficient consensus mechanisms, and privacy-preserving techniques is needed to realize all of the potential of blockchain-powered cybersecurity in IoT.",24,10,3111,3111,Blockchain; Computer science; Scalability; Internet of Things; Computer security; Blueprint; Intrusion detection system; Field (mathematics); Key (lock); Cryptography; Engineering; Database; Mathematics; Pure mathematics; Mechanical engineering,BaaS; IoT; blockchain; intrusion detection; security; smart contracts,,,"Korea government (MSIT); Korea government (MSIT); Ministry of Education, Science and Technology; Ministry of Education, Science and Technology",https://www.mdpi.com/1424-8220/24/10/3111/pdf?version=1715678965 https://doi.org/10.3390/s24103111 https://pmc.ncbi.nlm.nih.gov/articles/PMC11124985/pdf/sensors-24-03111.pdf https://www.ncbi.nlm.nih.gov/pmc/articles/11124985,http://dx.doi.org/10.3390/s24103111,38793962,10.3390/s24103111,,PMC11124985,0,000-134-697-698-297; 001-496-884-935-117; 001-561-372-119-667; 003-481-343-621-909; 005-928-380-611-698; 009-746-077-355-001; 010-389-501-475-049; 010-398-351-366-932; 012-661-407-428-96X; 013-185-357-772-19X; 013-541-969-076-695; 017-384-703-538-10X; 017-557-495-440-679; 017-920-101-429-391; 018-541-770-775-407; 020-608-398-164-364; 020-950-009-680-431; 022-338-684-752-242; 022-924-924-705-181; 023-717-667-370-687; 026-909-983-562-694; 028-181-544-355-582; 028-288-766-123-517; 028-729-853-376-126; 031-501-469-850-476; 031-617-340-029-606; 033-308-513-271-964; 035-854-491-687-045; 039-420-403-957-058; 042-624-883-629-143; 044-006-485-680-650; 044-013-694-831-115; 044-449-815-514-755; 049-951-033-983-640; 052-158-968-311-086; 055-910-552-965-344; 060-345-256-979-997; 061-361-066-081-461; 061-460-125-016-568; 061-521-960-838-06X; 062-081-654-953-705; 062-176-327-706-274; 062-803-685-386-506; 065-395-818-630-920; 065-486-663-704-959; 065-809-285-278-668; 065-868-539-989-452; 066-898-865-609-287; 067-381-549-853-311; 070-476-628-070-075; 072-600-323-549-198; 073-739-435-228-906; 077-260-830-890-183; 078-526-060-435-652; 084-868-202-172-358; 087-947-567-283-995; 089-795-214-363-028; 105-875-035-276-285; 107-180-614-818-378; 107-242-593-339-837; 107-391-906-810-730; 107-963-037-057-53X; 109-157-022-233-656; 109-739-986-940-70X; 110-339-970-316-622; 110-718-083-267-385; 111-084-634-675-524; 115-945-734-037-033; 117-798-204-241-278; 121-550-819-768-936; 122-682-468-170-924; 123-069-224-976-586; 123-913-107-770-205; 124-438-324-862-25X; 125-506-858-788-822; 130-057-547-194-322; 131-725-080-046-007; 134-080-876-954-100; 137-726-812-502-454; 140-092-065-449-632; 141-423-342-517-497; 145-173-885-701-174; 148-522-449-584-807; 149-052-308-914-748; 150-460-349-077-50X; 161-094-158-894-453; 168-901-406-786-965; 171-903-883-796-653; 185-760-039-599-85X; 186-451-011-720-010; 195-166-973-859-463,49,true,cc-by,gold
137-620-264-746-427,Mentor's Musings on Disruptive Technologies and Standards Interplay in Industrial Transformation,,2022,journal article,IEEE Internet of Things Magazine,25763180; 25763199,Institute of Electrical and Electronics Engineers (IEEE),,N. Kishor Narang,"IoT Standards will look at different segments of the IoT market as it relates to implementation and use of standards. Each column will select a particular vertical, and lay out the relevant standards and technologies that affect the evolving IoT hyperspace. The pace of the columns will start broadly with the vision of narrowing the subject of subsequent articles toward more specific applications of standards, whether in the development, application, test, or commissioning of IoT technologies.",5,1,4,12,Pace; Internet of Things; Hyperspace; Column (typography); Emerging technologies; Computer science; Telecommunications; Engineering; Data science; Computer security; Artificial intelligence; Frame (networking); Geography; Geodesy,,,,,https://ieeexplore.ieee.org/ielx7/8548628/9773082/09773142.pdf https://doi.org/10.1109/miot.2022.9773142,http://dx.doi.org/10.1109/miot.2022.9773142,,10.1109/miot.2022.9773142,,,0,,3,true,,bronze
138-426-055-614-687,Earth Grid: Toward a low-carbon energy infrastructure.,2025-10-03,2025,journal article,iScience,25890042,Elsevier BV,United States,Abhishek Kumar; Xiangning He; Yan Deng; Bikash Sah; Arvind R Singh; Praveen Kumar; R C Bansal; James L Kirtley,"With fossil fuels as a major global energy source and their associated carbon emissions impacting the climate, there is an urgency in transitioning to carbon-free energy sources (CFESs) such as nuclear and renewables (solar, hydroelectric, and wind). The need for an updated electric power transmission and distribution system arises due to the variable loads and geographic diversity of renewable energy sources. This perspective explores the idea of the ""Earth Grid,"" which proposes an intercontinental electric grid facilitated by three technological advancements: enhanced information and communication technology (ICT) applications in the electric grid, development of inter-country grids for power-sharing, and the application of artificial intelligence (AI) for efficient operation and maintenance. Further, the article discusses the need for a collaborative effort on the global stage to transform the existing electricity generation, transmission, and distribution sector to create a globally interconnected carbon-neutral Earth Grid infrastructure for accelerated carbon-free energy access for all.",28,11,113681,113681,,Earth sciences; Energy management; Energy resources; Energy sustainability; Energy systems,,,National Key Research and Development Program of China; National Research Foundation,,http://dx.doi.org/10.1016/j.isci.2025.113681,41210970,10.1016/j.isci.2025.113681,,PMC12590004,0,000-452-908-115-500; 001-775-876-761-518; 002-918-557-410-122; 003-524-962-957-951; 004-876-273-081-224; 006-162-264-471-261; 008-206-683-143-283; 008-592-122-067-338; 012-356-722-605-427; 012-359-386-019-667; 012-965-495-615-097; 013-923-582-078-155; 015-205-835-544-705; 015-444-569-386-457; 016-588-558-776-600; 016-964-982-830-561; 017-400-217-418-29X; 018-293-872-041-279; 021-949-544-448-907; 023-187-213-831-826; 023-673-671-681-435; 025-284-577-006-269; 025-376-989-317-467; 025-965-342-861-555; 028-015-500-935-231; 031-948-680-557-663; 032-262-145-463-50X; 035-351-188-709-163; 035-635-708-991-639; 039-969-676-473-76X; 042-241-742-671-681; 042-340-133-753-386; 045-237-164-279-342; 047-676-624-097-927; 048-622-057-429-499; 049-951-121-141-46X; 053-816-003-969-066; 056-431-010-777-873; 059-421-533-947-421; 059-631-298-353-708; 062-774-211-153-460; 063-676-382-450-993; 066-837-264-402-679; 067-577-207-147-18X; 067-968-221-852-748; 069-233-376-264-997; 069-822-269-968-53X; 070-529-677-047-767; 073-514-051-601-495; 073-783-666-142-964; 079-806-289-268-517; 080-796-547-039-442; 081-837-203-936-873; 084-971-549-230-655; 086-882-023-768-993; 087-504-760-057-049; 089-487-995-134-564; 090-269-970-121-177; 090-474-168-616-642; 091-163-024-507-752; 091-412-032-875-517; 093-699-520-287-849; 095-901-531-946-028; 102-224-315-391-490; 106-375-528-532-174; 113-296-294-925-431; 126-141-737-445-53X; 128-466-850-994-053; 129-635-074-665-804; 129-717-673-838-112; 131-206-117-846-231; 140-010-265-129-025; 141-552-389-343-907; 149-388-463-448-985; 151-470-998-474-551; 151-654-783-752-768; 159-189-198-801-389; 187-019-032-865-175; 188-741-040-442-038,3,true,"CC BY, CC BY-NC-ND",gold
140-684-505-729-320,Automotive Intelligence Embedded in Electric Connected Autonomous and Shared Vehicles Technology for Sustainable Green Mobility,2021-08-26,2021,journal article,Frontiers in Future Transportation,26735210,Frontiers Media SA,,Ovidiu Vermesan; Reiner John; Patrick Pype; Gerardo Daalderop; Kai Kriegel; Gerhard Mitic; Vincent Lorentz; Roy Bahr; Hans Erik Sand; Steffen Bockrath; Stefan Waldhör,"The automotive sector digitalization accelerates the technology convergence of perception, computing processing, connectivity, propulsion, and data fusion for electric connected autonomous and shared (ECAS) vehicles, bringing new computing paradigms at the edge with embedded cognitive capabilities into the vehicle domains and data infrastructure to provide holistic intrinsic and extrinsic intelligence for new mobility applications. Innovation occurs predominantly in ECAS vehicles' architectures, intelligent functions, operations, and automotive digital infrastructure. Artificial Intelligence (AI), cellular/wireless connectivity, edge computing, Internet of Things (IoT), Internet of Intelligent Things, digital twins (DTs), virtual/augmented reality (VR/AR) and distributed ledger technologies (DLTs) converge to facilitate vehicle-to-vehicle (V2V), vehicle-to-infrastructure (V2I) and vehicle-to-everything (V2X) communication and automation. Expanding automotive intelligence at the vehicle and mobility system level allows the Internet of Vehicles (IoV) and Internet of Energy (IoE) to become the key enabling technologies to realize future autonomous driving scenarios that embed cognition and autonomous functions. Vehicles become intelligent connected edge micro-servers on wheels, powered by software, smart virtual functions and integrated into the digital infrastructure. Electrification, automation, connectivity, digitalization, decarbonization, decentralization, and standardization are the main drivers that unlock intelligent vehicles' potential for sustainable green mobility applications. ECAS vehicles act as autonomous agents using swarm intelligence to communicate and exchange information either directly or indirectly with each other and the infrastructure, accessing independent services such as energy, high-definition maps, routs, infrastructure information, traffic lights, tolls, parking (micropayments) and finding emergent/intelligent solutions. Digitalization is also radically transforming the powertrains in electric vehicles (EVs). For example, in the battery domain, the batteries' architectures are optimizing the cables to the sensors and sensing point. Innovations like smart battery cells assembled in complex battery systems, with wireless communication between the smart cells and the central battery management system (BMS), enable ultra-high-speed interaction with the smart battery cell parameters. The article presents ECAS vehicles' evolution towards domain controller, zonal vehicle, and federated vehicle/edge/cloud-centric based on distributed intelligence at the vehicle and infrastructure level architectures and the role of AI techniques and methods to implement the different autonomous driving and optimization functions for sustainable green mobility.",2,,,,The Internet; Automation; Technological convergence; Distributed computing; Autonomous agent; Augmented reality; Edge computing; Smart Battery; Computer science; Automotive industry,artificial intelligence; electric connected autonomous and shared vehicles; internet of vehicles; edge computing; automotive architectures; swarm intelligence; vehicle-to-everything communication; green mobility,,,,https://www.frontiersin.org/articles/10.3389/ffutr.2021.688482/full,http://dx.doi.org/10.3389/ffutr.2021.688482,,10.3389/ffutr.2021.688482,3197878121,,0,001-800-404-704-955; 005-279-965-190-107; 007-627-728-341-654; 012-040-803-121-327; 015-055-470-506-333; 017-804-253-841-897; 022-594-621-206-909; 024-340-318-994-984; 029-375-529-271-606; 034-073-395-325-185; 039-854-323-458-070; 049-046-680-372-176; 057-780-380-012-570; 060-675-767-707-91X; 061-647-511-857-189; 062-573-995-052-21X; 067-087-761-720-869; 067-146-552-484-828; 081-841-874-808-946; 084-468-139-209-388; 095-965-724-544-853; 104-665-457-912-454; 105-146-903-504-453; 113-661-854-050-34X; 127-188-531-846-383; 130-295-058-177-840; 151-248-699-197-171; 166-006-555-232-639; 172-911-006-316-431; 188-513-352-805-18X; 190-714-153-564-662; 199-441-316-870-311,66,true,cc-by,gold
