Lens ID,Title,Date Published,Publication Year,Publication Type,Source Title,ISSNs,Publisher,Source Country,Author/s,Abstract,Volume,Issue Number,Start Page,End Page,Fields of Study,Keywords,MeSH Terms,Chemicals,Funding,Source URLs,External URL,PMID,DOI,Microsoft Academic ID,PMCID,Citing Patents Count,References,Citing Works Count,Is Open Access,Open Access License,Open Access Colour
005-194-684-516-163,Moving towards Greener Road Transportation: A Review,2023-06-07,2023,journal article,Clean Technologies,25718797,MDPI AG,,Nick Rigogiannis; Ioannis Bogatsis; Christos Pechlivanis; Anastasios Kyritsis; Nick Papanikolaou,"<jats:p>Road transportation accounts for about 20% of the total GHG emissions in the EU. Nowadays, the substitution of conventional fossil fuel-based ICEs with electric engines, or their hybridization, operating along with Energy Storage Systems, seems to be the most appropriate measure to achieve reductions in both fuel consumption and GHGs. However, EVs encounter crucial challenges, such as long charging time and limited driving range. Hence, the transition to the mass adoption of EVs requires considerable effort and time. However, significant steps have been taken in the hybridization of road vehicles, with the aid of renewables and energy recovery/saving systems. In this context, this paper presents a comprehensive literature review of modern green technologies for GHG reduction that are applicable to road transportation, such as on-vehicle energy harvesting and recovery (e.g., thermal, kinetic, etc.) systems and the incorporation of RES into EV charging stations. The impact of road vehicles on the environment is discussed in detail, along with the EU roadmap towards the decarbonization of transportation. Next, methods and techniques for fuel consumption and GHG reduction are systematically presented and categorized into on-vehicle and off-vehicle ones. Finally, a future outlook on more environmentally friendly road transportation is presented.</jats:p>",5,2,766,790,Renewable energy; Greenhouse gas; Environmentally friendly; Context (archaeology); Fossil fuel; Fuel efficiency; Transport engineering; Sustainable transport; Energy consumption; Range (aeronautics); Environmental economics; Environmental science; Automotive engineering; Engineering; Waste management; Sustainability; Paleontology; Electrical engineering; Aerospace engineering; Ecology; Economics; Biology,Rigogiannis  N.; Bogatsis  I.; Pechlivanis  C.; Kyritsis  A.; Papanikolaou  N. Moving towards Greener Road Transportation: A transportation sector; Electric Vehicle (EV); road transportation; EV charging; charging infrastructure; Renewable Energy Sources (RES),,,European Regional Development Fund of the European Union,https://www.mdpi.com/2571-8797/5/2/38/pdf?version=1686123277 https://doi.org/10.3390/cleantechnol5020038,http://dx.doi.org/10.3390/cleantechnol5020038,,10.3390/cleantechnol5020038,,,0,007-516-749-060-905; 009-413-806-106-668; 010-356-803-983-62X; 010-487-873-057-912; 011-327-972-778-268; 012-070-185-362-840; 017-063-092-804-87X; 017-708-778-116-444; 018-549-859-446-374; 019-181-046-814-807; 019-192-354-582-714; 020-439-884-713-811; 021-079-594-991-311; 022-420-069-341-655; 023-273-396-409-740; 024-199-432-907-581; 024-264-926-524-677; 025-112-881-268-860; 027-531-746-617-705; 030-178-998-559-787; 032-324-294-551-475; 036-468-212-826-745; 040-067-771-954-396; 041-239-443-560-763; 043-461-809-840-293; 043-804-249-121-937; 044-869-318-968-490; 045-202-061-747-748; 046-676-730-561-029; 049-800-750-452-123; 051-955-041-318-384; 051-980-185-966-078; 053-877-519-028-776; 055-712-923-939-587; 056-739-397-392-935; 057-091-350-818-879; 059-363-816-852-665; 061-439-544-360-957; 063-490-368-619-515; 066-218-333-490-869; 068-313-845-622-94X; 069-151-725-193-471; 069-799-797-961-136; 070-598-909-796-986; 070-958-279-586-584; 071-226-870-581-222; 073-031-709-019-252; 074-622-135-761-183; 076-045-653-937-607; 077-878-236-672-68X; 079-008-991-814-032; 079-992-670-666-508; 083-816-500-853-900; 085-145-546-051-928; 086-076-661-378-459; 086-757-095-953-271; 087-201-524-482-678; 089-083-253-474-622; 090-580-801-864-078; 090-830-918-784-687; 091-334-372-413-836; 093-354-875-873-878; 095-591-623-970-163; 098-512-149-650-699; 100-169-721-036-29X; 100-191-723-914-624; 103-107-929-241-44X; 109-732-993-079-514; 112-982-353-230-60X; 113-579-095-789-158; 113-772-120-571-025; 117-637-438-263-800; 121-162-823-299-496; 121-617-747-547-029; 123-452-413-245-944; 129-620-363-465-129; 131-229-523-640-927; 135-164-500-556-125; 143-406-417-893-859; 147-254-988-054-19X; 147-483-204-407-786; 153-268-792-253-263; 154-077-890-975-619; 164-729-418-809-725; 174-419-437-402-276; 183-661-622-155-416; 188-526-286-098-941,26,true,cc-by,gold
007-392-010-650-454,Solving the 0-1 Knapsack Problem by Using Tissue P System With Cell Division,,2019,journal article,IEEE Access,21693536,Institute of Electrical and Electronics Engineers (IEEE),United States,Lian Ye; Jinhang Zheng; Ping Guo; Mario J. Pérez-Jiménez,"Membrane computing is a kind of distributed and parallel computing model inspired by a biological cell mechanism. The maximum parallelism of membrane computing improves the computational efficiency of its computational model. In this paper, a tissue P system named KP is proposed to solve the 0-1 knapsack problem, which is one of the classic NP-hard problems. KP could obtain the accurate solutions of knapsack problem and points out the number of accurate solutions, which mainly consists of three stages: first, generate all the solutions of knapsack problem by a cell division; then calculate the weights and total values in all the candidate membranes, which will be kept or dissolved according to the restriction of knapsack problem; and check out the final solutions. The instances are executed on a membrane simulator named UPSimulator, and the result of the experiments shows the whole searching procedure by the rules and proves the correctness and efficiency of the system.",7,,66055,66067,Knapsack problem; Mathematical optimization; Computer science; Combinatorial optimization; P system; Cell division; Membrane computing,,,,Fundamental Research Funds for the Central Universities,https://dblp.uni-trier.de/db/journals/access/access7.html#YeZGP19 https://idus.us.es/handle/11441/116340 https://doi.org/10.1109/ACCESS.2019.2917889,http://dx.doi.org/10.1109/access.2019.2917889,,10.1109/access.2019.2917889,2945606680,,0,003-672-683-944-562; 004-937-432-992-719; 006-631-718-703-995; 006-928-054-031-838; 009-739-358-677-773; 013-069-021-527-053; 026-147-358-367-086; 029-910-939-715-902; 035-692-294-054-442; 036-422-636-238-53X; 043-212-705-131-321; 046-214-286-078-121; 049-428-018-137-263; 049-698-175-524-806; 054-984-486-367-930; 058-766-011-394-214; 059-380-131-766-064; 061-566-949-356-376; 062-180-083-924-022; 063-840-363-390-624; 067-524-723-265-263; 070-653-850-605-40X; 071-325-224-623-655; 081-086-337-957-528; 082-211-324-945-882; 092-715-156-114-845; 098-160-479-536-980; 100-092-581-146-194; 106-862-617-243-110; 120-328-406-459-453; 157-588-432-381-235; 178-556-811-098-638; 180-139-186-953-890,18,true,"CC BY, CC BY-NC-ND",gold
014-822-679-436-83X,A panoramic view and swot analysis of artificial intelligence for achieving the sustainable development goals by 2030: progress and prospects,2021-06-11,2021,journal article,"Applied intelligence (Dordrecht, Netherlands)",15737497; 0924669x,Springer Netherlands,Netherlands,Iván Palomares; Eugenio Martínez-Cámara; Rosana Montes; Pablo García-Moral; Manuel Chiachío; Juan Chiachío; Sergio Alonso; Francisco Javier Melero; Daniel Molina; Bárbara Fernández; Cristina Moral; Rosario Marchena; Javier Pérez de Vargas; Francisco Herrera,"The17 Sustainable Development Goals (SDGs) established by the United Nations Agenda 2030 constitute a global blueprint agenda and instrument for peace and prosperity worldwide. Artificial intelligence and other digital technologies that have emerged in the last years, are being currently applied in virtually every area of society, economy and the environment. Hence, it is unsurprising that their current role in the pursuance or hampering of the SDGs has become critical. This study aims at providing a snapshot and comprehensive view of the progress made and prospects in the relationship between artificial intelligence technologies and the SDGs. A comprehensive review of existing literature has been firstly conducted, after which a series SWOT (Strengths, Weaknesses, Opportunities and Threats) analyses have been undertaken to identify the strengths, weaknesses, opportunities and threats inherent to artificial intelligence-driven technologies as facilitators or barriers to each of the SDGs. Based on the results of these analyses, a subsequent broader analysis is provided, from a position vantage, to (i) identify the efforts made in applying AI technologies in SDGs, (ii) pinpoint opportunities for further progress along the current decade, and (iii) distill ongoing challenges and target areas for important advances. The analysis is organized into six categories or perspectives of human needs: life, economic and technological development, social development, equality, resources and natural environment. Finally, a closing discussion is provided about the prospects, key guidelines and lessons learnt that should be adopted for guaranteeing a positive shift of artificial intelligence developments and applications towards fully supporting the SDGs attainment by 2030.",51,9,6497,6527,SWOT analysis; Artificial intelligence; Blueprint; Fundamental human needs; Position (finance); Social change; Prosperity; Positive shift; Computer science; Sustainable development,Artificial intelligence; Emerging digital technologies; Sustainable development goals,,,Spanish Government fellowship Juan de la Cierva Formacion; Royal Academy of Engineering of Spain,https://link.springer.com/article/10.1007/s10489-021-02264-y https://europepmc.org/article/PMC/PMC8192224 https://dblp.uni-trier.de/db/journals/apin/apin51.html#PalomaresMMGCCA21 https://www.ncbi.nlm.nih.gov/pmc/articles/PMC8192224 https://link.springer.com/content/pdf/10.1007/s10489-021-02264-y.pdf,http://dx.doi.org/10.1007/s10489-021-02264-y,34764606,10.1007/s10489-021-02264-y,3168386798,PMC8192224,0,000-341-100-187-665; 000-899-137-330-51X; 001-532-384-269-205; 001-977-195-207-517; 002-245-480-021-140; 003-180-496-879-004; 003-914-072-470-379; 004-106-707-799-567; 004-450-776-937-831; 005-585-997-643-110; 006-420-918-875-724; 006-842-090-950-017; 007-055-065-071-76X; 007-592-719-575-515; 007-913-951-153-792; 008-523-166-971-899; 008-575-208-581-528; 009-068-005-552-129; 009-398-581-123-607; 010-447-540-978-418; 011-057-318-347-263; 012-421-343-553-194; 013-313-028-142-510; 014-259-719-084-323; 014-700-149-362-292; 015-246-054-590-056; 016-188-382-034-626; 017-941-784-164-515; 018-370-681-108-852; 018-404-759-726-400; 019-351-714-423-510; 020-768-006-069-679; 021-574-384-216-956; 021-716-877-928-450; 023-310-504-216-656; 025-488-714-334-088; 025-511-055-037-719; 025-981-905-309-095; 026-535-241-407-309; 026-704-003-420-836; 027-525-000-604-915; 028-334-310-243-830; 030-284-484-325-034; 030-740-555-946-599; 030-830-089-977-193; 030-837-502-785-809; 031-014-835-610-66X; 032-093-268-304-635; 033-105-434-222-785; 033-442-138-511-512; 034-356-291-738-946; 035-812-308-876-214; 036-239-582-692-044; 037-229-226-645-740; 038-322-165-876-221; 039-168-986-368-922; 039-306-933-967-430; 040-181-350-163-288; 040-335-445-915-728; 040-409-500-441-086; 042-472-536-497-780; 042-801-534-965-733; 043-382-391-614-17X; 044-146-025-180-457; 044-161-334-804-791; 044-352-663-000-42X; 045-172-539-411-924; 046-325-391-721-360; 048-887-924-074-766; 049-186-202-534-921; 049-716-456-220-557; 051-916-041-415-780; 052-923-826-446-976; 054-214-848-350-95X; 056-721-191-991-013; 057-353-039-867-675; 057-397-425-187-20X; 058-084-011-973-496; 059-273-131-587-396; 060-442-996-880-436; 061-076-248-538-933; 061-390-634-096-067; 061-475-121-262-704; 062-924-910-892-722; 063-542-700-953-569; 064-784-488-619-405; 066-166-912-122-524; 068-023-222-452-969; 068-318-690-408-916; 069-176-983-069-837; 070-275-199-957-178; 071-691-067-873-537; 071-860-959-402-137; 072-269-542-266-086; 072-436-041-800-389; 077-117-943-362-158; 078-480-180-559-528; 080-434-643-261-256; 081-357-277-851-415; 081-638-760-690-114; 083-655-573-187-297; 085-371-017-012-953; 086-901-957-098-592; 087-732-086-567-737; 087-898-166-142-35X; 088-884-432-819-802; 089-396-411-044-888; 089-489-283-632-767; 089-745-137-413-996; 090-241-745-379-206; 091-706-850-577-005; 094-823-539-969-171; 094-864-860-262-632; 095-505-520-418-452; 095-764-659-416-896; 100-076-919-754-913; 105-389-730-636-293; 106-611-103-247-409; 114-936-021-787-888; 114-984-353-790-094; 115-066-965-983-958; 116-005-314-582-189; 117-016-178-655-880; 118-997-578-443-323; 119-418-108-964-586; 124-172-305-068-776; 125-108-305-925-029; 127-551-487-669-749; 131-262-342-837-311; 131-708-215-940-483; 136-635-184-363-763; 136-800-018-856-833; 137-649-161-120-930; 143-330-492-845-496; 145-429-123-500-68X; 145-773-351-334-399; 145-839-366-172-475; 147-516-912-068-269; 153-813-582-796-762; 156-009-647-442-853; 165-374-533-427-075; 166-177-854-049-291; 172-514-968-005-627; 172-599-025-243-22X; 174-647-433-820-90X; 175-404-220-213-997; 178-405-708-552-099; 181-263-240-480-807; 182-930-138-117-959; 184-603-795-712-381; 190-297-388-457-98X; 192-790-750-437-837; 198-183-400-775-565; 199-441-316-870-311,206,true,,green
016-531-045-540-435,Flexible Mobility On-Demand: An Environmental Scan,2019-02-27,2019,journal article,Sustainability,20711050,MDPI AG,Switzerland,Sohani Liyanage; Hussein Dia; Rusul L. Abduljabbar; Saeed Asadi Bagloee,"On-demand shared mobility is increasingly being promoted as an influential strategy to address urban transport challenges in large and fast-growing cities. The appeal of this form of transport is largely attributed to its convenience, ease of use, and affordability made possible through digital platforms and innovations. The convergence of the shared economy with a number of established and emerging technologies—such as artificial intelligence (AI), Internet of Things (IoT), and Cloud and Fog computing—is helping to expedite their deployment as a new form of public transport. Recently, this has manifested itself in the form of Flexible Mobility on Demand (FMoD) solutions, aimed at meeting personal travel demands through flexible routing and scheduling. Increasingly, these shared mobility solutions are blurring the boundaries with existing forms of public transport, particularly bus operations. This paper presents an environmental scan and analysis of the technological, social, and economic impacts surrounding disruptive technology-driven shared mobility trends. Specifically, the paper includes an examination of current and anticipated external factors that are of direct relevance to collaborative and low carbon mobility. The paper also outlines how these trends are likely to influence the mobility industries now and into the future. The paper collates information from a wide body of literature and reports on findings from actual ‘use cases’ that exist today which have used these disruptive mobility solutions to deliver substantial benefits to travellers around the world. Finally, the paper provides stakeholders with insight into identifying and responding to the likely needs and impacts of FMoD and informs their policy and strategy positions on the implementation of smart mobility systems in their cities and jurisdictions.",11,5,1262,,Software deployment; Environmental economics; Usability; Economic impact analysis; Sharing economy; Use case; Public transport; Environmental studies; Cloud computing,Flexible Mobility on Demand (FMoD); Mobility-as-a-Service (MaaS); shared mobility; Internet of Things (IoT); Cloud and Fog computing; sustainable public transport,,,,https://ideas.repec.org/a/gam/jsusta/v11y2019i5p1262-d209505.html https://www.mdpi.com/2071-1050/11/5/1262/pdf https://pubag.nal.usda.gov/catalog/6528523 https://findanexpert.unimelb.edu.au/scholarlywork/1384487-flexible-mobility-on-demand--an-environmental-scan https://www.mdpi.com/2071-1050/11/5/1262/htm,http://dx.doi.org/10.3390/su11051262,,10.3390/su11051262,2917854307,,0,000-043-189-036-023; 001-035-660-368-836; 001-398-368-956-561; 002-996-373-816-260; 005-297-395-816-487; 006-098-645-634-454; 007-209-903-937-024; 007-659-103-691-87X; 008-507-269-432-185; 008-515-628-835-374; 009-360-841-007-896; 009-797-958-235-368; 009-912-088-278-188; 010-856-004-994-534; 011-789-294-342-794; 013-187-200-820-236; 013-217-062-604-977; 013-934-387-062-493; 015-052-285-039-389; 015-100-418-247-32X; 015-477-781-886-185; 016-857-470-385-296; 017-903-458-267-589; 018-564-790-421-392; 018-804-440-180-71X; 018-864-632-350-829; 018-865-557-089-118; 019-188-779-572-552; 020-393-727-368-750; 021-092-397-907-180; 021-306-464-079-065; 021-327-298-737-925; 022-095-923-139-282; 023-358-103-574-519; 023-362-628-006-997; 023-382-476-546-158; 023-463-525-072-396; 023-938-364-644-483; 025-319-910-536-608; 026-685-430-895-472; 029-167-264-031-378; 029-284-102-967-66X; 029-895-773-663-651; 029-981-063-093-309; 030-557-687-480-57X; 034-667-106-893-812; 034-804-070-057-449; 035-564-027-954-626; 035-924-440-887-144; 037-002-570-976-93X; 037-221-200-931-160; 037-591-227-954-061; 037-664-907-194-478; 039-311-531-332-789; 039-657-302-359-353; 039-835-648-677-622; 041-268-666-024-653; 042-251-157-585-319; 042-851-592-117-180; 045-984-014-816-551; 046-135-402-616-826; 046-249-043-925-197; 047-578-153-176-813; 047-592-046-139-591; 048-403-176-187-592; 048-438-973-607-270; 048-891-005-134-256; 050-780-106-419-568; 050-962-436-649-785; 052-936-055-333-65X; 053-094-537-530-97X; 053-361-858-191-562; 054-876-407-837-079; 055-211-104-508-542; 055-991-696-008-698; 057-128-183-236-770; 057-985-864-366-85X; 058-848-901-774-250; 059-149-073-001-124; 059-395-942-563-713; 060-803-966-157-66X; 064-376-838-887-168; 066-267-743-364-33X; 066-757-651-381-396; 067-158-841-238-445; 068-187-433-100-809; 072-328-445-220-227; 072-531-337-801-167; 072-688-772-871-085; 072-932-589-150-61X; 073-792-837-468-796; 075-054-855-189-094; 075-247-571-070-391; 075-258-006-369-263; 076-321-236-870-26X; 076-420-544-684-42X; 076-871-983-754-242; 077-800-797-745-551; 078-641-927-671-943; 079-037-270-273-355; 079-802-135-809-714; 083-026-118-560-465; 084-746-398-460-881; 087-426-061-600-478; 088-297-575-528-176; 091-789-620-697-673; 092-280-256-519-401; 092-429-617-750-08X; 092-782-233-139-65X; 093-038-764-922-054; 093-530-739-304-785; 094-253-725-977-106; 094-779-222-651-928; 096-161-225-829-697; 096-340-992-104-391; 096-644-601-131-193; 096-698-303-594-855; 097-324-518-391-692; 098-384-798-822-063; 098-536-735-895-572; 098-806-106-745-966; 098-969-839-981-524; 098-976-165-430-376; 100-333-809-406-867; 100-573-912-091-667; 101-402-083-065-663; 101-459-152-036-389; 102-098-360-098-23X; 104-885-490-548-556; 107-706-519-798-368; 107-998-050-163-054; 108-371-155-125-430; 108-579-708-162-964; 109-375-590-381-572; 109-792-205-844-006; 110-093-035-899-321; 110-111-784-750-07X; 110-360-523-248-337; 111-489-165-822-071; 112-402-109-164-141; 113-149-279-040-619; 114-551-910-275-279; 115-870-892-661-356; 117-743-410-485-814; 118-504-675-991-278; 118-754-019-553-52X; 121-344-127-344-297; 121-496-108-528-165; 121-707-574-802-675; 122-274-957-929-791; 123-069-540-271-721; 124-344-842-522-24X; 124-512-614-290-766; 128-795-245-116-954; 129-618-586-727-218; 131-681-422-653-818; 132-225-447-311-774; 134-771-225-424-23X; 135-582-354-690-773; 136-289-240-354-580; 139-084-076-680-383; 139-467-377-952-619; 140-056-369-841-651; 140-739-931-053-138; 142-630-962-095-107; 143-082-340-602-671; 144-802-569-199-365; 148-901-025-217-448; 154-238-099-689-412; 157-264-713-520-667; 157-949-760-388-410; 158-692-010-272-107; 158-982-470-017-671; 159-483-859-160-038; 160-219-182-701-316; 162-509-740-935-570; 165-566-995-406-160; 166-810-668-485-111; 167-599-700-630-004; 169-327-132-995-032; 172-530-690-016-451; 179-846-967-865-882; 180-572-727-276-632; 180-947-118-282-891; 181-950-212-694-466; 183-043-928-369-486; 184-838-605-449-612; 189-661-808-735-417; 193-278-837-614-182; 193-569-169-960-740; 194-448-878-785-696; 198-734-365-942-759,87,true,cc-by,gold
019-833-473-123-921,Thermal management of 3D integrated circuits with microchannel-based liquid cooling,,,dissertation,,,Nanyang Technological University,,Hanhua Qian,,,,,,Computer cooling; Thermal management of electronic devices and systems; Engineering; Electronics; Electrical engineering technology; Integrated circuit; Microchannel; Mechanical engineering,3DIC Technology and Its Fabrication Processes; 1 3DIC Fabrication Through Monolithic Approaches; 2 3D Integration Through Wafer Bonding; 2 The 3DIC Architecture Under Consideration,,,,https://dr.ntu.edu.sg/handle/10356/61034,http://dx.doi.org/10.32657/10356/61034,,10.32657/10356/61034,2274093345,,0,000-150-917-428-791; 000-496-151-744-245; 001-084-155-301-009; 001-099-687-295-465; 001-110-961-111-169; 002-543-022-703-211; 002-801-115-576-652; 003-346-244-499-168; 004-916-052-537-244; 005-044-971-616-702; 005-208-300-144-490; 006-085-319-420-511; 009-320-008-820-485; 010-159-711-144-375; 010-777-893-841-427; 010-867-593-440-313; 010-979-271-512-130; 011-670-329-577-756; 014-461-418-097-832; 016-387-447-943-751; 017-684-088-623-701; 019-555-954-220-83X; 019-641-649-531-958; 020-028-384-569-829; 021-276-386-964-717; 021-310-751-703-985; 021-366-597-773-389; 022-222-491-565-083; 022-480-249-065-138; 023-033-725-509-812; 024-449-951-464-187; 024-718-605-826-774; 026-639-000-301-630; 026-865-503-294-343; 027-701-509-125-845; 029-081-585-643-255; 031-676-686-141-785; 032-404-798-019-079; 032-575-950-793-744; 033-190-716-707-018; 034-008-981-090-007; 034-755-841-760-944; 037-647-411-463-932; 039-340-786-600-231; 041-883-091-386-50X; 043-294-968-424-339; 044-114-170-443-819; 045-129-409-941-894; 045-761-257-928-410; 046-154-475-966-441; 046-999-996-484-549; 047-569-406-575-042; 049-694-658-772-523; 050-722-388-513-070; 053-180-688-779-095; 054-831-994-314-467; 055-058-921-506-995; 057-102-664-298-811; 059-213-648-188-537; 059-571-255-796-697; 060-499-016-005-394; 060-789-393-698-072; 061-432-470-977-089; 062-432-733-635-352; 062-447-974-489-917; 062-725-322-806-742; 063-936-485-844-870; 064-683-024-880-936; 065-271-902-703-42X; 067-593-364-076-32X; 068-891-185-875-216; 069-523-414-480-806; 070-109-130-226-066; 070-176-159-892-388; 071-039-141-716-867; 072-140-595-248-167; 072-814-009-944-919; 075-467-255-365-002; 077-566-958-424-773; 078-407-837-475-978; 078-510-753-677-48X; 078-691-601-283-823; 079-752-389-267-561; 081-517-309-694-291; 083-446-247-693-02X; 089-017-340-535-352; 090-870-413-398-269; 092-294-986-760-237; 094-466-463-351-988; 095-244-215-823-74X; 095-420-737-446-582; 097-926-182-452-698; 101-041-536-634-777; 101-669-885-174-768; 102-723-804-766-659; 103-544-561-166-95X; 105-446-711-613-924; 106-846-187-199-534; 109-219-680-308-93X; 110-863-712-893-073; 110-991-872-367-212; 112-285-955-062-435; 114-050-869-172-511; 115-310-088-129-806; 115-664-233-955-222; 121-469-424-572-471; 123-367-059-329-822; 126-541-555-244-158; 127-129-361-671-938; 127-327-536-917-117; 129-221-111-029-533; 129-529-761-711-72X; 129-626-689-172-403; 133-896-707-519-306; 135-581-407-915-143; 136-411-646-082-868; 136-416-517-559-378; 136-523-237-156-914; 139-339-600-167-458; 141-070-717-054-193; 142-553-556-903-117; 148-755-737-252-935; 150-223-979-939-232; 150-420-350-220-346; 155-188-954-399-242; 156-739-937-060-321; 160-927-746-493-75X; 163-164-921-291-570; 164-995-286-071-387; 167-275-661-979-72X; 170-956-991-470-354; 172-585-883-528-048; 172-762-474-080-566; 178-631-439-297-928; 179-180-711-896-505; 179-458-677-010-291; 182-582-059-985-792; 185-490-433-791-383; 189-544-499-543-493; 194-498-532-518-043; 199-254-392-508-871; 199-476-120-910-705,1,true,,green
