Lens ID,Title,Date Published,Publication Year,Publication Type,Source Title,ISSNs,Publisher,Source Country,Author/s,Abstract,Volume,Issue Number,Start Page,End Page,Fields of Study,Keywords,MeSH Terms,Chemicals,Funding,Source URLs,External URL,PMID,DOI,Microsoft Academic ID,PMCID,Citing Patents Count,References,Citing Works Count,Is Open Access,Open Access License,Open Access Colour
086-478-189-076-255,Quantum Biotech and Internet of Virus Things: Towards a Theoretical Framework,2021-04-08,2021,journal article,Applied System Innovation,25715577,MDPI AG,,Prafulla Kumar Padhi; Feranando Charrua-Santos,"Quantumization, the process of converting information into quantum (qubit) format, is a key enabler for propelling a new and distinct infrastructure in the pharmaceutical space. Quantum messenger RNA (QmRNA) technology, an indispensable constituent of quantum biotech (QB), is a compelling alternative to conventional vaccine methods because of its capacity for rapid development, high efficacy, and low-cost manufacturing to combat infectious diseases. Internet of Virus Things (IoVT), a biological version of Internet of Things (IoT), comprises applications to fight against pandemics and provides effective vaccine administration. The integration of QB and IoVT constitutes the QBIoVT system to advance the prospect of QmRNA vaccine discovery within a few days. This research disseminates the QBIoVT system paradigm, including architectural aspects, priority areas, challenges, applications, and QmRNA research engine design to accelerate QmRNA vaccines discovery. A comprehensive review of the literature was accomplished, and a context-centered methodology was applied to the QBIoVT paradigm forensic investigations to impel QmRNA vaccine discovery. Based on the above rumination, the principal motive for this study was to develop a novel QBIoVT theoretical framework which has not been produced through earlier theories. The proposed framework shall inspire future QBIoVT system research activities to improve pandemics detection and protection.",4,2,27,,The Internet; Principal (computer security); Biotechnology; Key (cryptography); Qubit; Enabling; Computer science; Process (engineering); Quantum computer; Pandemic,mRNA technology; quantum information system; quantum computing; quantum intelligence; QBIoVT system paradigm; quantumization; QmRNA vaccine discovery,,,,https://www.mdpi.com/2571-5577/4/2/27/pdf https://www.mdpi.com/2571-5577/4/2/27,http://dx.doi.org/10.3390/asi4020027,,10.3390/asi4020027,3150804964,,0,002-955-370-415-401; 003-596-375-551-140; 004-166-507-052-607; 006-175-561-615-690; 009-983-560-064-14X; 010-546-739-559-53X; 011-704-587-912-353; 012-554-967-670-072; 014-159-852-652-23X; 016-280-735-664-626; 016-398-295-762-428; 019-234-607-024-060; 019-480-435-924-719; 021-087-429-192-591; 024-459-065-796-493; 024-473-188-669-057; 025-852-157-325-805; 027-194-470-119-742; 027-642-614-749-345; 031-701-169-913-494; 031-916-907-396-459; 034-139-893-566-087; 034-475-522-360-330; 038-855-739-399-084; 039-146-072-792-973; 040-054-012-755-094; 044-200-360-828-139; 044-481-270-091-288; 045-835-775-181-432; 045-930-692-208-228; 059-232-244-333-105; 060-484-608-078-026; 060-967-063-282-292; 061-789-573-275-006; 063-411-493-074-034; 063-790-307-563-620; 065-895-633-348-057; 066-975-230-019-263; 066-988-411-534-320; 068-362-832-317-496; 071-012-501-024-953; 073-605-402-084-148; 076-596-515-244-483; 077-518-204-661-856; 078-263-702-818-486; 081-445-848-041-564; 081-788-980-257-981; 083-461-427-855-714; 085-314-492-915-19X; 087-706-020-198-140; 094-170-620-482-47X; 094-641-027-121-655; 095-013-623-936-50X; 097-996-242-279-262; 102-090-706-740-896; 103-546-092-170-137; 114-892-432-098-444; 115-150-284-028-922; 118-509-078-643-593; 126-068-448-018-074; 128-068-747-630-514; 136-202-828-623-070; 136-910-477-002-092; 142-108-664-638-167; 146-150-244-290-322; 151-917-385-647-569; 165-253-255-283-399; 198-838-016-682-019,12,true,cc-by,gold
086-607-249-033-520,"Internet of Robotic Things: Current Technologies, Challenges, Applications, and Future Research Topics.",2025-01-27,2025,journal article,"Sensors (Basel, Switzerland)",14248220; 14243210,Multidisciplinary Digital Publishing Institute (MDPI),Switzerland,Jakub Krejčí; Marek Babiuch; Jiří Suder; Václav Krys; Zdenko Bobovský,"This article focuses on the integration of the Internet of Things (IoT) and the Internet of Robotic Things, representing a dynamic research area with significant potential for industrial applications. The Internet of Robotic Things (IoRT) integrates IoT technologies into robotic systems, enhancing their efficiency and autonomy. The article provides an overview of the technologies used in IoRT, including hardware components, communication technologies, and cloud services. It also explores IoRT applications in industries such as healthcare, agriculture, and more. The article discusses challenges and future research directions, including data security, energy efficiency, and ethical issues. The goal is to raise awareness of the importance of IoRT and demonstrate how this technology can bring significant benefits across various sectors.",25,3,765,765,Internet of Things; Cloud computing; Autonomy; The Internet; Emerging technologies; Computer science; Engineering management; Systems engineering; Engineering; Computer security; World Wide Web; Artificial intelligence; Political science; Operating system; Law,IoRT; cloud-based; industrial applications; industry 4.0; industry 5.0; robot; robotic things; smart factories,,,European Union under the RE-FRESH (CZ.10.03.01/00/22_003/0000048),https://www.mdpi.com/1424-8220/25/3/765/pdf?version=1737969255 https://doi.org/10.3390/s25030765 https://pmc.ncbi.nlm.nih.gov/articles/PMC11820596/pdf/sensors-25-00765.pdf https://www.ncbi.nlm.nih.gov/pmc/articles/11820596,http://dx.doi.org/10.3390/s25030765,39943403,10.3390/s25030765,,PMC11820596,0,002-582-568-935-104; 004-542-871-234-091; 004-867-512-959-598; 007-823-310-608-890; 008-124-206-643-913; 008-262-051-867-730; 009-938-405-217-975; 010-075-121-006-564; 011-135-665-194-127; 012-395-240-322-944; 013-188-274-001-772; 013-980-502-604-751; 014-185-154-962-82X; 014-601-267-611-727; 015-453-734-280-82X; 015-669-481-970-138; 021-363-523-185-45X; 022-093-794-849-181; 022-935-961-206-772; 023-076-444-777-95X; 023-606-157-901-087; 024-345-364-117-600; 024-833-558-446-544; 025-959-278-650-938; 027-830-507-935-060; 028-851-819-061-867; 028-907-946-272-368; 028-977-774-661-36X; 029-318-970-834-018; 030-476-590-727-252; 032-101-110-049-926; 032-582-663-969-60X; 033-076-683-881-28X; 033-221-450-227-824; 034-781-900-096-30X; 035-600-202-539-194; 036-930-175-742-91X; 038-042-493-720-780; 038-806-692-856-514; 040-099-119-409-051; 041-039-705-855-590; 042-134-300-645-458; 042-341-534-702-963; 043-619-078-063-298; 043-689-367-508-20X; 044-060-140-966-589; 044-414-148-711-287; 045-295-835-788-494; 046-266-858-607-960; 048-103-673-629-967; 048-385-613-631-430; 050-198-651-471-990; 050-591-117-032-841; 050-775-211-691-962; 050-997-950-548-215; 051-019-036-614-048; 052-311-115-118-418; 052-420-985-280-737; 052-707-803-093-489; 053-506-183-192-114; 053-889-217-365-310; 055-344-643-758-371; 058-248-784-098-150; 060-587-882-034-642; 060-905-654-464-027; 062-541-391-558-264; 069-140-189-831-236; 069-927-068-164-237; 070-391-995-180-134; 070-611-005-273-481; 071-183-080-759-260; 073-291-754-716-875; 073-750-371-248-533; 074-835-564-110-062; 075-813-276-361-173; 076-730-916-402-168; 077-534-272-671-108; 078-966-223-252-252; 079-106-914-532-663; 079-957-631-089-978; 079-992-892-358-543; 080-108-141-079-514; 081-639-614-103-270; 084-249-962-919-116; 084-353-629-120-845; 085-299-262-909-242; 086-446-036-703-899; 086-889-660-075-446; 087-237-000-895-02X; 088-138-571-948-132; 090-359-655-741-025; 090-421-492-808-313; 094-220-026-350-768; 097-743-450-494-076; 099-406-957-941-635; 101-748-290-669-88X; 103-252-738-347-058; 103-444-614-610-519; 104-556-157-974-597; 104-689-821-664-466; 104-855-861-105-432; 104-882-466-690-153; 105-143-034-882-239; 105-212-211-882-966; 106-058-954-627-724; 106-134-824-397-061; 106-777-157-322-38X; 107-634-045-508-241; 107-739-748-616-370; 108-577-068-510-318; 109-121-518-542-36X; 112-395-951-606-287; 112-841-724-965-842; 113-040-267-480-239; 114-116-684-871-032; 114-379-463-681-811; 114-525-702-594-794; 115-764-661-514-923; 115-826-764-844-053; 115-878-026-579-678; 118-047-951-699-732; 122-089-048-978-874; 124-640-347-495-80X; 126-068-309-823-014; 126-081-607-470-719; 132-029-728-441-366; 133-044-821-728-283; 135-643-832-589-44X; 137-294-846-001-950; 139-081-819-537-462; 141-255-844-143-667; 141-753-732-758-896; 142-307-237-799-363; 143-749-471-664-04X; 144-336-648-786-220; 144-796-391-638-165; 146-821-932-897-544; 148-124-267-223-433; 150-449-468-752-080; 151-579-574-680-609; 152-059-821-866-097; 152-263-450-212-534; 155-950-605-081-369; 156-313-505-433-907; 158-461-378-613-661; 161-283-055-090-172; 161-964-289-684-081; 163-734-977-698-152; 166-567-450-736-240; 166-708-559-622-171; 168-508-453-067-954; 170-399-772-699-379; 174-088-367-046-814; 174-566-193-673-757; 174-845-130-988-550; 177-481-879-569-387; 180-266-606-080-902; 184-885-595-234-096; 185-051-314-322-424; 189-502-698-794-994,11,true,cc-by,gold
088-024-925-775-895,GOVERMENT INITIATIVES 4.0: A COMPARISON BETWEEN INDUSTRIAL INNOVATION POLICIES FOR INDUSTRY 4.0,2021-03-12,2021,journal article,Revista Gestão e Desenvolvimento,24466875; 18075436,Associacao Pro-Ensino Superior em Novo Hamburgo,,Thales Volpe Rodrigues; Vitor Hugo dos Santos Filho; Joseane Pontes; Luis Mauricio Resende; Rui Tadashi Yoshino,"ABSTRACT: In recent years, the fourth industrial revolution has attracted increasing attention around the world. However, efforts are still lacking to systematically review the state of the art of this new wave of industrial revolution. In the second decade of the 21st century, the rapid proliferation of technology and the intensification of global competition created a sense of urgency for governments of developed and developing countries to engage in a major industrial revitalization, leading to the global emergence of something generically known as Industry 4.0. These critical government programs are expected to dramatically alter the global structures of major industrial sectors. The World Economic Forum took the lead in discussing the Fourth Industrial Revolution, adding the issue to its 2016 agenda, and found that many governments were concerned about how to support their country's participation in the Fourth Industrial Revolution and were pursuing programs to support these efforts. Based on this context, this literature review aims to analyze global government initiatives, making a comparison between industrial innovation policies of Industry 4.0. Prisma methodologies were used to compose the final portfolio, which made it possible to find the most relevant works for the research. This study contributes to the clarification of innovation policies for the development of Industry 4.0, presenting to emerging economies that it is essential to develop policies that guide the direction of revitalization of the development of industry using demand-side policies. Thus, the study presents how through good governance, the Fourth Industrial Revolution can better promote sustainable development that meets the needs of the present without compromising its capacity to meet the needs of future generations. Keywords: Fourth Industrial Revolution. Industry 4.0. Industrial innovation policies. Government initiatives. RESUMO: Nos ultimos anos, a quarta revolucao industrial atraiu cada vez mais atencao em todo o mundo. Entretanto, ainda faltam esforcos para revisar sistematicamente o estado da arte dessa nova onda da revolucao industrial. Na segunda decada do seculo XXI, a rapida proliferacao da tecnologia e a intensificacao da concorrencia global criaram um senso de urgencia para que governos de paises desenvolvidos e em desenvolvimento se engajem em uma grande revitalizacao industrial, levando ao surgimento global de algo genericamente conhecido como Industria 4.0. Espera-se que esses programas criticos do governo alterem drasticamente as estruturas globais dos principais setores industriais. O Forum Economico Mundial assumiu a lideranca na discussao da Quarta Revolucao Industrial, acrescentando a questao a sua agenda de 2016, e constatou que muitos governos estavam preocupados em como apoiar a participacao de seu pais na Quarta Revolucao Industrial e estavam perseguindo programas para apoiar esses esforcos. Com base nesse contexto, esta revisao de literatura tem como objetivo analisar as iniciativas governamentais globais, realizando um comparativo entre as politicas de inovacao industrial da Industria 4.0. Para composicao do portfolio final, foi utilizada a metodologia PRISMA, que possibilitou encontrar os trabalhos mais relevantes para a pesquisa em relacao a tematica. Este estudo contribui para o esclarecimento sobre as politicas de inovacao para o desenvolvimento da Industria 4.0, apresentando para as economias emergentes que e fundamental desenvolver politicas que orientem a direcao da revitalizacao do desenvolvimento da industria usando politicas do lado da demanda. Evidenciando assim a importância da assistencia do Estado e considerar como por meio da boa governanca, a Quarta Revolucao Industrial pode promover melhor o desenvolvimento sustentavel que atenda as necessidades do presente sem comprometer sua capacidade de atender as necessidades das geracoes futuras. Palavras-chave: Quarta Revolucao Industrial. Industria 4.0. Politicas de inovacao industrial. Iniciativas governamentais.",18,1,119,147,Political science; Industry 4.0; Context (language use); Governo; Welfare economics,Fourth Industrial Revolution; Industry 4; Industrial innovation policies; Government initiatives,,,,https://doaj.org/article/c73e966fd6bf447a9adfbc6097d5c199,http://dx.doi.org/10.25112/rgd.v18i1.2411,,10.25112/rgd.v18i1.2411,3137185273,,0,,13,true,cc-by,gold
094-715-773-921-397,Volume 19 : 2021 Issue 3,2021-10-17,2021,journal article,PLANNING MALAYSIA,01280945; 16756215,Malaysian Institute of Planners,Malaysia,MIP Malaysia,The views expressed in this publication are those of the author(s) and do not necessarily represent the views of MIP. This journal is a refereed journal. All articles were reviewed by two or three unanimous referees identified by the Institute (MIP).,19,,,,Volume (thermodynamics); Business; Physics; Quantum mechanics,Tangible assets  intangible assets  infrastructure asset valuation  property valuation  Malaysia Tangible factors that influence infrastructure asset valuation No. Tangible Factors Digital Technologies  Construction Industry  Project Management Property portfolios  investment style  risk and return Land Value  Land Market  Residential Land JEL Code: R330  R210 Outer loadings Land_Atribute Land_Structure Land_Value Location purchase decision  house buyers  environmental factors  financial factors  government factors  residential properties  inferential analysis The Housing Quality  Financial Capabilities  and Government Policies Studies The Housing Quality  Financial Capabilities  and Government Policies Studies framework  legal  research  land  methodology quality measurement  residential house price  residential quality property crowdfunding  first-time homebuyer  affordable housing  homeownership Aging  Elderly  Strata Housing  Aging in Place  Housing Attributes Wright  D. L.  Faculty  C. I.  Buys  L.  Faculty  C. I.  Vine  D.  Faculty  C. I.  Xia  B.  Faculty  E.  Skitmore  M.  Faculty  E.  Drogemuller  R.  Faculty  C. I.  Kennedy  R.  Faculty  C. I.  Li  M.  & Faculty  C. I. (2014). EUTOPIA 75 + : Exploratory Futures Scenarios for Baby Boomers ' Preferred Living Spaces EU TOPIA 75 + : Exploratory Futures Scenarios for Baby Boomers ' Preferred Living Spaces Flash flood  urban  green infrastructure  green roof  storm water Local authority  tax reassessment  valuation firm  failure Housing preference  youth Heritage property  investment  price index  diversification numeraire  welfare change  willingness to work  willingness to pay Technical  Scale; Efficiency; Malaysian REITs Market Rental Valuation  Hedonic Pricing Model  Willingness to Pay infrastructure  scenario analysis  financing  new capital heritage property  valuation  law of property  Malaysian laws  international laws Strategic Asset Management  public property fair value  City of Tangerang  public asset revaluation Development  Malay Reserve Land (MRL)  Focus Group Discussions (FGDs) Corporate Goals; Corporate Sustainability; Triple Bottom Line Property forecasting  property valuation  predictive accuracy  hedonic price model  artificial neural network Housing Affordability  Housing Price  Middle Income Group (M40)  Waqf AI  ANFIS  ANN  ANFIS-AN  price prediction  Real Estate  Valuation commercial waqf properties (CWP)  rental arrears  tenancy management  Shariah compliance  waqf needs waqf  agribusiness  lands  agriculture  model  wakaf  wakap Business Valuation  Tax  Scenario Analysis  Monte Carlo JEL Code: G170 Waqf Land  Land Development  Development Approaches & Practices  State Islamic Religious Councils (SIRCs) short-term accommodation  governance  land office  local authorities Property Indicator  Shop Property  Penang  Laspeyres  PSPI  Investor transaction value  Gross Income Multiplier  fairness indication Tobler's First Law of Geography  housing distribution  spatial patterns  spatial autocorrelation Housing market  housing price index  hedonic analysis  residential property Housing Affordability  Affordable House  Mortgage  Housing Policy volcanic vulnerability  building  cost approach method machine learning  real estate  property price prediction  valuation Big data  analytics  maintenance  forecasting  Malaysia Location  Spatial Econometrics  Commercial Property Market  Hedonic Pricing Modelling  Spatial dependence Village  Asset Management  Innovation  Community State Asset Management  Sultanate Ground  Dispute Resolution  State Asset Management policy,,,,https://www.planningmalaysia.org/index.php/pmj/article/download/981/677 https://doi.org/10.21837/pm.v19i17.981,http://dx.doi.org/10.21837/pm.v19i17.981,,10.21837/pm.v19i17.981,,,0,,2,true,cc-by-nc-nd,hybrid
096-240-937-068-094,Current Trend of Industry 4.0 in Logistics and Transformation of Logistics Processes Using Digital Technologies: An Empirical Study in the Slovak Republic,2022-11-15,2022,journal article,Logistics,23056290,MDPI AG,,Patrik Richnák,"<jats:p>Background: The digital transformation towards Industry 4.0 has become a necessity for businesses as it makes them more flexible, agile and responsive. Logistics is no exception, as it is constantly undergoing a significant transformation supported by revolutionary Industry 4.0 technologies that are fundamentally changing logistics processes and operations. Methods: In the construction of the paper, the following classical scientific methods were used: analysis, synthesis, induction, deduction, analogy, specification and comparison. Among the special scientific methods, the method of classification, concretisation, graphical methods, questionnaire survey and statistical methods were used. Results: The analysed enterprises perceive digital transformation in logistics. In the analysed enterprises in Slovakia, the Industry 4.0 strategy is implemented in logistics. Industry 4.0 in logistics has the largest representation in production logistics in each enterprise category. In implementing Industry 4.0 in logistics, enterprises confront the biggest barrier, namely, investment costs. Conclusions: Through one-way analysis of variance (ANOVA) and Pearson’s correlation coefficient, several significant relationships were confirmed. The significant relationship between manufacturing logistics and selected Industry 4.0 technologies was demonstrated. The significant relationship between procurement logistics and selected Industry 4.0 technologies was also demonstrated. The statistical analysis also confirmed a significant relationship between distribution logistics and the selected Industry 4.0 technologies.</jats:p>",6,4,79,79,Digital transformation; Industry 4.0; Business; Variance (accounting); Procurement; Production (economics); Manufacturing; Computer science; Industrial organization; Operations management; Marketing; Engineering; Economics; Data mining; Accounting; Macroeconomics; World Wide Web,digital transformation; Industry 4.0; Industry 4.0 technologies; Logistics 4.0; statistical methods,,,VEGA,https://www.mdpi.com/2305-6290/6/4/79/pdf?version=1669174867 https://doi.org/10.3390/logistics6040079,http://dx.doi.org/10.3390/logistics6040079,,10.3390/logistics6040079,,,0,005-824-574-457-645; 012-081-829-380-686; 012-486-887-601-243; 015-599-915-142-276; 016-769-652-350-860; 016-819-194-616-838; 019-792-976-465-335; 019-992-138-496-817; 020-135-321-521-645; 021-452-048-275-96X; 023-976-447-932-728; 027-916-280-495-159; 028-162-225-651-807; 029-635-109-159-245; 031-640-821-606-844; 032-369-782-027-735; 033-076-683-881-28X; 040-210-856-606-058; 041-388-122-583-971; 041-979-438-631-524; 043-474-345-279-647; 045-606-342-604-277; 047-188-377-878-829; 050-089-676-804-867; 052-178-343-401-717; 052-540-372-538-252; 054-244-545-950-971; 058-053-401-399-133; 059-743-840-127-812; 063-135-384-962-122; 063-449-682-371-402; 066-550-677-885-789; 068-881-795-087-007; 070-782-505-583-263; 071-927-078-373-501; 076-303-271-715-610; 076-991-386-599-906; 089-921-600-737-125; 090-218-470-242-562; 092-214-035-837-03X; 093-142-205-928-425; 094-014-733-175-850; 097-459-858-452-744; 098-241-037-133-433; 101-076-999-746-484; 101-597-275-400-799; 103-179-275-565-930; 103-808-365-189-114; 110-271-216-878-123; 114-445-083-096-322; 120-870-786-928-732; 125-854-364-953-075; 129-227-139-583-699; 134-432-511-168-568; 136-854-266-499-859; 146-251-967-183-275; 150-547-783-407-083; 152-435-801-834-852; 152-645-981-868-624; 156-411-557-217-244; 156-441-061-972-809; 169-464-940-458-869; 172-498-502-313-305; 180-640-382-449-156; 182-759-344-778-777; 187-428-898-795-582; 195-062-031-600-830,18,true,cc-by,gold
