Lens ID,Title,Date Published,Publication Year,Publication Type,Source Title,ISSNs,Publisher,Source Country,Author/s,Abstract,Volume,Issue Number,Start Page,End Page,Fields of Study,Keywords,MeSH Terms,Chemicals,Funding,Source URLs,External URL,PMID,DOI,Microsoft Academic ID,PMCID,Citing Patents Count,References,Citing Works Count,Is Open Access,Open Access License,Open Access Colour
003-621-483-901-744,Mapping artificial intelligence affordances for the public sector,2022-01-01,2022,dissertation,,,Queensland University of Technology,,Samar Fatima,"<jats:p>This thesis explores the affordances of artificial intelligence (AI) for the public sector. The thesis consists of three studies that answer what, why and how questions of AI affordance actualization in public sector using a combination of primary and secondary data sources. In this thesis, the affordance theory lens is used to explore AI affordance perception and actualization for the public sector through three related studies. The perception of AI affordance is investigated in the first two studies. The third study designed and evaluated artefact for public agencies to actualize AI affordance.</jats:p>",,,,,Affordance; Perception; Public sector; Psychology; Computer science; Cognitive science; Human–computer interaction; Political science; Law; Neuroscience,"Artificial intelligence; public sector; AI affordances; technology affordance theory; national strategic AI plans; information systems; AI governance; business models; business model canvas; signalling theory; public value; social value; design science research; fuzzy set qualitative comparative analysis; principal component analysis Peer-reviewed conference papers; Fatima; S.; Desouza; K.C.; Buck; C.; Fielt; E. ""Business Model Canvas to",,,,https://eprints.qut.edu.au/235926/1/Samar%2BFatime%2BThesis.pdf https://doi.org/10.5204/thesis.eprints.235926,http://dx.doi.org/10.5204/thesis.eprints.235926,,10.5204/thesis.eprints.235926,,,0,,0,true,cc-by-nc-nd,gold
006-388-883-620-125,Integrating 6G technology in smart hospitals: challenges and opportunities for enhanced healthcare services.,2025-04-04,2025,journal article,Frontiers in medicine,2296858x,Frontiers Media SA,Switzerland,Arun Kumar; Mehedi Masud; Mohammed H Alsharif; Nishant Gaur; Aziz Nanthaamornphong,"<AbstractText Label=""Introduction"" NlmCategory=""UNASSIGNED"">The advent of sixth-generation (6G) wireless communication technology promises to transform various sectors, with healthcare-particularly smart hospitals-standing to gain significantly. This study investigates the transformative potential of 6G in healthcare by exploring its architectural foundations and enabling technologies.</AbstractText>;           <AbstractText Label=""Methods"" NlmCategory=""UNASSIGNED"">A comprehensive review and analysis were conducted on current technological trends, frameworks, and integration strategies relevant to 6G-enabled healthcare systems. The proposed model integrates key technologies such as the Internet of Things (IoT), artificial intelligence (AI), blockchain, robotics, telemedicine, and advanced data analytics within the context of smart hospitals.</AbstractText>;           <AbstractText Label=""Results"" NlmCategory=""UNASSIGNED"">The findings suggest that 6G's ultralow latency, massive device connectivity, and high data throughput can dramatically enhance patient care, real-time monitoring, and hospital operational efficiency. The proposed 6G-based smart hospital model fosters seamless communication between medical devices and systems, enabling intelligent decision-making and optimized resource allocation.</AbstractText>;           <AbstractText Label=""Discussion"" NlmCategory=""UNASSIGNED"">Despite the promising benefits, several challenges were identified, including data privacy and security risks, system interoperability, and ethical implications. The study underscores the critical importance of robust regulatory frameworks and standardized protocols to ensure secure and ethical deployment of 6G technologies in healthcare settings.</AbstractText>;           <AbstractText Label=""Conclusion"" NlmCategory=""UNASSIGNED"">By providing a forward-looking analysis of the opportunities and challenges associated with 6G-powered smart hospitals, this research offers valuable insights into the evolving landscape of digital healthcare and its potential to redefine patient care and hospital management in the near future.</AbstractText>;           <CopyrightInformation>Copyright © 2025 Kumar, Masud, Alsharif, Gaur and Nanthaamornphong.</CopyrightInformation>",12,,1534551,1534551,Interoperability; Health care; Software deployment; Big data; Context (archaeology); Transformative learning; Computer science; Knowledge management; Computer security; Data science; World Wide Web; Psychology; Operating system; Economic growth; Paleontology; Biology; Pedagogy; Economics,6G; AI; IoT; advanced waveforms; big data; health care; smart hospital; telemedicine,,,,https://www.frontiersin.org/journals/medicine/articles/10.3389/fmed.2025.1534551/pdf https://doi.org/10.3389/fmed.2025.1534551,http://dx.doi.org/10.3389/fmed.2025.1534551,40255587,10.3389/fmed.2025.1534551,,PMC12006048,0,000-937-714-880-605; 003-498-608-925-846; 003-802-518-702-722; 008-555-390-566-325; 009-383-195-432-32X; 010-765-122-996-780; 011-045-516-136-944; 013-204-887-132-115; 014-289-049-176-84X; 014-766-985-048-049; 015-091-791-088-126; 017-868-342-709-049; 018-204-620-574-776; 018-371-528-767-223; 018-782-552-328-956; 021-144-015-960-894; 022-114-966-528-385; 026-308-070-618-848; 026-342-238-965-341; 028-023-481-870-929; 032-138-794-040-672; 032-707-327-205-738; 032-746-105-093-322; 033-002-629-244-114; 033-784-280-319-564; 034-068-488-466-52X; 034-553-551-862-496; 036-254-706-670-927; 039-768-294-163-618; 040-665-692-364-216; 040-920-000-114-562; 042-677-537-623-119; 043-738-223-277-236; 047-616-059-910-30X; 049-358-887-282-058; 051-623-357-115-46X; 052-707-803-093-489; 055-388-537-323-897; 055-682-225-662-213; 056-138-964-639-196; 056-903-637-514-877; 056-924-148-980-247; 057-945-836-274-046; 058-383-067-595-922; 062-050-769-356-108; 062-973-976-977-738; 064-295-570-699-97X; 064-397-016-327-359; 065-160-141-574-077; 067-124-087-228-986; 069-065-334-096-702; 070-220-720-516-210; 071-899-551-283-11X; 072-178-231-347-678; 072-917-289-474-094; 073-572-563-720-522; 074-446-195-878-658; 075-834-477-016-15X; 077-786-919-411-130; 078-330-960-000-051; 079-711-949-575-669; 081-206-044-727-124; 084-021-756-818-356; 084-833-501-690-470; 086-828-993-031-952; 091-202-805-369-013; 091-634-540-395-580; 092-028-139-742-386; 094-787-530-087-126; 097-919-429-972-164; 100-298-247-236-323; 105-256-769-558-211; 107-948-808-389-108; 110-040-622-205-559; 114-530-241-031-433; 115-955-260-717-326; 120-871-240-444-087; 124-530-145-826-175; 129-516-041-533-248; 135-217-019-876-049; 135-360-717-142-722; 135-539-789-485-644; 145-693-465-798-853; 146-741-122-462-40X; 152-538-416-464-711; 159-556-827-721-51X; 168-698-971-294-962; 171-461-607-765-513; 173-818-956-439-726; 179-955-328-647-646; 196-063-728-714-37X,18,true,cc-by,gold
007-457-655-439-650,Integration of IoT and Quantum Computing,2024-09-23,2024,book chapter,Advances in Computer and Electrical Engineering,2327039x; 23270403,IGI Global,,Arnav Shailesh Sonavane; Amit Aylani,"<jats:p>The integration of Internet of Things (IoT) and Quantum Computing is revolutionizing manufacturing by ushering in a new era of smart, efficient, and secure industrial processes. This synergy combines the power of IoT devices to collect and transmit real-time data with the computational prowess of quantum computing for advanced analytics and optimization. Through smart manufacturing, industrial automation, and predictive maintenance, this integration enables agile production lines, optimized supply chains, and enhanced quality control. Quantum cryptography ensures robust security for sensitive data transmissions within IoT networks. By leveraging real-time analytics and machine learning capabilities, manufacturers can make informed decisions swiftly, improve product traceability, and enhance overall operational efficiency. The fusion of IoT and Quantum Computing is reshaping the manufacturing landscape, paving the way for a more connected and intelligent industrial ecosystem.</jats:p>",,,331,358,Internet of Things; Computer science; Quantum; Quantum computer; Distributed computing; Computer security; Physics; Quantum mechanics,,,,,,http://dx.doi.org/10.4018/979-8-3693-3940-4.ch016,,10.4018/979-8-3693-3940-4.ch016,,,0,000-612-241-128-900; 003-570-917-344-432; 008-889-426-833-895; 010-584-267-125-465; 010-929-990-795-901; 017-394-991-891-205; 023-760-215-721-128; 029-803-646-760-538; 037-350-485-736-027; 037-358-174-470-045; 043-984-353-831-411; 047-073-124-079-615; 059-927-293-575-611; 065-610-970-780-770; 069-461-549-173-167; 075-154-980-834-775; 081-339-533-394-614; 087-504-212-055-675; 108-394-347-795-780; 118-940-639-093-113; 126-649-459-392-26X; 148-341-682-635-233; 154-677-988-458-838,5,false,,
007-494-395-735-658,Opportunities of the Technological Trends Linked to Industry 4.0 for Achieve Sustainable Manufacturing Objectives,2022-09-06,2022,journal article,Sustainability,20711050,MDPI AG,Switzerland,Guillermo Fuertes; Jorge Zamorano; Miguel Alfaro; Manuel Vargas; Jorge Sabattin; Claudia Duran; Rodrigo Ternero; Ricardo Rivera,"<jats:p>In this work, we integrate the concepts of Industry 4.0, smart manufacturing, and sustainable manufacturing in a model that provides a conceptual framework for the study of long-term solutions with a high degree of specialization, according to the specific context of each investigation. This study offers a holistic analysis and evaluation of the main challenges facing the Industry 4.0 concept. We also diagnose the current methodological proposals aimed at solving the challenges of Industry 4.0 and sustainability using a systemic review of the literature from the past 5 years. Firstly, we identify 14 technological trends linked to Industry 4.0. Subsequently, the trends are integrated into the proposed model to identify opportunities, evaluating their relationship with three performance areas. This allows the identification of trends that present the greatest number of opportunities in the context of sustainability. The second stage complements the literature review with a descriptive analysis of the studies and discusses the findings. The study concludes that the identified technological trends positively impact Industry 4.0 challenges, helping to achieve sustainable manufacturing objectives.</jats:p>",14,18,11118,11118,Sustainability; Context (archaeology); Industry 4.0; Manufacturing; Identification (biology); Work (physics); Business; Conceptual framework; Management science; Process management; Knowledge management; Computer science; Engineering; Marketing; Geography; Embedded system; Philosophy; Biology; Botany; Archaeology; Ecology; Epistemology; Mechanical engineering,Industry 4.0; sustainable manufacturing; smart factory; circular economy; technological trends,,,,https://www.mdpi.com/2071-1050/14/18/11118/pdf?version=1662526137 https://doi.org/10.3390/su141811118,http://dx.doi.org/10.3390/su141811118,,10.3390/su141811118,,,0,001-103-459-836-919; 001-325-721-419-998; 004-613-954-334-253; 007-592-719-575-515; 007-864-372-052-710; 008-521-134-141-787; 008-696-589-330-888; 009-068-005-552-129; 009-332-177-931-723; 009-938-286-840-624; 010-055-131-223-628; 010-987-924-507-516; 011-467-724-104-55X; 011-848-196-551-792; 011-959-187-920-308; 012-961-770-641-743; 013-209-041-019-592; 013-287-665-466-861; 013-414-291-804-06X; 013-633-743-727-414; 015-015-282-840-40X; 015-557-240-550-312; 015-683-609-016-740; 016-819-194-616-838; 017-995-757-541-235; 019-084-854-733-162; 020-581-472-422-02X; 020-615-272-295-524; 022-073-243-744-545; 022-281-351-874-570; 022-477-158-244-117; 022-902-654-665-02X; 023-363-806-263-238; 024-072-569-721-632; 024-361-346-918-914; 025-213-855-108-41X; 025-253-322-092-116; 025-979-790-388-99X; 028-680-917-351-880; 028-815-207-755-19X; 028-949-455-668-320; 029-068-847-999-416; 029-732-822-570-798; 030-092-122-469-683; 030-601-865-733-53X; 030-686-554-327-070; 031-041-128-104-999; 031-704-855-243-21X; 031-756-607-363-516; 031-903-747-225-462; 032-593-025-336-350; 033-076-683-881-28X; 033-998-023-590-998; 035-912-051-816-635; 036-245-209-346-291; 036-601-600-371-463; 036-777-747-911-750; 036-865-183-272-729; 038-855-739-399-084; 038-904-037-813-023; 043-657-580-334-353; 043-815-155-426-784; 044-592-141-889-981; 045-936-475-493-242; 046-153-894-128-587; 047-034-828-914-621; 047-336-433-953-988; 047-895-795-314-316; 049-821-967-090-429; 050-460-748-820-414; 050-662-505-495-499; 050-815-540-538-129; 051-062-581-099-209; 051-902-780-886-415; 052-178-343-401-717; 052-234-185-277-119; 052-592-848-948-498; 052-603-569-095-390; 054-231-788-606-021; 054-244-545-950-971; 054-847-550-503-925; 055-272-736-924-578; 056-310-356-269-453; 057-087-240-183-858; 057-214-042-880-707; 058-057-836-506-020; 058-179-874-356-591; 059-424-427-267-469; 059-614-684-903-478; 059-969-527-886-486; 060-879-832-826-435; 062-067-559-042-988; 062-525-514-762-952; 064-723-242-350-46X; 064-773-944-498-94X; 065-010-405-236-060; 065-661-089-715-690; 066-241-776-480-753; 069-259-093-700-889; 069-747-161-696-512; 070-047-008-873-090; 070-694-964-750-489; 071-611-320-886-997; 072-179-123-070-821; 072-328-874-685-030; 072-610-976-413-203; 072-974-520-873-188; 073-070-457-108-882; 073-091-485-128-357; 074-137-015-892-454; 075-237-093-063-242; 075-996-258-734-495; 076-303-271-715-610; 076-690-767-175-163; 077-692-690-460-876; 079-329-009-311-172; 079-725-390-592-069; 080-570-784-132-104; 080-914-690-570-636; 081-111-048-284-779; 081-365-052-727-317; 081-726-890-191-583; 084-180-446-222-483; 084-249-962-919-116; 084-773-930-346-027; 084-906-843-116-609; 086-688-417-413-950; 087-019-900-120-785; 087-535-267-238-489; 087-716-115-273-608; 088-281-843-577-462; 089-230-166-614-452; 090-218-470-242-562; 092-275-640-011-112; 095-777-048-135-641; 098-676-304-580-485; 098-698-438-240-352; 099-257-984-430-017; 101-111-616-618-620; 102-424-326-687-39X; 102-861-736-374-631; 104-306-884-144-723; 107-391-738-878-778; 109-368-369-462-255; 113-811-562-357-842; 114-180-815-758-424; 114-806-139-301-374; 119-984-635-146-880; 120-172-359-520-240; 120-908-449-587-376; 122-177-114-419-617; 123-073-170-945-208; 123-885-241-189-563; 124-707-104-600-736; 127-153-347-053-56X; 129-475-105-628-804; 129-902-869-143-675; 132-308-279-448-387; 135-553-141-898-826; 136-831-130-559-080; 138-529-852-670-835; 141-938-808-624-618; 142-749-015-586-504; 143-715-823-424-096; 144-790-711-872-00X; 144-796-391-638-165; 146-346-698-365-266; 150-233-135-089-265; 151-367-882-448-620; 153-578-898-747-150; 161-717-582-635-352; 163-196-802-102-657; 166-743-648-149-404; 169-380-214-360-631; 172-812-948-733-729; 185-949-037-232-383; 194-844-940-769-65X,31,true,cc-by,gold
009-735-661-822-058,Continuous maintenance and the future – Foundations and technological challenges,,2016,journal article,CIRP Annals,00078506,Elsevier BV,Switzerland,Rajkumar Roy; Rainer Stark; Kirsten Tracht; Shozo Takata; Masahiko Mori,"High value and long life products require continuous maintenance throughout their life cycle to achieve required performance with optimum through-life cost. This paper presents foundations and technologies required to offer the maintenance service. Component and system level degradation science, assessment and modelling along with life cycle ‘big data’ analytics are the two most important knowledge and skill base required for the continuous maintenance. Advanced computing and visualisation technologies will improve efficiency of the maintenance and reduce through-life cost of the product. Future of continuous maintenance within the Industry 4.0 context also identifies the role of IoT, standards and cyber security.",65,2,667,688,Risk analysis (engineering); Engineering; Systems engineering; Monitoring Maintenance Lifecycle; Context (language use); System level; Service (systems architecture); Product (business); Component (UML); Big data; Analytics,,,,EPSRC,https://core.ac.uk/display/42144561 https://dspace.lib.cranfield.ac.uk/bitstream/1826/10166/1/Continuous_maintenance_and_the_future-2016.pdf http://www.sciencedirect.com/science/article/pii/S0007850616301986 https://waseda.pure.elsevier.com/en/publications/continuous-maintenance-and-the-future-foundations-and-technologic https://www.sciencedirect.com/science/article/pii/S0007850616301986 https://depositonce.tu-berlin.de/handle/11303/7897 https://openaccess.city.ac.uk/id/eprint/22203/ https://dspace.lib.cranfield.ac.uk/handle/1826/10166 https://depositonce.tu-berlin.de/bitstream/11303/7897/2/1-s2.0-S0007850616301986-main.pdf https://core.ac.uk/download/200199721.pdf,http://dx.doi.org/10.1016/j.cirp.2016.06.006,,10.1016/j.cirp.2016.06.006,2463378445,,1,000-713-610-170-518; 000-715-409-335-172; 001-599-413-081-735; 003-052-623-371-291; 003-266-974-434-171; 003-306-526-907-469; 003-353-313-467-473; 003-629-517-612-489; 003-642-534-775-737; 003-956-976-501-380; 004-883-616-809-412; 005-038-151-973-850; 006-092-874-196-155; 006-867-704-238-173; 007-925-515-165-891; 008-042-454-522-273; 008-666-213-565-681; 009-180-350-784-609; 009-684-576-510-968; 010-128-333-200-867; 010-312-942-208-557; 012-116-976-443-277; 012-557-017-890-956; 012-808-067-715-463; 012-969-465-284-07X; 012-979-081-451-202; 013-694-904-066-768; 014-328-558-120-632; 015-942-106-116-479; 016-245-823-947-788; 018-733-045-507-991; 019-611-127-489-716; 019-886-565-057-975; 020-169-292-801-191; 020-381-768-373-830; 020-608-314-022-941; 020-620-720-849-612; 020-929-067-100-566; 021-670-595-114-79X; 021-968-364-382-764; 022-211-566-470-203; 022-785-877-907-84X; 023-261-368-709-852; 023-662-863-413-650; 023-822-075-001-17X; 023-858-106-556-210; 026-668-402-901-762; 026-766-761-873-539; 026-864-956-866-223; 027-123-454-710-067; 027-139-534-556-879; 027-775-424-683-030; 027-929-722-977-730; 027-960-436-951-869; 027-966-579-952-196; 028-621-405-583-872; 028-723-622-381-81X; 029-416-905-818-096; 029-453-219-622-467; 030-664-985-157-395; 032-119-106-229-866; 032-408-821-653-19X; 033-650-812-304-002; 034-915-848-399-67X; 035-724-054-088-292; 035-726-531-475-092; 037-742-289-769-262; 038-127-108-592-288; 039-077-936-958-429; 040-108-992-085-84X; 041-258-071-792-507; 041-339-779-737-479; 041-648-003-619-853; 043-056-942-339-802; 044-876-083-588-56X; 046-868-458-183-431; 047-162-344-226-749; 047-280-144-761-162; 047-755-990-357-253; 048-730-841-888-750; 048-779-868-782-937; 050-142-699-498-671; 051-418-201-833-403; 051-623-873-520-197; 051-842-222-895-905; 052-616-887-361-028; 053-070-217-629-27X; 054-629-421-825-906; 056-311-129-861-718; 057-133-178-070-426; 059-068-041-687-788; 059-308-455-048-660; 060-295-437-412-938; 060-330-965-949-799; 062-558-420-120-976; 063-299-951-097-325; 063-989-625-191-787; 064-402-849-237-175; 064-574-205-248-793; 065-260-230-101-253; 065-448-430-842-106; 065-801-098-186-884; 065-810-149-563-69X; 067-218-774-124-334; 069-026-647-993-330; 069-449-863-579-913; 070-926-846-290-32X; 071-049-792-502-685; 071-247-914-930-942; 072-568-861-958-071; 073-124-451-811-578; 077-722-195-288-081; 078-227-914-318-573; 078-409-105-645-950; 079-629-546-245-734; 080-847-498-406-919; 082-764-696-783-706; 082-778-254-754-489; 083-002-699-052-242; 083-394-073-288-478; 084-222-912-926-916; 085-109-759-077-402; 085-264-969-725-674; 087-566-980-843-491; 090-598-697-501-503; 091-792-083-387-174; 092-684-888-640-366; 094-280-406-839-64X; 095-135-397-627-631; 095-637-866-710-084; 095-820-515-574-426; 098-623-888-166-501; 098-756-079-371-168; 101-621-910-161-908; 102-205-801-739-612; 104-093-210-789-975; 104-524-208-543-265; 105-230-163-904-620; 105-300-933-528-774; 105-983-807-623-012; 106-535-854-212-571; 109-568-141-046-083; 110-647-566-771-935; 111-688-294-267-715; 112-975-114-720-577; 113-708-252-733-851; 116-837-338-691-269; 122-196-832-937-690; 122-592-340-420-497; 122-922-608-369-24X; 124-727-526-895-341; 124-870-767-181-034; 126-081-607-470-719; 127-293-063-427-528; 128-460-069-592-972; 129-862-689-665-130; 130-933-746-927-776; 138-426-168-082-445; 139-267-933-458-552; 139-446-597-110-971; 140-740-395-785-594; 141-591-335-616-895; 141-757-067-755-959; 144-371-691-768-70X; 145-098-935-532-018; 145-747-766-530-94X; 146-235-469-402-201; 146-606-546-003-221; 151-730-616-506-115; 153-308-292-927-421; 154-521-502-176-080; 155-914-829-740-513; 163-743-017-576-064; 163-749-004-648-994; 165-010-163-214-816; 166-487-315-129-026; 168-742-953-576-435; 172-529-890-187-134; 172-969-987-436-810; 174-265-327-068-79X; 175-369-655-340-871; 193-638-328-143-42X; 195-772-837-237-475,266,true,cc-by,hybrid
009-882-229-724-344,"Challenges and Opportunities in Industry 4.0 for Mechatronics, Artificial Intelligence and Cybernetics",2021-08-19,2021,journal article,Electronics,20799292,MDPI AG,,Vasiliki Liagkou; Chrysostomos D. Stylios; Lamprini Pappa; Alexander Petunin,"Industry 4.0 has risen as an integrated digital manufacturing environment, and it has created a novel research perspective that has thrust research to interdisciplinarity and exploitation of ICT advances. This work presents and discusses the main aspects of Industry 4.0 and how intelligence can be embedded in manufacturing to create the smart factory. It briefly describes the main components of Industry 4.0, and it focuses on the security challenges that the fully interconnected ecosystem of Industry 4.0 has to meet and the threats for each component. Preserving security has a crucial role in Industry 4.0, and it is vital for its existence, so the main research directions on how to ensure the confidentiality and integrity of the information shared among the Industry 4.0 components are presented. Another view is in light of the security issues that come as a result of enabling new technologies.",10,16,2001,,Engineering management; Cybernetics; Engineering; Cyber-physical system; Emerging technologies; Industry 4.0; Digital manufacturing; Mechatronics; Information and Communications Technology; Cloud computing,Industry 4.0; mechatronics; artificial intelligence; cybersecurity; security threats; internet of things; cyber-physical systems,,,,https://www.mdpi.com/2079-9292/10/16/2001/pdf https://www.mdpi.com/2079-9292/10/16/2001 https://science.urfu.ru/es/publications/challenges-and-opportunities-in-industry-40-for-mechatronics-arti,http://dx.doi.org/10.3390/electronics10162001,,10.3390/electronics10162001,3195023828,,0,001-021-458-144-33X; 001-794-311-960-329; 003-235-747-646-308; 003-821-070-459-763; 004-785-911-223-335; 007-309-854-651-270; 008-142-780-122-409; 008-404-008-444-741; 008-659-601-165-174; 012-289-024-722-32X; 014-958-440-648-892; 016-845-837-701-999; 018-767-792-875-822; 019-710-067-455-197; 019-768-331-540-502; 024-253-860-457-665; 024-956-861-475-639; 025-016-433-045-559; 025-850-048-589-415; 026-880-846-288-450; 028-073-424-096-215; 028-949-455-668-320; 032-039-912-494-664; 035-679-565-460-391; 036-650-627-870-917; 039-061-424-290-174; 039-610-184-345-998; 040-954-000-855-374; 041-437-717-635-476; 046-153-894-128-587; 046-744-066-303-436; 049-651-573-112-737; 050-099-231-780-347; 056-543-336-008-499; 056-858-981-072-908; 058-220-421-068-863; 064-158-898-902-803; 067-394-040-360-007; 068-881-795-087-007; 070-835-294-705-254; 071-959-788-500-196; 074-886-801-306-73X; 075-996-258-734-495; 077-657-517-956-786; 078-930-921-680-313; 080-735-265-991-495; 082-785-374-669-815; 084-127-507-460-483; 087-103-284-480-892; 093-226-478-665-323; 094-957-882-532-165; 098-995-214-886-69X; 103-636-346-617-218; 104-855-861-105-432; 104-963-683-392-202; 109-568-141-046-083; 113-506-581-771-618; 115-860-500-161-434; 116-924-978-226-360; 119-806-532-860-262; 122-038-300-442-271; 123-003-416-766-610; 125-184-556-716-218; 134-187-767-636-306; 136-347-247-252-838; 140-239-323-312-182; 149-462-758-755-707; 150-148-650-092-841; 157-052-308-598-183; 163-643-945-645-730; 180-777-531-155-467; 181-383-343-326-198; 197-582-091-625-513,39,true,cc-by,gold
