Lens ID,Title,Date Published,Publication Year,Publication Type,Source Title,ISSNs,Publisher,Source Country,Author/s,Abstract,Volume,Issue Number,Start Page,End Page,Fields of Study,Keywords,MeSH Terms,Chemicals,Funding,Source URLs,External URL,PMID,DOI,Microsoft Academic ID,PMCID,Citing Patents Count,References,Citing Works Count,Is Open Access,Open Access License,Open Access Colour
132-983-451-292-839,QAmplifyNet: Pushing the Boundaries of Supply Chain Backorder Prediction Using Interpretable Hybrid Quantum-Classical Neural Network,2023-07-24,2023,preprint,arXiv (Cornell University),,,,Md Abrar Jahin; Md Sakib Hossain Shovon; Md. Saiful Islam; Jungpil Shin; M. F. Mridha; Yuichi Okuyama,"Supply chain management relies on accurate backorder prediction for optimizing inventory control, reducing costs, and enhancing customer satisfaction. However, traditional machine-learning models struggle with large-scale datasets and complex relationships, hindering real-world data collection. This research introduces a novel methodological framework for supply chain backorder prediction, addressing the challenge of handling large datasets. Our proposed model, QAmplifyNet, employs quantum-inspired techniques within a quantum-classical neural network to predict backorders effectively on short and imbalanced datasets. Experimental evaluations on a benchmark dataset demonstrate QAmplifyNet's superiority over classical models, quantum ensembles, quantum neural networks, and deep reinforcement learning. Its proficiency in handling short, imbalanced datasets makes it an ideal solution for supply chain management. To enhance model interpretability, we use Explainable Artificial Intelligence techniques. Practical implications include improved inventory control, reduced backorders, and enhanced operational efficiency. QAmplifyNet seamlessly integrates into real-world supply chain management systems, enabling proactive decision-making and efficient resource allocation. Future work involves exploring additional quantum-inspired techniques, expanding the dataset, and investigating other supply chain applications. This research unlocks the potential of quantum computing in supply chain optimization and paves the way for further exploration of quantum-inspired machine learning models in supply chain management. Our framework and QAmplifyNet model offer a breakthrough approach to supply chain backorder prediction, providing superior performance and opening new avenues for leveraging quantum-inspired techniques in supply chain management.",,,,,Interpretability; Computer science; Supply chain; Artificial neural network; Benchmark (surveying); Supply chain management; Artificial intelligence; Quantum; Machine learning; Law; Physics; Geodesy; Geography; Political science; Quantum mechanics,,,,,https://arxiv.org/abs/2307.12906,http://dx.doi.org/10.48550/arxiv.2307.12906,,10.48550/arxiv.2307.12906,,,0,,0,true,cc-by,green
134-203-390-704-571,QAmplifyNet: pushing the boundaries of supply chain backorder prediction using interpretable hybrid quantum-classical neural network.,2023-10-25,2023,journal article,Scientific reports,20452322,Springer Science and Business Media LLC,United Kingdom,Md Abrar Jahin; Md Sakib Hossain Shovon; Md Saiful Islam; Jungpil Shin; M F Mridha; Yuichi Okuyama,"Supply chain management relies on accurate backorder prediction for optimizing inventory control, reducing costs, and enhancing customer satisfaction. Traditional machine-learning models struggle with large-scale datasets and complex relationships. This research introduces a novel methodological framework for supply chain backorder prediction, addressing the challenge of collecting large real-world datasets with 90% accuracy. Our proposed model demonstrates remarkable accuracy in predicting backorders on short and imbalanced datasets. We capture intricate patterns and dependencies by leveraging quantum-inspired techniques within the quantum-classical neural network QAmplifyNet. Experimental evaluations on a benchmark dataset establish QAmplifyNet's superiority over eight classical models, three classically stacked quantum ensembles, five quantum neural networks, and a deep reinforcement learning model. Its ability to handle short, imbalanced datasets makes it ideal for supply chain management. We evaluate seven preprocessing techniques, selecting the best one based on logistic regression's performance on each preprocessed dataset. The model's interpretability is enhanced using Explainable artificial intelligence techniques. Practical implications include improved inventory control, reduced backorders, and enhanced operational efficiency. QAmplifyNet also achieved the highest F1-score of 94% for predicting ""Not Backorder"" and 75% for predicting ""backorder,"" outperforming all other models. It also exhibited the highest AUC-ROC score of 79.85%, further validating its superior predictive capabilities. QAmplifyNet seamlessly integrates into real-world supply chain management systems, empowering proactive decision-making and efficient resource allocation. Future work involves exploring additional quantum-inspired techniques, expanding the dataset, and investigating other supply chain applications. This research unlocks the potential of quantum computing in supply chain optimization and paves the way for further exploration of quantum-inspired machine learning models in supply chain management. Our framework and QAmplifyNet model offer a breakthrough approach to supply chain backorder prediction, offering superior performance and opening new avenues for leveraging quantum-inspired techniques in supply chain management.",13,1,18246,18246,Interpretability; Computer science; Supply chain; Artificial neural network; Benchmark (surveying); Artificial intelligence; Machine learning; Data mining; Law; Political science; Geography; Geodesy,Engineering; Mathematics and computing,,,,https://www.nature.com/articles/s41598-023-45406-7.pdf https://doi.org/10.1038/s41598-023-45406-7 https://pmc.ncbi.nlm.nih.gov/articles/PMC10600161/pdf/41598_2023_Article_45406.pdf https://www.ncbi.nlm.nih.gov/pmc/articles/10600161,http://dx.doi.org/10.1038/s41598-023-45406-7,37880386,10.1038/s41598-023-45406-7,,PMC10600161,0,002-018-348-707-997; 002-086-594-987-490; 004-246-118-085-51X; 005-897-273-794-880; 007-587-447-821-228; 008-928-979-228-782; 009-870-933-968-467; 012-065-150-005-206; 013-231-635-980-162; 014-082-107-904-334; 014-520-767-877-391; 015-579-750-418-298; 017-929-057-292-981; 025-916-718-275-458; 026-638-864-832-151; 029-706-906-093-942; 029-803-646-760-538; 030-589-504-330-533; 032-879-282-531-038; 037-036-633-916-412; 038-224-180-823-970; 048-458-420-759-977; 050-254-268-053-140; 055-999-087-584-434; 062-991-804-341-046; 066-129-271-213-035; 071-645-090-606-35X; 073-327-254-944-566; 079-452-557-990-843; 079-563-671-471-846; 081-238-786-593-918; 089-684-083-469-583; 095-024-338-859-297; 097-320-410-698-846; 097-548-300-492-354; 100-248-510-663-352; 105-963-593-136-99X; 106-944-685-498-501; 112-607-213-452-919; 119-924-958-013-914; 120-409-132-365-453; 127-992-632-103-359; 138-876-057-304-445; 158-921-799-770-037; 160-208-842-957-138; 189-071-951-639-700,31,true,"CC BY, CC BY-NC-ND",gold
137-702-839-933-135,Deep Learning Based Multi Constraint Hybrid Optimization Algorithm for Transshipment-Based Inventory Routing with Dynamic Demands,2024-12-05,2024,journal article,International Journal of Networked and Distributed Computing,22117938; 22117946,Springer Science and Business Media LLC,,Sreeparnesh Sharma Sivadevuni; Naveen J,"The Inventory-Routing Problem (IRP) is considered a major issue in supply chain management as it comprises two areas: vehicle routing and inventory control. The existing techniques were unable to incorporate location details for enhancing the decision-making and it failed to consider the uncertainty of the demands. Hence to solve this issue, a Snake Artificial Ecosystem Optimization (SAEO) algorithm is proposed in this paper. The SAEO algorithm is developed to address the transshipment IRP with dynamic demands by combining the AEO model and SO to enhance the optimizer's performance. Further, a penalty strategy is proposed, where Deep Quantum Neural Network (DQNN) is employed for calculating the penalty for verifying the feasibility of the solution generated in case of violations in model constraints. In addition, the efficiency of the proposed SAEO-DQNN technique is examined by considering metrics, like transportation cost, transshipment cost, and total cost, and it achieved improved values of 0.391, 0.518, and 1.012 when compared to existing techniques such as Genetic Algorithm with Deep Reinforcement Learning (GA + Deep RL) and Kernel Search Multi-vehicle IRP (KSMIRP).",13,1,,,Transshipment (information security); Computer science; Routing (electronic design automation); Constraint (computer-aided design); Algorithm; Mathematical optimization; Artificial intelligence; Engineering; Mathematics; Computer network; Computer security; Mechanical engineering,,,,,https://link.springer.com/content/pdf/10.1007/s44227-024-00048-7.pdf https://doi.org/10.1007/s44227-024-00048-7,http://dx.doi.org/10.1007/s44227-024-00048-7,,10.1007/s44227-024-00048-7,,,0,001-250-375-948-50X; 005-907-787-936-352; 012-570-627-546-921; 017-163-923-780-169; 022-313-279-750-939; 035-672-702-425-049; 054-259-719-537-805; 057-331-412-514-29X; 057-372-470-689-689; 062-554-440-931-911; 063-675-545-623-170; 065-752-951-360-475; 074-915-185-083-295; 077-767-946-075-466; 085-724-140-817-336; 106-290-586-573-836; 109-689-912-508-911; 117-124-943-943-600; 129-052-333-523-217; 155-468-422-611-106; 182-661-653-030-521; 184-347-092-529-994,2,true,"CC BY, CC BY-NC-ND",gold
137-816-275-790-102,Secure and Reliable Big-Data-Based Decision Making Using Quantum Approach in IIoT Systems.,2023-05-18,2023,journal article,"Sensors (Basel, Switzerland)",14248220; 14243210,Multidisciplinary Digital Publishing Institute (MDPI),Switzerland,Abir El Azzaoui; Mikail Mohammed Salim; Jong Hyuk Park,"Nowadays, the industrial Internet of things (IIoT) and smart factories are relying on intelligence and big data analytics for large-scale decision making. Yet, this method is facing critical challenges regarding computation and data processing due to the complexity and heterogeneous nature of big data. Smart factory systems rely primarily on the analysis results to optimize production, predict future market directions, prevent and manage risks, and so on. However, deploying the existing classical solutions such as machine learning, cloud, and AI is not effective anymore. Smart factory systems and industries need novel solutions to sustain their development. On the other hand, with the fast development of quantum information systems (QISs), multiple sectors are studying the opportunities and challenges of implementing quantum-based solutions for a more efficient and exponentially faster processing time. To this end, in this paper, we discuss the implementation of quantum solutions for reliable and sustainable IIoT-based smart factory development. We depict various applications where quantum algorithms could improve the scalability and productivity of IIoT systems. Moreover, we design a universal system model where smart factories would not need to acquire quantum computers to run quantum algorithms based on their needs; instead, they can use quantum cloud servers and quantum terminals implemented at the edge layer to help them run the desired quantum algorithms without the need of an expert. To prove the feasibility of our model, we implement two real-world case studies and evaluate their performance. The analysis shows the benefits of quantum solutions in different sectors of smart factories.",23,10,4852,4852,Computer science; Scalability; Big data; Quantum computer; Cloud computing; Factory (object-oriented programming); Distributed computing; Quantum; Data science; Data mining; Database; Quantum mechanics; Physics; Operating system; Programming language,IIoT; quantum algorithms; quantum approximate optimization algorithm; quantum neural network; smart factory,,,This study was supported by the Research Program funded by the SeoulTech (Seoul Na-tional University of Science and Technology),https://www.mdpi.com/1424-8220/23/10/4852/pdf?version=1684377791 https://doi.org/10.3390/s23104852 https://pmc.ncbi.nlm.nih.gov/articles/PMC10222651/pdf/sensors-23-04852.pdf https://www.ncbi.nlm.nih.gov/pmc/articles/10222651,http://dx.doi.org/10.3390/s23104852,37430766,10.3390/s23104852,,PMC10222651,0,000-299-728-119-557; 008-407-448-457-494; 009-229-350-918-747; 010-922-688-634-929; 013-276-532-141-883; 015-138-683-835-935; 022-380-596-265-048; 038-603-036-885-878; 059-637-827-027-922; 068-218-734-440-54X; 072-634-149-803-626; 090-751-267-392-755; 091-250-744-654-473; 126-823-649-722-662; 142-493-990-891-84X; 159-820-346-496-040; 183-888-703-800-583,19,true,cc-by,gold
139-270-326-753-493,A Blockchain-Based Authentication Solution for 6G Communication Security in Tactile Networks,2022-04-25,2022,journal article,Electronics,20799292,MDPI AG,,Khurram Shahzad; Ahmad O. Aseeri; Munam Ali Shah,"<jats:p>In this era, the ultimate vision is to transform current technologies into intelligent global environments to facilitate everyday transactions. The emerging Industry 4.0 has introduced promising potential technologies that have expedited the transition of Internet of Things (IoT) into the Internet of Everything (IoE), utilizing the advances in artificial intelligence. Such a transition implies that sensitive data can be effortlessly accessed via the open network used by various domains such as military, business, transportation, medical, and education, leading to potential security concerns. Although a blockchain, along with the above fields, already employs a fast network such as 5G, the explosive growth in the development and implementation of various Industry 4.0-related domains requires significantly faster networking speeds and a secure mechanism for data transfer. This exhibits the need for 6G to meet the requirements of real-time applications, as shown in the graphical representation of the abstract. The bulk of this work was performed on a blockchain, but some methodology was needed that fulfilled security at different levels, such as the process level, data level, and infrastructure level. Our contribution in this work was twofold: first, at the process level, a novel smart contract mechanism was described; and second, at the data level, a digital signature methodology was employed that allowed anonymization to authenticate and secure the blockchain without encryption.</jats:p>",11,9,1374,1374,Blockchain; Computer science; Authentication (law); Computer security; Encryption; Process (computing); The Internet; Key (lock); World Wide Web; Operating system,6G; blockchain; authentication; tactile networks; smart contract; Industry 4.0,,,,https://www.mdpi.com/2079-9292/11/9/1374/pdf?version=1650892544 https://doi.org/10.3390/electronics11091374,http://dx.doi.org/10.3390/electronics11091374,,10.3390/electronics11091374,,,0,003-990-986-734-62X; 004-366-946-644-272; 006-916-372-409-201; 014-963-871-775-427; 018-541-770-775-407; 022-782-290-270-882; 024-495-233-980-352; 025-501-708-865-599; 033-827-910-920-969; 041-035-540-675-429; 041-643-196-791-904; 046-653-711-107-881; 047-891-178-074-996; 052-959-731-711-129; 054-079-583-763-10X; 056-554-717-542-138; 083-366-430-872-667; 087-263-590-004-141; 096-091-715-269-337; 098-952-889-146-868; 111-790-816-253-267; 118-199-011-994-291; 128-788-310-983-224; 131-896-697-150-53X; 168-950-076-109-136,19,true,cc-by,gold
143-325-925-966-546,Quantum Machine Learning for Material Synthesis and Hardware Security,2022-08-16,2022,preprint,arXiv (Cornell University),,,,Collin Beaudoin; Satwik Kundu; Rasit Onur Topaloglu; Swaroop Ghosh,"Using quantum computing, this paper addresses two scientifically pressing and day-to-day relevant problems, namely, chemical retrosynthesis which is an important step in drug/material discovery and security of the semiconductor supply chain. We show that Quantum Long Short-Term Memory (QLSTM) is a viable tool for retrosynthesis. We achieve 65% training accuracy with QLSTM, whereas classical LSTM can achieve 100%. However, in testing, we achieve 80% accuracy with the QLSTM while classical LSTM peaks at only 70% accuracy! We also demonstrate an application of Quantum Neural Network (QNN) in the hardware security domain, specifically in Hardware Trojan (HT) detection using a set of power and area Trojan features. The QNN model achieves detection accuracy as high as 97.27%.",,,,,Computer science; Trojan; Domain (mathematical analysis); Set (abstract data type); Quantum; Artificial neural network; Computer engineering; Artificial intelligence; Computer hardware; Computer security; Programming language; Mathematics; Mathematical analysis; Quantum mechanics; Physics,,,,,https://arxiv.org/abs/2208.08273,http://dx.doi.org/10.48550/arxiv.2208.08273,,10.48550/arxiv.2208.08273,,,0,,1,true,,green
146-972-006-162-491,Optimizing Feature Selection for Predictive Analytics With Quantum Algorithms,2024-12-13,2024,book chapter,"Advances in Marketing, Customer Relationship Management, and E-Services",23275502; 23275529,IGI Global,,C. N. Manushree; Hari Deepthi Putluru; Himanshu Khajuria; Chintan Singh; Biswa Prakash Nayak,"<jats:p>Quantum algorithms for predictive analytics is important across various sectors such as finance, healthcare, marketing and supply chain management where accurate predictions can be used to optimise operations and decision-making processes. This chapter addresses Specific quantum machine learning algorithms such as Quantum Support Vector Machines (QSVM), Quantum K-nearest Neighbors (QKNN) and Quantum Neural Networks (QNN). These algorithms enhance classification, regression and complex predictive tasks by accelerating training processes and managing large feature spaces effectively. And, to this, quantum optimization algorithms like Quantum Approximate Optimization Algorithm (QAOA) and Variational Quantum Eigensolver (VQE) are mentioned for their role in optimising model parameters and improving prediction accuracy. In addition, it discusses quantum data encoding methods, such as Quantum Fourier Transform (QFT) and amplitude encoding. Along with this, it acknowledges significant challenges such as hardware limitations, algorithmic complexity and practical integration issues.</jats:p>",,,203,242,Feature selection; Predictive analytics; Computer science; Analytics; Selection (genetic algorithm); Algorithm; Machine learning; Artificial intelligence; Data mining,,,,,,http://dx.doi.org/10.4018/979-8-3693-7673-7.ch009,,10.4018/979-8-3693-7673-7.ch009,,,0,000-418-479-206-973; 002-086-594-987-490; 006-162-973-218-322; 008-468-343-915-662; 013-231-635-980-162; 014-627-318-511-482; 023-184-996-297-899; 030-589-504-330-533; 039-209-268-217-44X; 042-583-916-469-257; 051-048-441-755-20X; 051-454-358-189-773; 082-934-947-254-139; 095-431-297-536-878; 096-330-758-359-960; 105-489-889-052-626; 107-548-128-976-269; 113-076-048-101-221; 113-628-899-736-201; 122-780-713-271-470; 143-582-194-683-784; 161-541-506-505-015; 172-121-038-756-128,2,false,,
147-743-285-952-441,Taking stock of Nature-Based Solutions (NBS): An analysis of global NBS submissions to the United Nations Climate Action Summit in September 2019,,2022,book,,,Center for International Forestry Research (CIFOR),,Zhou W.; Martius C.,"Nature-based solutions have seen increasing emphasis as a means of realizing transformative change for climate change mitigation and adaptation, environmental conservation, and sustainable development. This report examines 187 proposals of nature-based solutions (NBS) submitted to the United Nations Climate Action Summit in September 2019 to assess the breadth, nature, and potential impact of this emerging paradigm for climate change mitigation and adaptation, environmental conservation, and sustainable development. Noting the self-selected nature of the sample and the public nature of its intended forum, this analysis nonetheless considers these contributions in aggregate as illustrative of the variety of current conceptions and practices of NBS. The analysis finds that forests, cultivated landscapes, and marine and coastal regions comprise the main ecosystems of interest, with NBS most often taking the form of technological change and innovation. The analysis identifies certain concerns for NBS design and implementation, with the majority of submissions failing to provide adequate information on safeguards, transparency, and monitoring. Furthermore, only four submissions provide comprehensive explanations of how their proposed contribution comprises a nature-based solution, raising questions for the ongoing operationalization of NBS as a coherent body of practice. Finally, only 28 contributions are identified as possessing high transformational potential in their sectors of intervention, assessed on the basis of the scale, speed, sustainability and depth of proposed changes. While these findings suggest that submissions with both high transformational potential and a high likelihood of success are often smaller-scale interventions adapted to their sites of implementation, this raises questions of whether NBS will be able to attain the scale and depth necessary to meet expectations for their sustained and transformational impact.",,,,,Summit; Stock (firearms); Action (physics); Political science; Climate change; Climatology; Geography; Physical geography; Biology; Ecology; Physics; Archaeology; Quantum mechanics; Geology,,,,,https://www.cifor.org/publications/pdf_files/WPapers/WP282Zhou.pdf https://doi.org/10.17528/cifor/008453,http://dx.doi.org/10.17528/cifor/008453,,10.17528/cifor/008453,,,0,,1,true,cc-by,hybrid
148-258-305-882-338,Quantum Neural Networks for a Supply Chain Logistics Application,2023-05-18,2023,journal article,Advanced Quantum Technologies,25119044,Wiley,,Randall Correll; Sean J. Weinberg; Fabio Sanches; Takanori Ide; Takafumi Suzuki,"<jats:title>Abstract</jats:title>;                   <jats:p>Problem instances of a size suitable for practical applications are not likely to be addressed during the noisy intermediate‐scale quantum (NISQ) period with (almost) pure quantum algorithms. Hybrid classical‐quantum algorithms have potential, however, to achieve good performance on much larger problem instances. One such hybrid algorithm on a problem of substantial importance: vehicle routing for supply chain logistics with multiple trucks and complex demand structure is investigated. Reinforcement learning with neural networks with embedded quantum circuits is used. In such neural networks, projecting high‐dimensional feature vectors down to smaller vectors is necessary to accommodate restrictions on the number of qubits of NISQ hardware. However, a multi‐head attention mechanism is used where, even in classical machine learning, such projections are natural and desirable. Data from the truck routing logistics of a company in the automotive sector is considered, and the methodology is applied by decomposing into small teams of trucks and results are found comparable to human truck assignment.</jats:p>",6,7,,,Truck; Computer science; Routing (electronic design automation); Automotive industry; Artificial neural network; Reinforcement learning; Supply chain; Feature (linguistics); Quantum; Vehicle routing problem; Quantum computer; Artificial intelligence; Industrial engineering; Embedded system; Engineering; Automotive engineering; Law; Quantum mechanics; Philosophy; Physics; Political science; Aerospace engineering; Linguistics,,,,,https://onlinelibrary.wiley.com/doi/pdfdirect/10.1002/qute.202200183 https://doi.org/10.1002/qute.202200183,http://dx.doi.org/10.1002/qute.202200183,,10.1002/qute.202200183,,,0,010-908-655-963-071; 014-560-771-104-929; 028-092-362-584-160; 028-613-332-356-838; 031-652-295-545-276; 050-722-322-379-534; 064-156-753-280-573; 073-546-598-703-82X; 090-495-403-112-974; 100-989-214-961-687; 120-271-748-897-539; 159-188-705-708-150; 166-170-555-211-410,12,true,cc-by,hybrid
