Lens ID,Title,Date Published,Publication Year,Publication Type,Source Title,ISSNs,Publisher,Source Country,Author/s,Abstract,Volume,Issue Number,Start Page,End Page,Fields of Study,Keywords,MeSH Terms,Chemicals,Funding,Source URLs,External URL,PMID,DOI,Microsoft Academic ID,PMCID,Citing Patents Count,References,Citing Works Count,Is Open Access,Open Access License,Open Access Colour
133-397-926-981-414,AAAI - Reinforcement Mechanism Design: With Applications to Dynamic Pricing in Sponsored Search Auctions,2020-04-03,2020,journal article,Proceedings of the AAAI Conference on Artificial Intelligence,23743468; 21595399,Association for the Advancement of Artificial Intelligence (AAAI),,Weiran Shen; Binghui Peng; Hanpeng Liu; Michael Zhang; Ruohan Qian; Hong Yan; Guo Zhi; Ding Zongyao; Pengjun Lu; Pingzhong Tang,"In many social systems in which individuals and organizations interact with each other, there can be no easy laws to govern the rules of the environment, and agents' payoffs are often influenced by other agents' actions. We examine such a social system in the setting of sponsored search auctions and tackle the search engine's dynamic pricing problem by combining the tools from both mechanism design and the AI domain. In this setting, the environment not only changes over time, but also behaves strategically. Over repeated interactions with bidders, the search engine can dynamically change the reserve prices and determine the optimal strategy that maximizes the profit. We first train a buyer behavior model, with a real bidding data set from a major search engine, that predicts bids given information disclosed by the search engine and the bidders' performance data from previous rounds. We then formulate the dynamic pricing problem as an MDP and apply a reinforcement-based algorithm that optimizes reserve prices over time. Experiments demonstrate that our model outperforms static optimization strategies including the ones that are currently in use as well as several other dynamic ones.",34,02,2236,2243,Mathematical optimization; Mechanism design; Common value auction; Social system; Profit (economics); Consumer behaviour; Dynamic pricing; Computer science; Bidding; Search engine,,,,,https://arxiv.org/abs/1711.10279 https://dblp.uni-trier.de/db/conf/aaai/aaai2020.html#ShenPLZQHGDLT20 https://ojs.aaai.org/index.php/AAAI/article/view/5600 https://aaai.org/ojs/index.php/AAAI/article/view/5600,http://dx.doi.org/10.1609/aaai.v34i02.5600,,10.1609/aaai.v34i02.5600,2998596932,,0,,33,true,,gold
138-332-765-974-719,Combined Use of Hybrid Optimization and Quantum-Enhanced Neural Evolution for Predicting Cost and Charge Dynamics of Electric Vehicles,2025-02-28,2025,conference proceedings article,2025 4th International Conference on Smart Grid and Green Energy (ICSGGE),,IEEE,,Muhammad Zeshan Afzal; Fushuan Wen; Nimrah Saeed,"This paper introduces EcoSwarm, a bio-inspired hybrid optimization algorithm aimed at enhancing cost efficiency and charge management in electric vehicle (EV) fleets. EcoSwarm leverages Quantum-Enhanced Neural Evolution (QENE), which integrates quantum computing principles with neural evolution to significantly improve prediction accuracy and operational efficiency. Unlike traditional optimization methods, EcoSwarm employs quantum-inspired probabilistic transitions to explore a broader solution space, increasing the likelihood of achieving global optimal solutions. The proposed approach demonstrates $\mathbf{3 5 . 6 \%}$ reduction in operational costs and achieves $\mathbf{9 2 . 1 \%}$ energy utilization efficiency—surpassing the Particle Swarm Optimization (PSO) and Genetic Algorithm (GA) by at least 11.3% and $15.8 \%$, respectively. Furthermore, EcoSwarm enhances charging demand prediction accuracy by $32 \%$, as measured by the Mean Absolute Error (MAE), showcasing its capability to manage large-scale and dynamic EV fleets effectively. EcoSwarm is highly scalable and adaptable, making it suitable for addressing challenges in large-scale EV fleet management. Future research will explore its application in real-time autonomous fleet management, optimization systems, and smart grids as integral components of sustainable mobility solutions.",,,504,510,Quantum; Charge (physics); Computer science; Dynamics (music); Physics; Quantum mechanics; Acoustics,,,,,,http://dx.doi.org/10.1109/icsgge64667.2025.10984914,,10.1109/icsgge64667.2025.10984914,,,0,001-045-721-488-84X; 029-136-412-313-771; 039-184-115-411-454; 041-964-528-107-986; 056-633-291-784-345; 073-401-879-964-447; 076-383-552-313-450; 079-554-728-514-735; 091-443-886-800-000; 107-990-054-670-241; 108-657-204-003-346; 137-602-547-155-580; 138-323-553-881-268; 157-515-646-809-957; 177-014-990-978-573; 180-722-191-202-758,0,false,,
142-007-600-271-009,Threats to Autonomy from Emerging ICTs,2017-11-26,2017,journal article,Australasian Journal of Information Systems,14498618; 13262238,Australasian Association for Information Systems,Australia,Brandt Dainow,"This paper examines threats to autonomy created by significant emerging ICTs. Emerging ICTs cover a wide range of technologies, from intelligent environments to neuroelectronics, and human autonomy is potentially threatened by all of them in some way. However, there is no single agreed definition of autonomy. This paper therefore considers the ways in which different accounts of autonomy are impacted by the different IC technologies. From this range of threats we will derive some properties which any ICT must exhibit in order to threaten human autonomy. Finally, we will show how the range of definitions of autonomy creates problems for customary approaches to vale-sensitive design, and how this indicates a need for greater flexibility when attempting to improve the ethical status of emerging ICTs.",21,,,,Environmental resource management; Internet privacy; Business; Order (exchange); ICTS; Value sensitive design; Flexibility (engineering); Autonomy; Information and Communications Technology,ICT; ethics; autonomy; foresight studies; futures research; ETICA; value-sensitive design smart city  computer  society  actor-network theory  autopoiesis  future internet,,,,https://mural.maynoothuniversity.ie/10852/ https://journal.acs.org.au/index.php/ajis/article/view/1438 https://journal.acs.org.au/index.php/ajis/article/download/1438/790 https://core.ac.uk/display/132175254,http://dx.doi.org/10.3127/ajis.v21i0.1438,,10.3127/ajis.v21i0.1438,2769959411,,0,000-974-102-618-529; 001-487-021-568-062; 002-469-218-702-269; 005-329-785-667-695; 005-602-720-513-550; 007-748-166-226-806; 012-404-639-642-263; 012-825-985-377-760; 016-801-824-017-237; 017-479-713-590-384; 024-843-804-998-440; 028-977-889-948-547; 040-743-618-343-805; 042-185-288-382-674; 053-448-893-630-403; 055-738-329-874-480; 062-433-529-053-659; 065-298-009-236-195; 067-575-939-737-223; 070-514-287-311-401; 072-337-349-649-351; 075-700-090-078-985; 085-947-833-249-990; 088-973-740-245-593; 091-910-554-720-952; 100-582-803-140-559; 102-904-983-106-383; 110-352-060-681-264; 115-282-843-998-402; 124-671-939-858-725; 128-084-786-874-730; 138-848-579-748-192; 168-573-615-112-094; 169-491-080-559-363; 175-609-289-958-021; 176-934-348-809-196; 193-972-461-401-903; 198-274-772-820-121,2,true,cc-by-nc,gold
152-317-135-208-181,Universal machine learning framework for defect predictions in zinc blende semiconductors.,2022-02-14,2022,journal article,"Patterns (New York, N.Y.)",26663899,,United States,Arun Mannodi-Kanakkithodi; Xiaofeng Xiang; Laura Jacoby; Robert Biegaj; Scott T Dunham; Daniel R Gamelin; Maria K Y Chan,"We develop a framework powered by machine learning (ML) and high-throughput density functional theory (DFT) computations for the prediction and screening of functional impurities in groups IV, III-V, and II-VI zinc blende semiconductors. Elements spanning the length and breadth of the periodic table are considered as impurity atoms at the cation, anion, or interstitial sites in supercells of 34 candidate semiconductors, leading to a chemical space of approximately 12,000 points, 10% of which are used to generate a DFT dataset of charge dependent defect formation energies. Descriptors based on tabulated elemental properties, defect coordination environment, and relevant semiconductor properties are used to train ML regression models for the DFT computed neutral state formation energies and charge transition levels of impurities. Optimized kernel ridge, Gaussian process, random forest, and neural network regression models are applied to screen impurities with lower formation energy than dominant native defects in all compounds.",3,3,100450,100450,Density functional theory; Semiconductor; Impurity; Kernel (algebra); Materials science; Hybrid functional; Zinc; Machine learning; Computational chemistry; Chemical physics; Chemistry; Computer science; Optoelectronics; Mathematics; Metallurgy; Combinatorics; Organic chemistry,combinatorial screening; computational materials science; density functional theory; high-throughput data; machine learning; materials informatics; mid-gap states; point defects; semiconductors,,,,http://www.cell.com/article/S266638992200023X/pdf https://doi.org/10.1016/j.patter.2022.100450,http://dx.doi.org/10.1016/j.patter.2022.100450,35510195,10.1016/j.patter.2022.100450,,PMC9058924,0,000-243-282-934-262; 002-408-211-857-111; 003-116-864-727-746; 005-951-272-296-382; 008-401-884-943-90X; 008-459-550-240-480; 009-031-909-950-980; 010-316-928-247-646; 012-422-217-071-260; 013-024-954-048-418; 014-289-256-859-619; 014-490-150-047-350; 022-501-403-782-152; 026-938-136-460-358; 035-136-534-940-172; 035-959-864-848-739; 037-062-343-419-599; 037-259-267-491-634; 037-669-756-017-177; 040-024-171-977-455; 040-995-783-961-229; 041-957-648-387-075; 042-006-504-103-021; 043-480-126-415-080; 045-241-944-244-564; 047-984-584-447-156; 048-119-178-496-251; 048-527-400-186-653; 050-026-487-748-837; 051-979-233-435-645; 053-001-127-913-788; 055-604-411-522-616; 058-838-976-536-24X; 059-074-323-461-50X; 061-209-977-327-913; 066-418-743-151-241; 066-939-222-342-767; 067-868-868-171-013; 068-731-781-289-51X; 069-441-584-756-415; 076-960-282-348-73X; 077-055-900-689-707; 081-191-627-207-228; 081-964-381-098-536; 086-329-712-974-465; 088-110-781-689-269; 088-414-627-470-392; 089-389-668-851-591; 091-465-014-236-024; 092-565-569-639-315; 093-396-377-908-498; 094-048-287-001-396; 095-947-034-675-291; 100-698-555-730-238; 100-908-100-819-239; 101-304-061-510-579; 102-338-599-819-916; 104-470-305-583-532; 104-900-988-788-816; 107-608-928-539-456; 109-697-512-479-226; 112-560-383-414-709; 120-269-602-300-071; 121-509-304-679-577; 121-813-772-720-792; 123-498-859-171-509; 125-719-794-126-246; 126-274-660-662-980; 127-827-561-130-149; 128-669-072-498-263; 133-450-651-090-283; 136-594-409-167-459; 137-131-614-903-166; 140-983-697-518-893; 144-685-648-867-616; 147-097-008-896-388; 147-948-873-530-439; 175-249-388-084-984,46,true,"CC BY, CC BY-NC-ND",gold
158-748-668-313-075,"Battery Energy Storage Systems (BESSs) and the Economy-Dynamics of Microgrids: Review, Analysis, and Classification for Standardization of BESSs Applications",2022-06-30,2022,preprint,,,Institute of Electrical and Electronics Engineers (IEEE),,Mohsen Eskandari; Amin Rajabi; Andrey Savkin; Mohammad H. Moradi; Zhao Yang Dong,"<jats:p>The literature on microgrid (MG) studies can be categorized as those that investigated the dynamics or economics of MG systems. Due to the important roles of battery energy storage systems (BESSs) in MGs, the BESSs have been involved in both economics and dynamics studies but mostly separately due to the different time constants of studies. Whereas, in the complicated modern MGs, the BESS is the joint point that bridges these two studies. Thus, studying merely one aspect of economy-dynamic without considering the other aspect would not be accurate. To bridge this gap, this paper reviews, analysis and classifies the BESSs applications, based on their time constants, by merging of which helps researchers to develop joint economy-dynamics models that would be the future trend in the field. The classified BESS applications are 1) inertia synthesis, 2) primary frequency response to compensate slow response time of micro-sources (MSs) for load tracking, 3) real-time energy management for the integration of intermittent renewables, 4) economic dispatch and optimal power flow for improving steady-state performance, and 5) slack bus realization. The research gaps and future trends have been discussed throughout the paper and are summarized in the future trend section.</jats:p>",,,,,Standardization; Computer science; Inertia; Microgrid; Renewable energy; Realization (probability); Engineering; Electrical engineering; Mathematics; Operating system; Classical mechanics; Physics; Statistics,Economic dispatch; battery energy storage systems (ESSs); dynamics; microgrids; renewable energy sources (RESs); primary frequency response; virtual inertia synthesis,,,,https://www.techrxiv.org/articles/preprint/Battery_Energy_Storage_Systems_BESSs_and_the_Economy-Dynamics_of_Microgrids_Review_Analysis_and_Classification_for_Standardization_of_BESSs_Applications/16807279/3/files/36040676.pdf https://doi.org/10.36227/techrxiv.16807279,http://dx.doi.org/10.36227/techrxiv.16807279,,10.36227/techrxiv.16807279,,,0,,0,true,cc-by,gold
161-082-986-753-80X,"Improved Weighted Quantum Whale Optimization with vision transformer for intrusion detection, atmospheric monitoring and recommendation in smart agriculture.",2025-11-18,2025,journal article,Scientific reports,20452322,Springer Science and Business Media LLC,United Kingdom,A Menaka; K Sakthivel,"Precision farming enables farmers to make informed decisions regarding fertilization, irrigation, and harvesting by leveraging IoT-enabled sensors that collect real-time data on moisture, temperature, soil nutrients, and other environmental factors. Wireless Sensor Networks (WSNs) in agriculture face challenges such as high energy consumption, security vulnerabilities, and limited real-time data processing capabilities. To address these issues, this paper proposes an Improved Weighted Quantum Whale Optimization (IWQWO) integrated with a Vision Transformer (ViT) for secure and efficient environmental monitoring and intrusion detection in smart agriculture. The IWQWO algorithm combines quantum-inspired techniques with adaptive weighting to optimize node clustering, routing efficiency, and anomaly detection, enhancing energy efficiency and system security. Concurrently, the Vision Transformer captures spatial-temporal relationships in sensor data, ensuring high-precision monitoring, improved intrusion detection, and reduced false alarms. The framework also facilitates resource management, supply-demand prediction, and integration of modern IoT technologies with traditional agricultural practices, including automated irrigation, drone-assisted monitoring, and plant disease detection. Extensive evaluations demonstrate that the proposed IWQWO-ViT model surpasses existing approaches in detection accuracy, cost-effectiveness, and network reliability, offering a robust solution for intelligent, secure, and sustainable agricultural automation.",15,1,40526,40526,,Agricultural automation; Anomaly detection; Atmospheric monitoring; Crop surveillance; Improved Weighted Quantum Whale Optimization; Internet of things; Intrusion detection; Precision agriculture; Recommendation system; Smart agriculture; Vision transformer; Wireless sensor networks,,,,https://www.nature.com/articles/s41598-025-24425-6.pdf https://doi.org/10.1038/s41598-025-24425-6,http://dx.doi.org/10.1038/s41598-025-24425-6,41254081,10.1038/s41598-025-24425-6,,PMC12627707,0,004-608-265-989-020; 007-496-278-827-413; 009-640-660-957-506; 030-943-506-092-179; 031-751-824-811-829; 037-908-513-944-457; 038-733-827-737-13X; 050-240-169-449-249; 054-641-734-054-091; 064-016-672-339-110; 072-274-445-576-388; 074-604-140-662-172; 078-125-342-680-624; 092-867-457-835-534; 096-452-702-244-73X; 097-643-532-454-002; 103-416-305-475-984; 109-665-416-407-04X; 111-650-389-868-085; 112-499-178-042-037; 112-984-895-120-818; 118-122-307-262-203; 124-413-635-847-38X; 136-886-151-845-033; 137-668-204-343-557; 138-604-119-758-436; 147-817-278-296-705; 153-832-897-866-431; 156-311-217-649-800; 172-084-258-447-538; 172-340-252-726-923; 184-759-865-048-684,1,true,"CC BY, CC BY-NC-ND",gold
161-301-415-013-83X,Predicting Demand in Supply Chain Networks With Quantum Machine Learning Approach,2024-06-30,2024,book chapter,"Advances in Logistics, Operations, and Management Science",2327350x; 23273518,IGI Global,,Sunil Kumar Sehrawat; Pushan Kumar Dutta; Ashima Bhatnagar Bhatia; Pawan Whig,"<jats:p>This chapter explores the application of quantum machine learning (QML) techniques for demand prediction in supply chain networks. Traditional demand forecasting methods often struggle to capture the intricate dynamics and uncertainties present in modern supply chains. By leveraging the computational power and probabilistic nature of quantum computing, coupled with the flexibility and adaptability of machine learning algorithms, organizations can enhance the accuracy and efficiency of their demand prediction processes. This chapter provides an overview of QML methodologies tailored specifically for demand prediction in supply chain networks, highlighting their advantages over classical approaches. Through case studies and practical examples, the chapter demonstrates how QML can enable organizations to make more informed decisions, optimize inventory levels, and improve overall supply chain performance.</jats:p>",,,33,47,Computer science; Supply chain; On demand; Quantum; Business; Physics; Quantum mechanics; Marketing; Multimedia,,,,,,http://dx.doi.org/10.4018/979-8-3693-4107-0.ch002,,10.4018/979-8-3693-4107-0.ch002,,,0,027-487-446-697-250; 037-587-316-143-55X; 045-425-270-443-255; 096-075-072-784-959; 105-578-356-183-011; 127-200-898-240-504; 134-203-390-704-571; 151-327-746-441-348; 173-314-795-345-18X,11,false,,
186-179-353-816-530,Toward intelligent IoT scheduling with quantum-inspired latent models for energy and latency optimization.,2026-01-19,2026,journal article,Scientific reports,20452322,Springer Science and Business Media LLC,United Kingdom,Tahir Alyas; Qaiser Abbas; Adeela Hayat; Waqas Nawaz; Abdullah Alshanqiti; Hani Almoamari; Aidarus Mohamed Ibrahim,"Classical IoT scheduling methods, such as Greedy heuristics, Genetic Algorithms, Particle Swarm Optimisation, and Reinforcement Learning have difficulty in finding an optimistic compromise between latency and energy usage since they stay local search, slow convergence, and cannot express the hidden task resource interaction found in heterogeneous and dynamic Internet of Things settings. These constraints result in inefficient performance when workloads change, when workloads vary in round-trip time (RTT), and under mass distributed deployments. To address them, the quantum-inspired latent scheduling framework presented in this paper combines learning a latent representation with tunnelling-based global Optimisation. The latent encoder unravels small-task resource embeddings that uncover latent interactions, whereas the quantum-inspired search leverages superposition-driven exploration to circumvent local minima and adapt to changing network states. Although the dataset is benchmark-based, it captures realistic RTT variability patterns reported in large-scale IoT systems. Experimental results show that the proposed model reduces latency by up to 25% and energy consumption by up to 28% compared to classical baselines. The framework has been tested using convergence analysis and scalability tests to support its superiority in multi-objective Optimisation. These results can guide the future of quantum-inspired latent modelling to be a scalable, interpretable and energy-efficient next-generation IoT scheduling technique.",16,1,4234,4234,Computer science; Scheduling (production processes); Scalability; Distributed computing; Latency (audio); Energy consumption; Internet of Things; Cloud computing; Reinforcement learning; Particle swarm optimization; Efficient energy use; Premature convergence; Cluster analysis; Machine learning; Artificial intelligence; Dynamic priority scheduling; Maxima and minima; Convergence (economics); Coding (social sciences); Encoder; Real-time computing,Energy efficiency; IoT scheduling; Latency reduction; Multi-objective analysis; Quantum-inspired optimisation,,,,https://www.nature.com/articles/s41598-025-34374-9_reference.pdf https://doi.org/10.1038/s41598-025-34374-9,http://dx.doi.org/10.1038/s41598-025-34374-9,41554893,10.1038/s41598-025-34374-9,,PMC12859146,0,011-578-432-581-065; 013-233-533-121-438; 016-141-705-581-483; 024-387-222-433-064; 025-716-516-360-658; 031-597-887-067-299; 031-815-826-160-740; 040-383-915-491-955; 041-335-084-328-54X; 054-367-574-412-611; 069-161-284-397-231; 075-842-197-671-117; 084-460-375-584-773; 085-492-447-684-259; 095-291-457-727-63X; 096-649-238-348-920; 100-663-677-552-038; 107-223-205-356-421; 107-908-795-966-95X; 115-379-852-877-435; 132-250-855-412-309; 133-714-649-697-314; 143-911-669-613-531; 155-164-478-613-394; 178-246-459-869-275; 183-288-981-432-785; 188-127-001-598-339; 189-234-738-096-595; 193-743-366-018-464; 199-580-668-816-685,0,true,"CC BY, CC BY-NC-ND",gold
187-483-359-890-54X,Integrating high dimensional quadratic regression with penalties based predictive modeling for hydro power plants accurate tariff prediction.,2025-07-12,2025,journal article,Scientific reports,20452322,Springer Science and Business Media LLC,United Kingdom,Ritesh Dash; Anupa Sinha; Abinash Mahapatro; Bhabasis Mohapatra; Binod Kumar Sahu,"In order to optimize the financial and operational cost of an hydropower plant in a micro-grid operation, it is required to accurately forecast the per unit generation cost and per unit selling price in a competitive energy trading market. This study presents a novel high dimensional quadratic regression with penalty based predictive model for forecasting generation cost and selling price per unit in hydroelectric energy systems. The proposed model addresses the limitations of conventional method such as SVR, SARIMA and LSTM by integrating polynomial interaction terms with L2 regularization to balance model complexity and generalization. A total of 12 features including operational variables and nonlinear combinations are pre-processed using outlier detection normalization and interpolation techniques. The model is benchmarked across multiple time intervals using a comprehensive set of key performance indicators. Compared to benchmarking models, the proposed approach consistently achieves the lowest forecast error. Computational complexity is minimized with 100 parameters and training time of 2 s. Graphical and numerical evaluations confirm the model's accuracy and suitability for spot market forecasting within hydro-DISCOM integration. The study concludes with recommendations for real time deployment and extension into hybrid intelligent forecasting framework. In future the work can also be integrated to different policy & weather dynamics and impact analysis in predicting the per unit selling price of the energy.",15,1,25197,25197,Regression; Predictive power; Regression analysis; Computer science; Quadratic equation; Tariff; Power (physics); Econometrics; Statistics; Mathematics; Machine learning; Economics; International trade; Physics; Epistemology; Philosophy; Quantum mechanics; Geometry,Energy market; Hydro power plants; Quadratic regression; Quantum computing; Regression analysis; Tariff,,,Siksha 'O' Anusandhan Deemed To Be University,https://www.nature.com/articles/s41598-025-09366-4.pdf https://doi.org/10.1038/s41598-025-09366-4,http://dx.doi.org/10.1038/s41598-025-09366-4,40652004,10.1038/s41598-025-09366-4,,PMC12255676,0,000-409-859-128-343; 010-412-320-494-876; 018-334-026-233-296; 020-602-763-041-868; 023-436-951-658-441; 031-544-230-400-211; 035-309-577-554-274; 036-378-117-160-106; 042-893-920-851-284; 048-695-339-790-765; 054-094-268-227-732; 055-203-335-635-004; 057-081-782-062-156; 065-503-455-538-214; 069-228-363-500-691; 074-489-849-085-033; 080-401-101-832-172; 083-012-787-425-351; 084-691-985-090-226; 090-664-964-083-231; 095-451-809-905-71X; 097-322-492-511-481; 105-636-055-156-514; 112-447-273-796-350; 150-608-948-955-691; 166-057-854-625-58X; 169-316-581-833-748; 174-171-628-011-677,0,true,"CC BY, CC BY-NC-ND",gold
