Lens ID,Title,Date Published,Publication Year,Publication Type,Source Title,ISSNs,Publisher,Source Country,Author/s,Abstract,Volume,Issue Number,Start Page,End Page,Fields of Study,Keywords,MeSH Terms,Chemicals,Funding,Source URLs,External URL,PMID,DOI,Microsoft Academic ID,PMCID,Citing Patents Count,References,Citing Works Count,Is Open Access,Open Access License,Open Access Colour
071-792-301-677-677,Edge-enabled quantum-safe real-time vaccine supply chain optimization: a decentralized framework for autonomous decision making,2026-02-17,2026,journal article,PeerJ Computer Science,23765992,PeerJ,,Nirupam Saha; Rajesh Bose; Sandip Roy; Shrabani Sutradhar; Sujan Das; Arfat Ahmad Khan; Farman Ali; Ahmad Ali AlZubi; Jazem Mutared Alanazi,"<jats:p>The centralized architectures of global vaccine supply chains pose severe security, latency, and operational efficiency challenges to new threats of quantum computing. The article introduces the initial combined edge-enabled quantum-safe real-time optimization of vaccine supply chain based on multi-access edge computing (MEC), post-quantum cryptography, lightweight machine learning, and blockchain consensus algorithms. The framework uses autonomous decision-making distributed edge nodes, and uses novel algorithms such as hierarchical attention network to resource allocation (HAN-RA), quantum-inspired route optimization (QIRO) and adaptive multi-agent reinforcement learning (AMARL). CRYSTALS-Kyber, CRYSTALS-Dilithium and SPHINCS+ are post-quantum cryptographic protocols that are resistant to both classical and quantum adversaries. The improvements in performance have been verified experimentally: 68.2 percentage latency reduction (245 to 78 ms), 188.2 percentage throughput increase (850 to 2,450 throughput (TPS)), 19.5 percentage increase in security score (82 to 98/100), and any number of nodes can be scaled linearly to 10,000 nodes. The system has a 97.2% temperature breach detection, 94.8% high-demand prediction and 99.97% uptime during nonstop 72-h operations. This quantum-resistant architecture operates to fill key gaps in existing supply chain models, offering a scalable, secure and efficient system to support mission-critical healthcare logistics and developing theoretical bases of next-generation post-quantum distributed computing systems.</jats:p>",12,,e3597,e3597,Computer science; Supply chain; Distributed computing; Edge computing; Key (lock); Throughput; Cost reduction; Latency (audio); Enhanced Data Rates for GSM Evolution; Computer network; Reduction (mathematics); Cryptography; Server; Supply chain management; Cryptographic protocol; Resource efficiency; Architecture; Resource allocation; Resource (disambiguation); Routing (electronic design automation); Security domain; Protocol (science); Adaptive system; Scheduling (production processes); Activity-based costing,,,,"King Saud University, Riyadh, Saudi Arabia; Ministry of Education (MOE) and the Seoul Metropolitan Government",,http://dx.doi.org/10.7717/peerj-cs.3597,,10.7717/peerj-cs.3597,,,0,000-151-828-705-86X; 001-067-837-936-904; 001-265-795-849-497; 001-418-444-006-337; 004-374-656-274-947; 009-731-385-628-516; 012-828-020-596-952; 014-056-319-077-108; 014-973-411-784-241; 019-963-986-585-289; 022-165-920-906-483; 025-719-069-449-565; 039-035-888-468-875; 051-209-646-626-924; 065-600-264-192-278; 066-472-019-689-443; 068-878-253-336-390; 073-266-230-702-021; 073-514-051-601-495; 080-570-800-134-709; 085-148-249-671-905; 088-225-692-574-865; 088-432-388-793-803; 092-908-312-586-707; 099-756-694-107-007; 103-740-477-072-828; 108-765-851-053-284; 127-471-244-660-141; 134-562-920-923-558; 136-886-825-473-046; 138-016-796-860-226; 138-166-553-730-324; 139-784-002-240-999; 144-619-146-712-512; 159-238-352-960-707; 160-061-615-377-885; 163-231-611-590-601; 169-424-130-619-812; 175-771-258-126-033; 189-350-444-271-827; 195-730-791-069-203; 198-296-562-453-869,0,true,cc-by,gold
081-128-858-269-248,Universal Machine Learning Framework for Defect Predictions in Zinc Blende Semiconductors,2021-07-26,2021,preprint,,,Springer Science and Business Media LLC,,Arun Mannodi-Kanakkithodi; Xiaofeng Xiang; Laura M. Jacoby; Robert Biegaj; Scott T. Dunham; Daniel R. Gamelin; Maria K. Y. Chan,"<title>Abstract</title>;         <p>Point defects or impurities are either naturally present in semiconductors or may be intentionally introduced to tune their electronic and optical properties. The nature of impurity energy levels can strongly influence the performance of a semiconductor in applications ranging from solar cells to photodiodes to infrared sensors to qubits for quantum computing. In this work, we develop a framework powered by machine learning (ML) and high-throughput density functional theory (DFT) computations for the prediction and screening of functional impurities in group IV, III-V, and II-VI zinc blende semiconductors. Elements spanning the length and breadth of the periodic table are considered as impurity atoms at the cation, anion, or interstitial sites in supercells of 34 candidate semiconductors, leading to a chemical space of   12,000 points, 10% of which are used to generate a DFT dataset of charge dependent defect formation energies. Descriptors based on tabulated elemental properties, defect coordination environment, and relevant semiconductor properties are used to train ML regression models for the DFT computed properties, resulting in statistical predictions of the neutral state formation energies and charge transition levels of all possible impurities in the given set of compounds. Kernel ridge regression, Gaussian process regression, and neural networks, with appropriate feature selection and hyperparameter optimization, are seen to yield similar predictive performances and meaningful uncertainty estimates. We apply the ML framework to screen all impurities with lower formation energy than dominant native defects in all group IV, III-V, and II-VI zinc blende semiconductors. An online tool resulting from this work for predicting and visualizing defect properties in semiconductors is made available on github.</p>",,,,,Semiconductor; Universal Turing machine; Materials science; Condensed matter physics; Zinc,density fuctional theory (DFT); semiconductors; condensed matter physics,,,,https://www.researchsquare.com/article/rs-723035/v1,http://dx.doi.org/10.21203/rs.3.rs-723035/v1,,10.21203/rs.3.rs-723035/v1,3184388345,,0,009-313-334-880-373; 010-316-928-247-646; 010-547-480-452-294; 013-261-047-658-772; 022-501-403-782-152; 035-136-534-940-172; 035-959-864-848-739; 037-062-343-419-599; 037-259-267-491-634; 037-669-756-017-177; 050-026-487-748-837; 051-979-233-435-645; 058-838-976-536-24X; 061-209-977-327-913; 066-418-743-151-241; 066-939-222-342-767; 067-868-868-171-013; 068-731-781-289-51X; 069-441-584-756-415; 076-960-282-348-73X; 077-055-900-689-707; 081-714-355-933-33X; 081-964-381-098-536; 088-110-781-689-269; 088-414-627-470-392; 089-389-668-851-591; 091-465-014-236-024; 092-565-569-639-315; 093-396-377-908-498; 094-048-287-001-396; 102-338-599-819-916; 107-608-928-539-456; 120-269-602-300-071; 121-509-304-679-577; 121-813-772-720-792; 127-827-561-130-149; 136-594-409-167-459; 137-131-614-903-166; 144-685-648-867-616; 163-407-515-043-356,0,true,cc-by,green
082-947-287-693-074,Behavior-aware energy management in microgrids using quantum-classical hybrid algorithms under social and demand dynamics.,2025-07-01,2025,journal article,Scientific reports,20452322,Springer Science and Business Media LLC,United Kingdom,Liu Minghong; Fu Gaoshan; Wang Pengchao; Yuan Xin; Li Qing; Tengfei Hou; Zhang Shuo,"The increasing intricacy of modern microgrids, driven by uncertain consumption patterns, decentralized renewables, and user behavioral dynamics, calls for innovative optimization methodologies. This study introduces a hybrid quantum-classical framework for demand-side energy management, leveraging behavioral modeling to foster resilience and flexibility. By embedding principles from Social Cognitive Theory-such as behavioral imitation, confidence in personal capability, and social reinforcement-into a multi-objective optimization scheme, the model supports distributed decision-making and promotes adaptive prosumer behavior. The proposed approach employs Quantum Annealing in combination with NSGA-III to efficiently navigate the complex solution space, accounting for real-time uncertainties and the stochastic nature of both demand and renewable supply. The framework is tested within a case study of a peer-to-peer microgrid network, showcasing its effectiveness in enhancing energy efficiency, lowering peak demand, and improving operational resilience. Performance comparisons with traditional methods, including Mixed-Integer Programming and conventional metaheuristics, underline the improved scalability and robustness of the quantum-inspired model in handling trade-offs between cost, reliability, and socially-driven demand response. The research highlights the potential of integrating quantum-inspired optimization with behavioral energy modeling to advance intelligent and socially-responsive microgrid control systems.",15,1,21326,21326,Computer science; Quantum; Dynamics (music); Energy (signal processing); Mathematical optimization; Physics; Mathematics; Quantum mechanics; Acoustics,Behavioral demand response; Behavioral energy management; Microgrid resilience enhancement; NSGA-III; Quantum annealing; Quantum-inspired optimization; Social cognitive theory,,,Science and Technology Program of State Grid Xinjiang Electric Power Co. Ltd (SGXJJJ00XMJS2400038); Science and Technology Program of State Grid Xinjiang Electric Power Co. Ltd (SGXJJJ00XMJS2400038); Science and Technology Program of State Grid Xinjiang Electric Power Co. Ltd (SGXJJJ00XMJS2400038); Science and Technology Program of State Grid Xinjiang Electric Power Co. Ltd (SGXJJJ00XMJS2400038); Science and Technology Program of State Grid Xinjiang Electric Power Co. Ltd (SGXJJJ00XMJS2400038); Science and Technology Program of State Grid Xinjiang Electric Power Co. Ltd (SGXJJJ00XMJS2400038); Science and Technology Program of State Grid Xinjiang Electric Power Co. Ltd (SGXJJJ00XMJS2400038),https://www.nature.com/articles/s41598-025-06199-z.pdf https://doi.org/10.1038/s41598-025-06199-z,http://dx.doi.org/10.1038/s41598-025-06199-z,40594845,10.1038/s41598-025-06199-z,,PMC12216185,0,000-161-460-479-84X; 003-927-228-831-779; 015-555-443-779-126; 032-402-720-001-080; 032-687-682-037-729; 040-543-365-761-120; 043-286-041-506-427; 046-128-172-767-278; 053-516-386-023-010; 056-812-173-436-247; 057-789-249-143-875; 069-827-213-910-227; 073-398-846-977-650; 083-464-899-241-482; 097-923-847-203-888; 109-476-319-632-875; 111-929-451-931-355; 116-200-832-802-237; 118-478-162-967-663; 131-555-080-994-606; 141-419-140-340-329; 143-394-770-364-987; 144-783-285-283-679; 152-329-247-885-45X; 160-726-236-817-709; 164-230-206-869-184; 175-965-154-097-94X; 179-203-772-318-919; 197-798-456-095-280,4,true,"CC BY, CC BY-NC-ND",gold
099-085-528-355-692,Theoretical and practical aspects of the use of mathematical methods and information technology in education and science,,2021,book,,,Borys Grinchenko Kyiv University,,Vadym Abramov; Mariia Astafieva; Mariia Boiko; Dmytro M. Bodnenko; Aleksandr Bushma; Viktoriia Vember; Oksana Hlushak; Oleksii Zhyltsov; Liudmyla Ilich; Nataliya Kobets; Tetiana Kovaliuk; Halyna A. Kuchakovska; Oksana S. Lytvyn; P.M. Lytvyn; Irina Mashkina; Nataliia Morze; Tetiana Nosenko; Volodymyr V. Proshkin; Serhii Radchenko; Milana Sablina; Olena Volodymyrivna Semenikhina; Svitlana Semeniaka; Halyna Skorobreshchuk; Liudmyla Khoruzha; Vladyslav Yaskevych,"<jats:p>The monograph highlights the results of the scientific topic ""Theoretical and practical aspects of the use of mathematical methods and information technology in education and science"" (registration number 0116U004625) by the Department of Computer Science and Mathematics, Faculty of Information Technology and Management, Borys Hrinchenko University of Kyiv (deadline: March 2016 - March 2021). The main scientific and practical results in the following areas are presented: mathematical and computer modeling, hardware and software of automated control systems, application of digital technologies in the educational process. For scientific and pedagogical, scientific and pedagogical workers who are interested in modern problems of application of mathematical methods and digital technologies in education and science.</jats:p>",,,,,Information technology; Computer science; Management science,,,,,http://dx.doi.org/10.28925/9720213284km,http://dx.doi.org/10.28925/9720213284km,,10.28925/9720213284km,3211024171,,0,,14,true,,bronze
102-755-198-977-232,"Battery Energy Storage Systems (BESSs) and the Economy-Dynamics of Microgrids: Review, Analysis, and Classification for Standardization of BESSs Applications",2021-10-21,2021,preprint,,,Institute of Electrical and Electronics Engineers (IEEE),,Mohsen Eskandari; Amin Rajabi; Mostafa Rezaeimozafar; Andrey V. Savkin; Mohammad H. Moradi; Zhao Yang Dong,"The literature on microgrid (MG) studies can be categorized as those that investigated the dynamics or economics of MG systems. Due to the important roles of battery energy storage systems (BESSs) in MGs, the BESSs have been involved in both economics and dynamics studies but mostly separately due to the different time constants of studies. Whereas, in the complicated modern MGs, the BESS is the joint point that bridges these two studies. Thus, studying merely one aspect of economy-dynamic without considering the other aspect would not be accurate. To bridge this gap, this paper reviews, analysis and classifies the BESSs applications, based on their time constants, by merging of which helps researchers to develop joint economy-dynamics models that would be the future trend in the field. The classified BESS applications are 1) inertia synthesis, 2) primary frequency response to compensate slow response time of micro-sources (MSs) for load tracking, 3) real-time energy management for the integration of intermittent renewables, 4) economic dispatch and optimal power flow for improving steady-state performance, and 5) slack bus realization. The research gaps and future trends have been discussed throughout the paper and are summarized in the future trend section.",,,,,Slack bus; Economic dispatch; Standardization; Renewable energy; Reliability engineering; Microgrid; Field (computer science); Computer science; Energy management; Frequency response,,,,,https://www.techrxiv.org/articles/preprint/Battery_Energy_Storage_Systems_BESSs_and_the_Economy-Dynamics_of_Microgrids_Review_Analysis_and_Classification_for_Standardization_of_BESSs_Applications/16807279,http://dx.doi.org/10.36227/techrxiv.16807279.v1,,10.36227/techrxiv.16807279.v1,3216478247,,0,,0,true,cc-by,green
127-200-898-240-504,IEEE BigData - A Quantum Bayesian Approach for Bike Sharing Demand Prediction,2020-12-10,2020,conference proceedings article,2020 IEEE International Conference on Big Data (Big Data),,IEEE,,Ramkumar Harikrishnakumar; Sima E. Borujeni; Alok Dand; Saideep Nannapaneni,"The bike-sharing system (BSS) aims to provide an alternative mode of public transportation that are being adopted in urban cities. The use of the bike for short-distance travel aids in mitigating traffic congestion problems, reduce carbon emissions, and decrease the risk of overcrowding during a pandemic like COVID-19, thereby satisfying the urban-mobility needs of the residents. The key success of incorporating urban-mobility through BSS lies behind the prediction of bikes by identifying the pick-up and drop-off operations in each station. The main challenge includes the demand prediction for the number of bikes available for pick-up and drop-off during a specific point in time. Quantum Computing has been increasingly gaining popularity for its superior computational performance over similar classical algorithms. In this paper, we will illustrate potential applications of Quantum Bayesian networks, which are quantum-equivalent to classical Bayesian networks for probabilistic bike demand prediction.",,,2401,2409,Bayesian probability; Key (cryptography); Traffic congestion; Bayesian network; Computer science; Operations research; Probabilistic logic; Public transport; Quantum computer; Big data,,,,,https://dblp.uni-trier.de/db/conf/bigdataconf/bigdataconf2020.html#Harikrishnakumar20,http://dx.doi.org/10.1109/bigdata50022.2020.9378271,,10.1109/bigdata50022.2020.9378271,3138490475,,1,000-970-352-274-505; 002-724-662-116-771; 014-159-852-652-23X; 016-424-133-637-479; 017-796-880-414-133; 025-025-570-767-907; 029-660-832-420-865; 029-783-063-255-067; 032-489-241-646-847; 046-598-501-277-373; 051-565-223-462-703; 054-957-936-128-82X; 061-690-640-521-730; 068-137-617-763-492; 070-662-387-965-095; 071-239-435-548-770; 081-091-464-331-057; 081-993-849-720-734; 089-332-526-623-537; 090-798-599-279-87X; 097-363-273-159-554; 105-077-454-001-765; 106-599-182-961-379; 113-313-071-185-220; 113-784-184-350-844; 118-421-807-750-027; 131-682-996-748-765; 133-811-809-808-349; 140-399-664-245-611; 141-387-396-467-469; 142-630-962-095-107; 153-435-605-038-396; 159-800-961-656-554; 164-261-821-534-572; 187-431-227-132-259; 190-766-498-018-602,4,false,,
132-459-100-778-422,Quantum Machine Learning for 6G Communication Networks: State-of-the-Art and Vision for the Future,,2019,journal article,IEEE Access,21693536,Institute of Electrical and Electronics Engineers (IEEE),United States,Syed Junaid Nawaz; Shree Krishna Sharma; Shurjeel Wyne; Mohammad Patwary;  Asaduzzaman,"The upcoming fifth generation (5G) of wireless networks is expected to lay a foundation of intelligent networks with the provision of some isolated artificial intelligence (AI) operations. However, fully intelligent network orchestration and management for providing innovative services will only be realized in Beyond 5G (B5G) networks. To this end, we envisage that the sixth generation (6G) of wireless networks will be driven by on-demand self-reconfiguration to ensure a many-fold increase in the network performance and service types. The increasingly stringent performance requirements of emerging networks may finally trigger the deployment of some interesting new technologies, such as large intelligent surfaces, electromagnetic–orbital angular momentum, visible light communications, and cell-free communications, to name a few. Our vision for 6G is a massively connected complex network capable of rapidly responding to the users’ service calls through real-time learning of the network state as described by the network edge (e.g., base-station locations and cache contents), air interface (e.g., radio spectrum and propagation channel), and the user-side (e.g., battery-life and locations). The multi-state, multi-dimensional nature of the network state, requiring the real-time knowledge, can be viewed as a quantum uncertainty problem. In this regard, the emerging paradigms of machine learning (ML), quantum computing (QC), and quantum ML (QML) and their synergies with communication networks can be considered as core 6G enablers. Considering these potentials, starting with the 5G target services and enabling technologies, we provide a comprehensive review of the related state of the art in the domains of ML (including deep learning), QC, and QML and identify their potential benefits, issues, and use cases for their applications in the B5G networks. Subsequently, we propose a novel QC-assisted and QML-based framework for 6G communication networks while articulating its challenges and potential enabling technologies at the network infrastructure, network edge, air interface, and user end. Finally, some promising future research directions for the quantum- and QML-assisted B5G networks are identified and discussed.",7,,46317,46350,Wireless network; Deep learning; Edge device; Artificial intelligence; Visible light communication; Telecommunications network; Network performance; Quantum machine learning; Computer network; Complex network; Computer science; Intelligent Network,6G; B5G; machine learning; quantum communications; quantum machine learning,,,EU-funded; EU-funded,https://ieeexplore.ieee.org/abstract/document/8681450 https://dblp.uni-trier.de/db/journals/access/access7.html#NawazSWPA19 http://eprints.staffs.ac.uk/5526/ https://www.open-access.bcu.ac.uk/7579/ https://ieeexplore.ieee.org/document/8681450/ http://orbilu.uni.lu/bitstream/10993/39346/1/QML_preprint.pdf https://orbilu.uni.lu/bitstream/10993/39346/1/QML_preprint.pdf https://core.ac.uk/download/pdf/195389872.pdf,http://dx.doi.org/10.1109/access.2019.2909490,,10.1109/access.2019.2909490,2929612105,,10,000-096-586-397-745; 001-628-842-645-906; 001-992-271-793-964; 002-096-990-063-82X; 002-103-204-440-812; 002-253-344-023-045; 002-775-311-965-261; 002-802-139-975-476; 003-137-879-936-770; 003-456-545-749-041; 003-656-842-247-378; 003-746-153-615-453; 005-332-195-614-312; 005-959-240-514-96X; 006-178-327-039-254; 006-472-094-244-990; 006-920-968-782-623; 007-187-801-080-846; 007-456-875-399-262; 008-180-225-889-069; 008-182-167-200-495; 008-468-205-736-391; 008-953-671-827-273; 009-383-195-432-32X; 009-734-233-630-696; 010-823-196-419-532; 010-879-824-482-333; 011-156-641-093-666; 011-248-211-925-15X; 011-317-326-045-191; 012-758-539-526-618; 012-886-121-577-30X; 012-900-943-429-240; 013-024-374-365-732; 013-229-955-903-243; 014-159-852-652-23X; 015-400-355-232-239; 015-827-821-716-453; 016-549-713-240-450; 018-608-262-687-084; 019-039-427-073-179; 020-042-237-319-783; 021-126-044-726-619; 021-524-592-016-769; 022-204-670-175-532; 022-443-386-847-889; 022-473-538-271-143; 022-529-996-450-667; 023-028-349-527-42X; 023-199-984-369-842; 023-209-181-221-859; 024-419-410-029-10X; 024-616-145-210-612; 025-507-684-189-406; 025-750-086-366-10X; 026-068-605-255-108; 026-126-905-234-678; 027-586-570-150-07X; 028-952-011-619-277; 029-803-646-760-538; 030-088-016-215-717; 030-589-504-330-533; 031-209-407-733-778; 031-770-584-845-31X; 032-450-366-441-855; 032-521-800-661-400; 034-046-789-603-252; 034-158-104-490-280; 034-207-361-529-906; 034-357-124-308-126; 034-606-524-972-59X; 035-282-579-270-331; 035-685-933-963-808; 037-730-051-722-183; 037-912-238-611-448; 038-671-454-160-743; 039-671-742-720-764; 040-255-906-762-438; 040-283-118-404-259; 040-443-895-287-202; 040-485-120-568-434; 040-698-163-645-195; 040-796-027-290-296; 040-834-781-870-115; 041-462-634-590-852; 042-180-553-028-041; 042-294-299-437-258; 042-404-957-049-754; 043-889-351-927-369; 044-203-003-246-978; 044-211-536-274-365; 044-407-385-460-113; 044-673-419-200-558; 045-255-973-724-396; 045-425-270-443-255; 045-567-998-264-034; 046-862-287-077-863; 047-522-087-641-410; 047-623-362-625-670; 050-812-537-295-96X; 050-948-559-495-981; 051-654-625-706-015; 051-758-199-302-574; 052-175-518-915-573; 052-305-038-215-802; 052-320-132-405-35X; 054-015-294-380-679; 055-732-338-109-150; 056-329-597-930-45X; 056-742-543-058-706; 057-929-397-484-120; 058-253-679-532-847; 058-499-708-068-802; 059-784-486-625-579; 059-967-139-472-039; 060-010-222-639-391; 060-112-855-292-997; 060-431-566-534-214; 060-994-438-246-209; 061-544-804-438-082; 062-187-319-128-754; 062-390-921-920-772; 062-478-956-857-394; 062-896-349-368-937; 063-373-015-232-814; 063-419-447-583-336; 064-631-156-790-903; 064-893-453-819-039; 065-545-899-065-767; 065-848-978-792-741; 066-888-004-222-006; 067-511-551-073-640; 070-662-387-965-095; 071-172-273-812-618; 071-443-413-873-976; 071-531-047-947-321; 072-009-079-481-823; 072-164-697-064-015; 073-454-789-254-037; 073-644-095-327-681; 075-474-096-946-496; 075-838-655-322-861; 077-332-266-947-264; 078-115-305-452-674; 078-145-046-638-446; 079-112-097-941-475; 080-417-560-832-717; 080-829-496-657-74X; 082-344-146-091-499; 082-383-648-124-133; 082-551-350-295-917; 082-593-245-131-983; 083-918-534-540-790; 084-426-709-758-894; 085-742-984-064-281; 086-762-720-110-699; 087-202-459-634-157; 088-097-202-235-825; 088-284-313-250-44X; 089-083-312-452-125; 089-200-326-044-018; 089-325-049-904-460; 089-936-525-141-912; 090-036-958-997-734; 091-037-595-217-110; 091-497-865-385-534; 091-750-868-155-108; 092-276-761-846-882; 093-665-124-667-684; 094-274-223-835-610; 094-578-148-090-26X; 096-167-991-823-400; 096-833-595-183-116; 097-202-318-377-831; 098-841-716-624-364; 100-196-480-947-917; 101-144-949-223-708; 101-283-669-300-297; 102-423-896-406-09X; 102-472-585-566-580; 104-011-915-167-816; 105-141-033-151-785; 108-510-341-434-154; 108-823-149-909-911; 109-651-269-470-438; 111-769-055-798-986; 114-755-752-589-25X; 115-923-245-335-999; 117-877-364-809-032; 118-331-038-279-63X; 120-733-405-124-108; 120-896-310-880-88X; 122-278-778-313-412; 122-417-029-950-358; 124-356-819-628-685; 125-530-327-615-447; 128-118-246-406-146; 129-506-704-388-290; 131-802-979-027-716; 132-718-894-222-680; 132-773-910-769-208; 133-260-517-166-665; 135-157-201-733-907; 136-744-629-399-316; 138-761-612-415-348; 141-165-534-476-977; 143-344-280-927-091; 143-509-670-028-57X; 144-645-132-005-541; 145-136-299-375-254; 145-496-078-709-31X; 148-953-571-929-252; 149-747-506-589-57X; 149-827-501-612-881; 150-216-909-569-971; 150-660-544-758-067; 154-521-181-761-595; 156-354-070-132-670; 163-284-346-996-289; 168-948-533-090-766; 171-819-884-630-610; 171-877-188-350-346; 173-096-993-103-859; 173-727-659-234-843; 175-335-630-587-645; 176-689-590-850-713; 178-782-384-257-512; 179-386-420-045-413; 180-011-832-814-789; 180-118-743-541-029; 181-364-657-944-091; 187-004-876-009-369,590,true,"CC BY, CC BY-NC-ND",gold
