Lens ID,Title,Date Published,Publication Year,Publication Type,Source Title,ISSNs,Publisher,Source Country,Author/s,Abstract,Volume,Issue Number,Start Page,End Page,Fields of Study,Keywords,MeSH Terms,Chemicals,Funding,Source URLs,External URL,PMID,DOI,Microsoft Academic ID,PMCID,Citing Patents Count,References,Citing Works Count,Is Open Access,Open Access License,Open Access Colour
001-044-552-484-025,Table of contents,,2018,conference proceedings article,2018 Thirteenth International Conference on Digital Information Management (ICDIM),,IEEE,,Markus Haberzettl; Bernd Markscheffel; Mohamed Al Meer; Abdullah Al Mamun; Simona-Daniela Marcu; Adrian Florea; Lasitha Uyangoda; Supunmali Ahangama; Tharindu Ranasinghe; Georgios Koulinas; Alexandros Xanthopoulos; Athanasios Kiatipis; Dimitrios Koulouriotis; Ivana Biskupic; Robert Arapovic; Mateo Jurcic; Al Hafiz Akbar; Maulana Siagian; Masayoshi Aritsugi; Julian Risch; Ralf Krestel; Fadi Yamout; Rachad Lakkis; Pit Pichappan; P Vijayakumar; Fateh Ur Rehman; Muhammad Abbas; Sajjad Murtaza; Wasi Butt; Saad Rehman; Usman Qamar; Sansiri Tarnpradab; Kien Hua; Abdihakim Mao; M Omair; Muhammad Abrahams; Josef Langerman; Kuleli Burcu; Bora Pak; Sema Mocan; Nee Yolda; null Baz; Antonin Pavlicek; Frantisek Sudzina; Astika Ferry; Muhammad Saputra; Iwan Masputra; Kalamullah Syarif; null Ramli; Urszula Kuzelewska; Antonello Venditti; Fausto Fasano; Michele Risi; Genoveffa Tortora; Rami Ibrahim; Wei Tze; Su-Mae Liew; Chin Tan; null Gan; Nora Madi; Hend Al-Khalifa; Lisa Ehrlinger; Thomas Grubinger; Bence Varga; Mario Pichler; Thomas Natschlager; Jurgen Zeindl; Eldar Sultanow; Andr Ullrich; Stefan Konopik; Gergana Vladova; Soonsung Hwang; Jongpil Jeong; Youngbin Kang; Esther Gachanga; Micheal Kimwele; Lawrence Nderu; Maria Spiteri; George Azzopardi; Milan Koch; Hao Wang; Thomas Back; Christian Grvisse; Jeff Meder; Jean Botev; Steffen Rothkugel; Hasrini Sari; Farhan Mutaqin; Aditya Setiaboedi; Hilda Tellioglu; Aldila Rizkiana; Pameodji Hardjomidjojo; Budhi Prihartono; Indryati Sunaryo; Reza Prasetyo; Irfan Deden; Kalamullah Afryansyah; Shantanu Deshmukh; Natalia Khuri; Roman Berka; Bohus Zskal; Zdenek Travncek; Vandana Kannan; Jos Monteiro; Joo Barata; Marco Veloso; Luis Veloso; Joo Nunes; Brian Murray; Prasad Perera; Romuald Carette; Mahmoud Elbattah; Gilles Dequen; Jean-Luc Gurin; Federica Cilia; Pingpeng Yuan; Lijian Fan; Hai Jin; Hani Abd; Patrick Wamuyu; Joshua Ndiege; Imran Rasheed; Vivek Gupta; Haider Banka; Chiranjeev Kumar; Michael George; Hasan Al-Aswad; Wael Elmedany; Chitra Balakrishna; Sameer Aljeshi; Ahmed Tarfa; Hesham Hasan; Ghassan Ali; Saifuldeen Mohammed; Taghreed Mohamed; Ali Al-Rufaii; Ammar Al-Zubaidi; Abdullah Abd; Ali Jassim; Oba Mustapha; Yim Hu; Ray Sheriff; Raed Abd-Alhameed; M Ali; T Sigwele; Fatimah Alkareem; Taha Rassem; Mohammed Falah; Raad Hadi; Loay George; Auday Mohamad; Kareem Jumaa; Sameer Hameed Majeed; Charles Mutigwe; Johnson Kinyua; Amal Al-Abri; Naoufel Kraiem; Zuhoor Alkhanjari; Yassine Jamoussi; Minoru Motoki; Hirohito Shintani; Kazunori Matsuo; Thomas Mcginnity; Aboubakr Aqle; Kamran Khowaja; Dena Al-Thani; Saloni Gandhi; Anuja Gore; Sakshi Nimbarte; Jibi Abraham; Abdelali Bouchti; Younes Tribis; Tarik Nahhal; Chafik Okar; Ali Elmahmudi; Hassan Ugail; Ali Bukar; Sabah Al-Fedaghi; Manal Alsharah; Sunitha Cheriyan; Shaniba Ibrahim; Susan Treesa; Olusola Akinrolabu; Steve New; Andrew Martin; Kingsford Mireku; Zhang Fengli; Komlan Gbongli; Daniel Kotei; Xiaohui Zhu; Yong Yue; Rui Liu; Ming Liu; Jiawei Mao; Yawei Hu; Hung-Yuan Chung; Yao-Liang Chung; Chih-Yen Liang; Tengyue -Self; Simon Li; null Fong; Moutinho Lus; null Top,The following topics are dealt with: learning (artificial intelligence); pattern classification; Internet; text analysis; data mining; feature extraction; natural language processing; information retrieval; query processing; social networking (online).,,,i,vii,Table (database); Computer science; Database,,,,,https://ieeexplore.ieee.org/ielx7/8843511/8846966/08847160.pdf https://doi.org/10.1109/icdim.2018.8847160,http://dx.doi.org/10.1109/icdim.2018.8847160,,10.1109/icdim.2018.8847160,,,0,,0,true,,gold
015-138-683-835-935,Variational quantum classifiers through the lens of the Hessian.,2022-01-20,2022,journal article,PloS one,19326203,Public Library of Science (PLoS),United States,Pinaki Sen; Amandeep Singh Bhatia; Kamalpreet Singh Bhangu; Ahmed Elbeltagi,"In quantum computing, the variational quantum algorithms (VQAs) are well suited for finding optimal combinations of things in specific applications ranging from chemistry all the way to finance. The training of VQAs with gradient descent optimization algorithm has shown a good convergence. At an early stage, the simulation of variational quantum circuits on noisy intermediate-scale quantum (NISQ) devices suffers from noisy outputs. Just like classical deep learning, it also suffers from vanishing gradient problems. It is a realistic goal to study the topology of loss landscape, to visualize the curvature information and trainability of these circuits in the existence of vanishing gradients. In this paper, we calculate the Hessian and visualize the loss landscape of variational quantum classifiers at different points in parameter space. The curvature information of variational quantum classifiers (VQC) is interpreted and the loss function's convergence is shown. It helps us better understand the behavior of variational quantum circuits to tackle optimization problems efficiently. We investigated the variational quantum classifiers via Hessian on quantum computers, starting with a simple 4-bit parity problem to gain insight into the practical behavior of Hessian, then thoroughly analyzed the behavior of Hessian's eigenvalues on training the variational quantum classifier for the Diabetes dataset. Finally, we show how the adaptive Hessian learning rate can influence the convergence while training the variational circuits.",17,1,e0262346,,,,"Algorithms; Computer Simulation; Machine Learning; Neural Networks, Computer; Quantum Theory",,,,http://dx.doi.org/10.1371/journal.pone.0262346,35051206,10.1371/journal.pone.0262346,,PMC8775295,0,008-468-343-915-662; 009-583-282-755-019; 014-190-816-397-441; 014-896-609-810-429; 015-610-270-783-942; 016-792-790-154-804; 019-884-454-685-718; 020-577-104-094-323; 024-026-915-309-679; 026-738-712-279-877; 028-092-362-584-160; 029-940-616-501-78X; 041-643-410-913-918; 043-292-904-496-908; 047-888-693-205-244; 047-889-168-079-31X; 048-092-008-205-493; 048-721-446-123-462; 050-093-579-461-454; 054-136-591-008-030; 061-586-452-918-562; 065-732-899-179-40X; 068-721-906-241-677; 069-355-226-977-698; 077-730-468-803-801; 095-595-953-559-578; 107-124-572-515-646; 108-927-329-894-231; 113-572-058-717-313; 150-440-052-095-848; 153-737-053-258-879; 160-208-842-957-138; 161-393-657-821-945; 166-674-456-902-995,29,true,cc-by,gold
015-321-377-602-282,Quantum Neural Networks for a Supply Chain Logistics Application,2022-11-30,2022,preprint,arXiv (Cornell University),,,,Randall Correll; Sean J. Weinberg; Fabio Sanches; Takanori Ide; Takafumi Suzuki,"Problem instances of a size suitable for practical applications are not likely to be addressed during the noisy intermediate-scale quantum (NISQ) period with (almost) pure quantum algorithms. Hybrid classical-quantum algorithms have potential, however, to achieve good performance on much larger problem instances. We investigate one such hybrid algorithm on a problem of substantial importance: vehicle routing for supply chain logistics with multiple trucks and complex demand structure. We use reinforcement learning with neural networks with embedded quantum circuits. In such neural networks, projecting high-dimensional feature vectors down to smaller vectors is necessary to accommodate restrictions on the number of qubits of NISQ hardware. However, we use a multi-head attention mechanism where, even in classical machine learning, such projections are natural and desirable. We consider data from the truck routing logistics of a company in the automotive sector, and apply our methodology by decomposing into small teams of trucks, and we find results comparable to human truck assignment.",,,,,Truck; Computer science; Routing (electronic design automation); Automotive industry; Artificial neural network; Reinforcement learning; Supply chain; Feature (linguistics); Quantum; Vehicle routing problem; Quantum computer; Artificial intelligence; Mathematical optimization; Engineering; Embedded system; Mathematics; Automotive engineering; Political science; Linguistics; Law; Aerospace engineering; Physics; Philosophy; Quantum mechanics,,,,,https://arxiv.org/abs/2212.00576,http://dx.doi.org/10.48550/arxiv.2212.00576,,10.48550/arxiv.2212.00576,,,0,,0,true,,green
020-822-942-009-200,Software Supply Chain Vulnerabilities Detection in Source Code: Performance Comparison between Traditional and Quantum Machine Learning Algorithms,2022-12-17,2022,conference proceedings article,2022 IEEE International Conference on Big Data (Big Data),,IEEE,,Mst Shapna Akter; Md Jobair Hossain Faruk; Nafisa Anjum; Mohammad Masum; Hossain Shahriar; Nazmus Sakib; Akond Rahman; Fan Wu; Alfredo Cuzzocrea,"The software supply chain (SSC) attack has become one of the crucial issues that are being increased rapidly with the advancement of the software development domain. In general, SSC attacks execute during the software development processes lead to vulnerabilities in software products targeting downstream customers and even involved stakeholders. Machine Learning approaches are proven in detecting and preventing software security vulnerabilities. Besides, emerging quantum machine learning can be promising in addressing SSC attacks. Considering the distinction between traditional and quantum machine learning, performance could be varies based on the proportions of the experimenting dataset. In this paper, we conduct a comparative analysis between quantum neural networks (QNN) and conventional neural networks (NN) with a software supply chain attack dataset known as ClaMP. Our goal is to distinguish the performance between QNN and NN and to conduct the experiment, we develop two different models for QNN and NN by utilizing Pennylane for quantum and TensorFlow and Keras for traditional respectively. We evaluated the performance of both models with different proportions of the ClaMP dataset to identify the f1 score, recall, precision, and accuracy. We also measure the execution time to check the efficiency of both models. The demonstration result indicates that execution time for QNN is slower than NN with a higher percentage of datasets. Due to recent advancements in QNN, a large level of experiments shall be carried out to understand both models accurately in our future research.",,,5639,5645,Computer science; Machine learning; Software; Artificial intelligence; Artificial neural network; Code (set theory); Deep learning; Domain (mathematical analysis); Mathematics; Mathematical analysis; Set (abstract data type); Programming language,,,,National Science Foundation,https://arxiv.org/pdf/2306.08060 http://arxiv.org/abs/2306.08060,http://dx.doi.org/10.1109/bigdata55660.2022.10020813,,10.1109/bigdata55660.2022.10020813,,,0,004-503-667-406-35X; 006-414-906-210-505; 015-363-599-130-693; 017-136-248-684-232; 027-487-446-697-250; 031-916-907-396-459; 034-509-021-105-406; 037-655-163-223-453; 038-724-050-321-279; 051-454-358-189-773; 054-454-690-243-427; 057-819-082-756-104; 059-750-368-827-166; 060-780-836-906-395; 069-474-074-181-915; 070-662-387-965-095; 076-789-448-040-157; 078-115-305-452-674; 081-929-916-627-075; 108-106-079-215-866; 113-297-263-444-322; 140-497-927-373-367; 155-615-232-326-635; 160-711-728-952-235; 171-284-891-187-76X; 184-317-743-395-567,13,true,,green
027-289-853-595-203,The Sixth International Symposium on Neural Networks (ISNN 2009) - The Sixth International Symposium on Neural Networks (ISNN 2009),,2009,book,Advances in Intelligent and Soft Computing,18675662; 18675670; 18600794; 16153871,Springer Berlin Heidelberg,United States,Hongwei Wang; Yi Shen; Tingwen Huang; Zhigang Zeng,Session 1: Theoretical Analysis.- The Initial Alignment of SINS Based on Neural Network.- Analysis on Basic Conceptions and Principles of Human Cognition.- Global Exponential Stability for Discrete-Time BAM Neural Network with Variable Delay.- The Study of Project Cost Estimation Based on Cost-Significant Theory and Neural Network Theory.- Global Exponential Stability of High-Order Hopfield Neural Networks with Time Delays.- Improved Particle Swarm Optimization for RCP Scheduling Problem.- Exponential Stability of Reaction-Diffusion Cohen-Grossberg Neural Networks with S-Type Distributed Delays.- Global Exponential Robust Stability of Static Reaction-Diffusion Neural Networks with S-Type Distributed Delays.- A LEC-and-AHP Based Hazard Assessment Method in Hydroelectric Project Construction.- A Stochastic Lotka-Volterra Model with Variable Delay.- Extreme Reformulated Radial Basis Function Neural Networks.- Research of Nonlinear Combination Forecasting Model for Insulators ESDD Based on Wavelet Neural Network.- Parameter Tuning of MLP Neural Network Using Genetic Algorithms.- Intelligent Grid of Computations.- Method of Solving Matrix Equation and Its Applications in Economic Management.- Efficient Feature Selection Algorithm Based on Difference and Similitude Matrix.- Exponential Stability of Neural Networks with Time-Varying Delays and Impulses.- Session 2: Machine Learning.- Adaptive Higher Order Neural Networks for Effective Data Mining.- Exploring Cost-Sensitive Learning in Domain Based Protein-Protein Interaction Prediction.- An Efficient and Fast Algorithm for Estimating the Frequencies of 2-D Superimposed Exponential Signals in Presence of Multiplicative and Additive Noise.- An Improved Greedy Based Global Optimized Placement Algorithm.- An Alternative Fast Learning Algorithm of Neural Network.- Computer Aided Diagnosis of Alzheimer's Disease Using Principal Component Analysis and Bayesian Classifiers.- Margin-Based Transfer Learning.- Session 3: Support Vector Machines and Kernel Methods.- Nonlinear Dead Zone System Identification Based on Support Vector Machine.- A SVM Model Selection Method Based on Hybrid Genetic Algorithm and Empirical Error Minimization Criterion.- An SVM-Based Mandarin Pronunciation Quality Assessment System.- An Quality Prediction Method of Injection Molding Batch Processes Based on Sub-Stage LS-SVM.- Soft Sensing for Propylene Purity Using Partial Least Squares and Support Vector Machine.- Application of Support Vector Machines Method in Credit Scoring.- Session 4: Pattern Recognition.- Improving Short Text Clustering Performance with Keyword Expansion.- Nonnative Speech Recognition Based on Bilingual Model Modification at State Level.- Edge Detection Based on a PCNN-Anisotropic Diffusion Synergetic Approach.- Automatic Face Recognition Systems Design and Realization.- Multi-view Face Detection Using Six Segmented Rectangular Features.- Level Detection of Raisins Based on Image Analysis and Neural Network.- English Letters Recognition Based on Bayesian Regularization Neural Network.- Iris Disease Classifying Using Neuro-Fuzzy Medical Diagnosis Machine.- An Approach to Dynamic Gesture Recognition for Real-Time Interaction.- Dynamic Multiple Pronunciation Incorporation in a Refined Search Space for Reading Miscue Detection.- Depicting Diversity in Rules Extracted from Ensembles.- A New Statistical Model for Radar HRRP Target Recognition.- Independent Component Analysis of SPECT Images to Assist the Alzheimer's Disease Diagnosis.- The Multi-Class Imbalance Problem: Cost Functions with Modular and Non-Modular Neural Networks.- Geometry Algebra Neuron Based on Biomimetic Pattern Recognition.- A Novel Matrix-Pattern-Oriented Ho-Kashyap Classifier with Locally Spatial Smoothness.- An Integration Model Based on Non-classical Receptive Fields.- Classification of Imagery Movement Tasks for Brain-Computer Interfaces Using Regression Tree.- MIDBSCAN: An Efficient Density-Based Clustering Algorithm.- Detection and Following of a Face in Movement Using a Neural Network.- Session 5: Intelligent Modelling and Control.- Nonparametric Inter-Quartile Range for Error Evaluation and Correction of Demand Forecasting Model under Short Product Lifecycle.- Simulated Annealing and Crowd Dynamics Approaches for Intelligent Control.- Accomplishing Station Keeping Mode for Attitude Orbit Control Subsystem Designed for T-SAT.- Nonlinear System Identification Based on Recurrent Wavelet Neural Network.- Approximation to Nonlinear Discrete-Time Systems by Recurrent Neural Networks.- Model-Free Control of Nonlinear Noise Processes Based on C-FLAN.- An Empirical Study of the Artificial Neural Network for Currency Exchange Rate Time Series Prediction.- Grey Prediction with Markov-Chain for Crude Oil Production and Consumption in China.- Fabric Weave Identification Based on Cellular Neural Network.- Cutting Force Prediction of High-Speed Milling Hardened Steel Based on BP Neural Networks.- BP Neural Networks Based Soft Measurement of Rheological Properties of CWS.- A Parameters Self-adjusting ANN-PI Controller Based on Homotopy BP Algorithm.- Session 6: Optimization and Genetic Algorithms.- Study on Optimization of the Laser Texturing Surface Morphology Parameters Based on ANN.- A Combined Newton Method for Second-Order Cone Programming.- MES Scheduling Optimization and Simulation Based on CAPP/PPC Integration.- An Improved Diversity Guided Particle Swarm Optimization.- Research on Intelligent Diagnosis of Mechanical Fault Based on Ant Colony Algorithm.- A New Supermemory Gradient Method without Line Search for Unconstrained Optimization.- A Neural Network Approach for Solving Linear Bilevel Programming Problem.- Fuzzy Solution for Multiple Targets Optimization Based on Fuzzy Max-Min Neural Network.- Fixed-Structure Mixed Sensitivity/Model Reference Control Using Evolutionary Algorithms.- Session 7: Telecommunication and Transportation Systems.- ANN-Based Multi-scales Prediction of Self-similar Network Traffic.- Application of DM and Combined Grey Neural Network in E-Commerce Data Transmission.- Application of Prediction Model in Monitoring LAN Data Flow Based on Grey BP Neural Network.- Monitoring ARP Attack Using Responding Time and State ARP Cache.- A Study of Multi-agent Based Metropolitan Demand Responsive Transport Systems.- Sesson 8: Applications.- The Diagnosis Research of Electric Submersible Pump Based on Neural Network.- The Application of BP Feedforward Neural Networks to the Irradiation Effects of High Power Microwave.- A Novel Model for Customer Retention.- Neural Network Ensemble Approach in Analog Circuit Fault Diagnosis.- Research on Case Retrieval of Case-Based Reasoning of Motorcycle Intelligent Design.- Improving Voice Search Using Forward-Backward LVCSR System Combination.- Agent Oriented Programming for Setting Up the Platform for Processing EEG / ECG / EMG Waveforms.- A Forecasting Model of City Freight Volume Based on BPNN.- The Estimations of Mechanical Property of Rolled Steel Bar by Using Quantum Neural Network.- Diagnosis of Epilepsy Disorders Using Artificial Neural Networks.- Neural Forecasting Network for the Market of Pleione Formosana Hayata Orchid.- Harmonic Current Detection Based on Neural Network Adaptive Noise Cancellation Technology.- Study on Dynamic Relation between Share Price Index and Housing Price: Co-integration Analysis and Application in Share Price Index Prediction.- Application of RBF and Elman Neural Networks on Condition Prediction in CBM.- Judging the States of Blast Furnace by ART2 Neural Network.- Research on Dynamic Response of Riverbed Deformation Based on Theory of BP Neural Network.- Adaboosting Neural Networks for Credit Scoring.- An Enterprise Evaluation of Reverse Supply Chain Based on Ant Colony BP Neural Network.- Ultrasonic Crack Size Estimation Based on Wavelet Neural Networks.,,,,,Deep learning; Engineering; Probabilistic neural network; Recurrent neural network; Artificial intelligence; Time delay neural network; Types of artificial neural networks; Pattern recognition; Quantum neural network; Feedforward neural network; Artificial neural network,,,,,https://ci.nii.ac.jp/ncid/BB02196527 https://library.nims.go.jp/manifestations/122441?locale=ja https://link.springer.com/10.1007/978-3-642-01216-7,http://dx.doi.org/10.1007/978-3-642-01216-7,,10.1007/978-3-642-01216-7,634553904,,0,,9,false,,
028-396-614-861-21X,Quantum cyber-physical systems.,2022-05-13,2022,journal article,Scientific reports,20452322,Springer Science and Business Media LLC,United Kingdom,Javier Villalba-Diez; Ana González-Marcos; Joaquín Ordieres-Meré,"This paper aims to promote a quantum framework that analyzes Industry 4.0 cyber-physical systems more efficiently than traditional simulations used to represent integrated systems. The paper proposes a novel configuration of distributed quantum circuits in multilayered complex networks that enable the evaluation of industrial value creation chains. In particular, two different mechanisms for the integration of information between circuits operating at different layers are proposed, where their behavior is analyzed and compared with the classical conditional probability tables linked to the Bayesian networks. With the proposed method, both linear and nonlinear behaviors become possible while the complexity remains bounded. Applications in the case of Industry 4.0 are discussed when a component's health is under consideration, where the effect of integration between different quantum cyber-physical digital twin models appears as a relevant implication.",12,1,7964,7964,Cyber-physical system; Computer science; Component (thermodynamics); Quantum; Nonlinear system; Physical system; Theoretical computer science; Bounded function; Bayesian network; Distributed computing; Artificial intelligence; Mathematics; Physics; Operating system; Quantum mechanics; Mathematical analysis; Thermodynamics,Quantum simulation; Qubits,,,Ministry of Economy and Competitiveness | Agencia Estatal de Investigación (Spanish Agencia Estatal de Investigación) (RTI2018-094614-B-I00),https://www.nature.com/articles/s41598-022-11691-x.pdf https://doi.org/10.1038/s41598-022-11691-x,http://dx.doi.org/10.1038/s41598-022-11691-x,35562377,10.1038/s41598-022-11691-x,,PMC9106656,0,000-925-726-038-855; 000-970-352-274-505; 006-024-096-713-405; 008-174-400-647-761; 009-494-052-757-751; 009-571-099-425-435; 009-722-459-057-812; 011-018-575-862-58X; 012-155-768-791-906; 012-746-755-903-141; 014-117-212-937-24X; 014-375-055-630-499; 014-389-842-801-530; 019-828-619-434-76X; 020-289-870-886-796; 020-862-535-955-896; 023-317-207-105-708; 030-442-381-849-469; 030-589-504-330-533; 032-879-282-531-038; 034-679-292-563-769; 037-823-596-416-541; 040-100-252-914-933; 043-379-840-856-805; 044-287-575-313-532; 045-484-955-618-572; 046-598-501-277-373; 047-330-847-628-790; 051-544-614-767-560; 052-045-794-986-778; 052-663-769-887-303; 053-726-529-929-174; 054-507-077-983-01X; 063-036-344-667-328; 063-508-116-892-235; 063-694-233-570-544; 065-494-644-920-576; 071-764-813-880-267; 073-227-222-429-238; 073-426-437-282-749; 075-652-458-139-00X; 078-619-319-551-808; 083-977-239-335-188; 089-376-857-531-05X; 094-115-753-654-923; 104-963-683-392-202; 113-007-373-960-530; 113-391-244-402-814; 117-239-545-574-803; 129-461-000-946-008; 138-808-668-276-565; 158-729-768-554-104; 174-941-184-679-323,6,true,"CC BY, CC BY-NC-ND",gold
047-168-102-945-748,Forecasting Financial Risk using Quantum Neural Networks,2019-09-01,2019,journal article,Journal of Information Security Research,09764143; 09764151,Digital Information Research Foundation,,Abdelali El Bouchti; Younes Tribis; Tarik Nahhal; Chafik Okar,"There has been enormous attention in quantum algorithms for reinforcing machine learning (ML) algorithms. In the current paper, we present quantum neural networks (QNNs) and a method of training which is well in quantum system and is improved with momentum accession and parameter self adaptive algorithm, and we build a new financial risk forecasting model. We apply this model to the empirical research on the financial risk forecasting of some Moroccan companies. Then we will compare the findings with the standard artificial neural network (ANNs).",10,3,97,,Machine learning; Empirical research; Quantum algorithm; Artificial intelligence; Quantum system; Self adaptive; Computer science; Artificial neural network; Financial risk; Quantum,Financial Risk; Neural Networks; Quantum Computing; Artificial Neural Networks,,,,http://dx.doi.org/10.6025/jisr/2019/10/3/97-104,http://dx.doi.org/10.6025/jisr/2019/10/3/97-104,,10.6025/jisr/2019/10/3/97-104,2981542969,,0,,3,true,,bronze
