Lens ID,Title,Date Published,Publication Year,Publication Type,Source Title,ISSNs,Publisher,Source Country,Author/s,Abstract,Volume,Issue Number,Start Page,End Page,Fields of Study,Keywords,MeSH Terms,Chemicals,Funding,Source URLs,External URL,PMID,DOI,Microsoft Academic ID,PMCID,Citing Patents Count,References,Citing Works Count,Is Open Access,Open Access License,Open Access Colour
051-712-484-627-614,Industry 4.0 Applications for Medical/Healthcare Services,2021-06-30,2021,journal article,Journal of Sensor and Actuator Networks,22242708,MDPI AG,,Shuva Paul; Muhtasim Riffat; Abrar Yasir; Mir Nusrat Mahim; Bushra Yasmin Sharnali; Intisar Tahmid Naheen; Akhlaqur Rahman; Ambarish Kulkarni,"At present, the whole world is transitioning to the fourth industrial revolution, or Industry 4.0, representing the transition to digital, fully automated environments, and cyber-physical systems. Industry 4.0 comprises many different technologies and innovations, which are being implemented in many different sectors. In this review, we focus on the healthcare or medical domain, where healthcare is being revolutionized. The whole ecosystem is moving towards Healthcare 4.0, through the application of Industry 4.0 methodologies. Many technical and innovative approaches have had an impact on moving the sector towards the 4.0 paradigm. We focus on such technologies, including Internet of Things, Big Data Analytics, blockchain, Cloud Computing, and Artificial Intelligence, implemented in Healthcare 4.0. In this review, we analyze and identify how their applications function, the currently available state-of-the-art technologies, solutions to current challenges, and innovative start-ups that have impacted healthcare, with regards to the Industry 4.0 paradigm.",10,3,43,,Engineering management; Health care; Domain (software engineering); Industry 4.0; Focus (computing); Computer science; Industrial Revolution; Big data; Function (engineering); Cloud computing,Paul  S.; Riffat  M.; Yasir  A.; Mahim  M.N.; Sharnali  B.Y.; Naheen  I.T.; Rahman  A.; Kulkarni  A cloud computing method; artificial intelligence; IoT; blockchain; healthcare 4.0; industry 4.0,,,,https://dblp.uni-trier.de/db/journals/jsan/jsan10.html#PaulRYMSNRK21 https://doi.org/10.3390/jsan10030043 https://www.mdpi.com/2224-2708/10/3/43 https://www.mdpi.com/2224-2708/10/3/43/pdf,http://dx.doi.org/10.3390/jsan10030043,,10.3390/jsan10030043,3180706102,,0,001-380-309-583-376; 002-353-588-124-596; 003-305-085-020-680; 003-360-732-233-044; 003-677-445-178-594; 004-719-609-648-767; 006-196-624-089-636; 008-262-051-867-730; 009-163-257-407-871; 010-322-762-544-333; 010-987-924-507-516; 011-210-301-909-192; 011-650-353-291-258; 012-559-540-267-500; 013-095-955-185-359; 013-287-665-466-861; 013-486-442-948-611; 013-919-706-561-623; 014-621-368-441-227; 016-768-927-055-111; 016-819-194-616-838; 017-500-567-624-366; 018-404-323-540-496; 018-438-418-922-53X; 019-631-962-328-535; 019-739-704-167-489; 020-174-844-068-896; 021-152-254-601-282; 021-657-331-314-556; 023-443-714-629-60X; 023-670-462-834-50X; 024-212-344-647-904; 027-041-113-065-750; 027-367-050-473-406; 027-436-017-320-56X; 027-826-734-328-760; 029-284-033-251-675; 030-840-927-769-721; 032-037-543-513-874; 032-652-026-514-531; 033-670-310-722-296; 035-531-798-300-451; 036-358-754-553-270; 036-469-063-533-440; 036-567-966-846-914; 036-756-036-127-924; 038-198-616-735-239; 039-214-669-772-74X; 039-543-961-161-345; 039-846-999-880-060; 040-008-544-794-53X; 040-867-521-365-092; 041-133-557-089-732; 041-437-717-635-476; 042-583-049-426-469; 043-979-280-803-957; 045-288-088-738-93X; 046-693-311-256-745; 047-171-021-612-244; 047-232-961-833-828; 048-429-444-386-340; 050-516-164-491-864; 051-567-351-032-15X; 051-742-983-377-856; 052-096-758-892-758; 052-774-150-404-912; 054-260-178-856-958; 054-924-775-883-902; 057-015-670-912-413; 057-052-559-177-505; 057-201-196-855-499; 057-806-039-972-079; 059-090-030-621-119; 060-139-154-931-258; 065-482-797-451-610; 068-773-975-295-69X; 071-935-443-374-562; 073-306-242-519-543; 074-340-561-628-419; 078-630-971-483-655; 080-065-445-962-552; 086-387-394-113-429; 086-925-860-220-13X; 087-027-425-851-414; 088-589-063-696-437; 091-620-396-383-798; 093-473-259-348-545; 102-535-519-813-868; 104-854-812-622-957; 105-683-679-620-735; 109-055-157-525-325; 109-730-056-265-129; 115-207-236-810-412; 116-007-028-352-170; 121-938-072-519-034; 127-956-522-591-357; 129-031-277-945-673; 130-186-680-540-272; 130-555-965-498-697; 131-392-825-082-326; 135-553-141-898-826; 140-132-497-079-309; 143-332-116-517-893; 164-999-639-953-43X; 166-743-648-149-404; 168-127-555-363-421; 172-840-758-460-641; 182-472-964-860-175; 183-208-572-531-077; 186-773-563-357-661,83,true,cc-by,gold
052-616-783-435-969,"Future of industry 5.0 in society: human-centric solutions, challenges and prospective research areas.",2022-09-08,2022,journal article,"Journal of cloud computing (Heidelberg, Germany)",2192113x,Springer Science + Business Media,United States,Amr Adel,"Industry 4.0 has been provided for the last 10 years to benefit the industry and the shortcomings; finally, the time for industry 5.0 has arrived. Smart factories are increasing the business productivity; therefore, industry 4.0 has limitations. In this paper, there is a discussion of the industry 5.0 opportunities as well as limitations and the future research prospects. Industry 5.0 is changing paradigm and brings the resolution since it will decrease emphasis on the technology and assume that the potential for progress is based on collaboration among the humans and machines. The industrial revolution is improving customer satisfaction by utilizing personalized products. In modern business with the paid technological developments, industry 5.0 is required for gaining competitive advantages as well as economic growth for the factory. The paper is aimed to analyze the potential applications of industry 5.0. At first, there is a discussion of the definitions of industry 5.0 and advanced technologies required in this industry revolution. There is also discussion of the applications enabled in industry 5.0 like healthcare, supply chain, production in manufacturing, cloud manufacturing, etc. The technologies discussed in this paper are big data analytics, Internet of Things, collaborative robots, Blockchain, digital twins and future 6G systems. The study also included difficulties and issues examined in this paper head to comprehend the issues caused by organizations among the robots and people in the assembly line.",11,1,40,40,Industry 4.0; Productivity; Cloud computing; Big data; Industrial Revolution; Analytics; Computer science; Manufacturing; Supply chain; Automotive industry; Business; Engineering management; Marketing; Data science; Engineering; Economics; Macroeconomics; Law; Embedded system; Aerospace engineering; Operating system; Political science,Cognitive systems; Disaster recovery; Green manufacturing; Human machine collaboration; Industry 5.0; Smart healthcare; Supply chain,,,,https://journalofcloudcomputing.springeropen.com/counter/pdf/10.1186/s13677-022-00314-5 https://doi.org/10.1186/s13677-022-00314-5,http://dx.doi.org/10.1186/s13677-022-00314-5,36101900,10.1186/s13677-022-00314-5,,PMC9454409,0,000-059-747-613-11X; 000-679-134-652-56X; 003-438-619-894-518; 004-067-899-507-004; 006-265-666-197-017; 008-092-872-335-265; 008-248-960-484-314; 009-909-453-917-295; 010-560-601-156-413; 013-742-441-154-537; 013-923-582-078-155; 014-664-986-366-965; 014-934-290-898-725; 015-234-311-225-052; 015-378-722-636-57X; 016-995-263-200-207; 017-039-755-425-775; 017-415-713-662-955; 017-772-990-990-581; 018-822-581-363-834; 019-168-389-965-870; 019-395-827-118-349; 020-265-055-413-005; 020-332-310-820-968; 020-916-140-650-888; 022-634-714-384-636; 022-741-463-993-19X; 023-975-258-607-403; 024-220-679-888-160; 024-934-625-349-73X; 025-103-279-410-815; 026-628-464-174-197; 027-519-650-344-683; 028-449-924-497-640; 030-252-624-379-880; 032-446-197-585-556; 032-520-590-080-506; 033-851-018-944-660; 033-980-184-014-734; 035-657-181-781-287; 037-054-605-416-006; 037-283-252-713-855; 037-940-845-538-666; 038-196-787-346-28X; 038-406-633-043-713; 039-133-055-460-173; 039-246-626-911-312; 039-709-279-022-980; 040-101-701-855-284; 041-714-819-478-611; 042-611-611-135-403; 043-477-116-181-682; 044-449-815-514-755; 046-295-047-171-609; 047-735-862-933-748; 049-816-999-056-296; 050-191-879-559-444; 050-400-202-276-950; 052-065-581-868-602; 052-372-429-336-580; 054-019-477-630-579; 054-498-652-552-581; 054-538-253-062-474; 055-560-423-651-86X; 055-656-540-530-916; 057-798-161-513-127; 057-865-674-747-962; 058-352-705-568-514; 061-899-948-061-934; 064-430-501-718-726; 066-905-686-087-674; 067-215-875-080-779; 071-348-655-300-630; 071-904-945-537-243; 072-177-496-237-912; 075-662-363-625-645; 077-206-870-934-606; 077-657-517-956-786; 078-484-398-330-097; 079-334-094-555-935; 080-380-722-734-129; 081-784-441-469-012; 081-827-729-392-912; 082-270-222-266-31X; 082-341-503-935-917; 084-031-669-687-668; 084-041-436-635-591; 086-083-592-775-973; 087-755-183-970-677; 090-028-732-620-205; 090-754-045-510-625; 091-620-396-383-798; 096-589-038-114-888; 097-231-340-250-899; 098-210-573-142-155; 098-982-875-252-202; 099-270-959-178-768; 099-373-385-765-024; 109-579-374-934-050; 110-583-766-464-251; 112-938-897-652-028; 113-830-545-572-413; 118-071-883-945-11X; 125-035-331-464-946; 125-626-024-171-101; 125-795-343-058-314; 126-409-714-182-110; 127-782-955-491-59X; 130-705-982-455-630; 133-460-379-589-075; 136-867-687-693-206; 137-187-683-568-552; 138-211-094-500-051; 138-332-915-687-580; 139-621-347-640-123; 140-109-678-513-738; 141-847-466-564-024; 143-569-156-517-586; 146-693-085-289-05X; 147-061-188-080-049; 161-682-090-897-914; 164-140-572-616-76X; 164-292-302-306-916; 167-352-934-579-219; 176-595-487-592-114; 185-018-664-654-715; 186-316-323-513-297; 186-700-598-168-45X; 187-347-342-658-879; 188-253-263-014-273,597,true,"CC BY, CC BY-NC-ND",gold
054-550-126-577-522,Green Transition: The Frontier of the Digicircular Economy Evidenced from a Systematic Literature Review,2021-10-07,2021,journal article,Sustainability,20711050,MDPI AG,Switzerland,Fabio De Felice; Antonella Petrillo,"Today, the issue of economic circularity is certainly not a new concept. It represents an essential issue in any production system since it is an alternative to the current production and consumption model. The importance of the topic is confirmed worldwide. However, there is still a “circularity gap” that can be bridged in the short and medium term, probably with the use of innovative and digital technologies. In fact, many researchers agree that the sustainable future can be achieved in the long term thanks to digital technologies (i.e., IoT, artificial intelligence, quantum computing etc.) which, thanks to their speed of calculation, are able to identify the right solutions at the right time. The challenge, therefore, will be to develop innovative technologies and tools for the efficient use of resources in industries for sustainable production. Thus, the aim of this study is to define the current state of the art and future research developments in this very promising field. To achieve this goal, the integration of a “set” of tools, based on the AHP method and the PRISMA protocol, is proposed. The results aim to be a guideline for decision makers and researchers interested in this topic.",13,19,11068,,Risk analysis (engineering); Consumption (economics); Set (psychology); Circular economy; Production (economics); Field (computer science); Computer science; Business model; Analytic hierarchy process; Protocol (object-oriented programming),circular economy; digital age; technologies; business models; AHP; PRISMA,,,,https://www.mdpi.com/2071-1050/13/19/11068/pdf https://www.mdpi.com/2071-1050/13/19/11068,http://dx.doi.org/10.3390/su131911068,,10.3390/su131911068,3206560980,,0,000-115-957-846-943; 002-841-996-434-094; 004-067-899-507-004; 006-221-489-626-305; 006-930-740-137-934; 007-052-198-657-410; 007-802-141-517-150; 007-827-486-075-686; 010-021-078-612-230; 010-101-586-622-232; 010-314-256-508-137; 010-751-663-313-375; 011-288-108-358-499; 011-543-125-602-751; 013-594-396-390-765; 014-305-493-583-254; 014-380-272-908-684; 015-767-717-737-578; 016-947-232-278-611; 018-698-196-314-07X; 021-410-082-508-776; 021-965-638-332-93X; 022-117-795-105-874; 022-729-463-732-06X; 025-078-821-958-564; 025-168-011-385-919; 025-322-678-205-130; 031-775-181-474-799; 032-143-811-009-076; 034-328-673-210-751; 035-515-544-502-600; 036-961-429-695-327; 037-017-132-805-622; 037-511-796-861-129; 039-356-323-678-127; 041-569-713-415-016; 042-101-363-185-216; 042-147-489-512-351; 044-592-141-889-981; 044-832-507-036-626; 046-813-447-156-421; 046-989-767-200-304; 048-470-729-331-92X; 050-996-829-670-273; 051-209-309-957-749; 051-360-376-447-37X; 054-838-219-015-329; 056-813-810-872-469; 057-401-297-630-527; 058-230-056-733-050; 058-478-024-564-984; 061-866-806-053-858; 062-357-796-110-820; 063-854-744-032-14X; 064-113-824-838-336; 065-708-535-813-094; 066-157-822-409-471; 067-217-189-837-128; 067-975-723-728-662; 068-675-911-822-199; 069-030-120-442-403; 071-303-146-633-518; 071-674-721-444-282; 074-113-557-164-754; 075-421-655-039-579; 076-821-640-057-44X; 077-233-209-239-970; 077-519-427-397-479; 078-746-908-943-326; 082-214-721-771-664; 085-450-187-024-856; 087-250-869-796-948; 087-305-492-427-215; 087-800-300-867-59X; 087-809-834-802-003; 088-742-688-719-166; 095-911-157-172-198; 096-032-845-178-249; 097-372-112-992-216; 097-945-242-105-297; 098-419-943-333-678; 099-937-556-202-260; 104-584-143-746-452; 109-924-917-934-968; 110-175-754-037-022; 115-050-061-853-476; 116-295-029-659-042; 118-749-683-893-681; 121-774-222-561-53X; 124-697-320-254-27X; 130-130-289-861-169; 136-810-923-213-511; 137-803-981-277-020; 142-466-217-298-404; 144-561-493-826-216; 150-522-497-847-327; 159-596-782-569-425; 167-662-082-550-101; 169-967-911-552-818; 172-394-569-880-666; 173-153-239-639-350; 180-616-478-113-139; 192-053-282-425-965; 195-823-599-116-172; 197-768-907-118-940; 198-591-093-690-416,31,true,cc-by,gold
055-019-544-622-656,Close encounters of the fourth kind : A theological essay about new technologies,2022-02-11,2022,book,,,UJ Press,,R. Ruard Ganzevoort,"<jats:p>Some of the studies in this publication excavate lost or disappearing indigenous toponyms. Those researchers contribute in a very concrete way to the preservation of indigenous toponyms, and thereby also the associated cultural heritage. The other papers explore how place naming functions as a mechanism with which to create mental maps and exert socio-political power.</jats:p>",,,45,64,Aesthetics; Sociology; Emerging technologies,,,,,https://www.narcis.nl/publication/RecordID/oai%3Aresearch.vu.nl%3Apublications%2F4558b5e2-da44-4456-b9ea-826df35fdbca https://research.vu.nl/en/publications/close-encounters-of-the-fourth-kind-a-theological-essay-about-new,http://dx.doi.org/10.18820/9781928424512,,10.18820/9781928424512,3127269814,,0,,6,true,,green
055-629-982-758-201,Assessment of the Artificial Intelligence and Quantum Computing in the Smart Management Information Systems,2023-07-31,2023,journal article,Bilişim Teknolojileri Dergisi,13079697; 21470715,International Journal of Informatics Technologies,,Ahmet EFE,"<jats:p xml:lang=""en"">Abstract— Studies in the literature argue that solving the memory problem of quantum computers (QC) will lead to groundbreaking developments in artificial intelligence algorithms affecting every process, strategy, business, and polic,es. Quantum adaptive algorithms have been widely applied, which improve existing methods by taking advantage of artificial intelligence and quantum computing. Although new developments are achieved with hybrid quantum systems, which aim to have sub-threads made by quantum computers, it cannot be predicted precisely where these studies will reach in the future and what kind of benefits and risks, they involve. In this study, based on the knowledge of contemporary and interdisciplinary literature, the current and potential uses of quantum computers, super artificial intelligence applications, and quantum computing methods on machine learning, whose applications have just begun in the laboratory environment, are examined, and assessed. It is claimed that the hardware disadvantages of quantum computers will disappear, and new quantum applications will be developed in the future. This is a requirement of adaptation to the prevalent usage of IoT in Industry 4.0 and Society 5.0 applications. Therefore, theoretically, and conceptual aspects of AI and quantum computing are evaluated to realize guidance of the miracles of the Prophets that can be discovered in the future.</jats:p>",16,3,177,188,Computer science; Quantum computer; Process (computing); Quantum; Quantum machine learning; Adaptation (eye); Natural computing; Artificial intelligence; Computational intelligence; Physics; Quantum mechanics; Optics; Operating system,quantum technology; smart MIS; teleportation; artificial intelligence,,,,https://dergipark.org.tr/en/download/article-file/2714710 https://doi.org/10.17671/gazibtd.1190670 https://dergipark.org.tr/tr/pub/gazibtd/issue/79101/1190670,http://dx.doi.org/10.17671/gazibtd.1190670,,10.17671/gazibtd.1190670,,,0,001-263-143-584-228; 001-575-536-461-82X; 003-009-546-308-032; 007-931-244-368-929; 023-007-350-257-065; 029-046-973-892-452; 029-650-208-226-277; 029-803-646-760-538; 030-589-504-330-533; 031-294-251-873-166; 050-129-444-693-663; 066-792-165-293-976; 066-796-237-872-319; 082-502-175-768-359; 092-360-426-719-01X; 110-517-029-512-019; 119-257-710-140-85X; 122-666-175-857-095; 141-628-767-995-872; 168-401-748-412-022,8,true,,gold
056-710-875-382-311,Exponential Disruptive Technologies and the Required Skills of Industry 4.0: A Review,2019-10-23,2019,preprint,,,MDPI AG,,Ocident Bongomin; Gilbert Gilibrays Ocen; Eric Oyondi Nganyi; Alex Musinguzi; Timothy Omara,"<jats:p>The 21st century has witnessed precipitous changes spanning from the way of life to the technologies that emerged. We have entered a nascent paradigm shift (industry 4.0) where science fictions have become science facts, and technology fusion is the main driver. Thus, ensuring that any advancement in technology reach and benefit all is the ideal opportunity for everyone. In this study, disruptive technologies of industry 4.0 was explored and quantified in terms of the number of their appearances in published literature. The study aimed at identifying industry 4.0 key technologies which have been ill-defined by previous researchers and to enumerate the required skills of industry 4.0. Comprehensive literature survey covering the field of engineering, production, and management was done from multidisciplinary databases: Google scholar, ScienceDirect, Scopus, Sage, Taylor &amp;amp; Francis and Emerald insight. Results of the electronic survey showed that 35 disruptive technologies were quantified and 13 key technologies: Internet of things, Big data, 3D printing, Cloud computing, Autonomous robots, Virtual and Augmented reality, Cyber physical system, Artificial intelligence, Smart sensors, Simulation, Nanotechnology, Drones and Biotechnology were identified. Both technical and personal skills to be imparted into the human workforce for industry 4.0 were reported. The study identified the need to investigate the capability and the readiness of developing countries in adapting industry 4.0 in terms of the changes in the education systems and industrial manufacturing settings. The study proposes the need to address integration of industry 4.0 concepts into the current education system.</jats:p>",,,,,Exponential function; Data science; Industry 4.0; Computer science; 3D printing; Big data; Cloud computing; Internet of Things,3D printing; artificial intelligence; big data; cloud computing; education system; disruptive technologies; industry 4.0; internet of things; skills; virtual and augmented reality,,,,https://www.preprints.org/manuscript/201910.0240/v1/download http://www.preprints.org/manuscript/201910.0240/v1 https://www.preprints.org/manuscript/201910.0240/v2,http://dx.doi.org/10.20944/preprints201910.0240.v2,,10.20944/preprints201910.0240.v2,2980943863,,0,,5,true,cc-by,hybrid
056-935-028-206-605,Technology prioritization framework to adapt maintenance legacy systems for Industry 4.0 requirement: an interoperability approach,,2022,journal article,Production,19805411; 01036513,FapUNIFESP (SciELO),Brazil,André Luiz Alcântara Castilho Venâncio; Eduardo de Freitas Rocha Loures; Fernando Deschamps; Alvaro dos Santos Justus; Alysson Felipe Lumikoski; Guilherme Louro Brezinski,"In the midst of a highly informational scenario, interoperability is an element to be explored by organizations. Such term represents the capacity of a system to communicate between two or more others, in order to use the shared data and access external functionalities (Chen & Daclin, 2006). Among the technologies that exert interoperability in manufacturing, the Internet of Things (IoT), Big Data, Artificial Intelligence (AI), Augmented Reality, Machine to Machine (M2M), Analytics, and Cloud Computing stand out (Alccer & Cruz-Machado, 2019; Oztemel & Gursev, 2020). Classified as information and communication technologies (ICTs), they are the basis for Industry 4.0 (I4.0), enabling the emergence of cyber-physical systems. According to (Erasmus et al., 2020;",32,,,,Interoperability; Industry 4.0; Process management; Engineering; Digital transformation; Capability Maturity Model; Legacy system; Systems engineering; Engineering management; Knowledge management; Computer science; Software; World Wide Web; Operating system; Programming language; Embedded system,Industry 4; Industrial maintenance; Multicriteria Decision-Making (MCDM) methods; Interoperability; Digital transformation,,,,https://www.scielo.br/j/prod/a/sLpKnLskqnQMRp8FCcstj3y/?lang=en&format=pdf https://doi.org/10.1590/0103-6513.20210035,http://dx.doi.org/10.1590/0103-6513.20210035,,10.1590/0103-6513.20210035,,,0,000-860-276-317-245; 003-353-313-467-473; 010-792-349-304-957; 012-097-318-423-855; 013-414-291-804-06X; 014-439-097-360-765; 014-844-432-847-44X; 019-886-565-057-975; 020-131-367-064-365; 022-959-262-923-795; 024-490-648-644-42X; 026-049-078-551-98X; 036-880-037-697-37X; 037-325-156-272-511; 039-017-721-293-306; 040-292-952-697-473; 042-663-325-902-936; 048-038-873-341-337; 048-400-719-661-745; 059-126-492-659-367; 066-241-776-480-753; 066-985-516-694-669; 070-776-690-857-703; 071-379-027-014-096; 071-933-420-639-485; 072-610-976-413-203; 078-441-174-178-428; 079-424-403-334-554; 084-249-962-919-116; 088-418-910-846-488; 092-959-522-724-637; 094-019-771-819-795; 097-634-424-300-327; 101-836-310-109-055; 102-075-874-525-735; 118-436-721-724-321; 122-979-179-413-085; 126-081-607-470-719; 128-993-393-125-307; 134-477-067-632-705; 159-876-659-961-006; 159-889-666-691-692; 160-795-362-213-788; 163-206-876-518-088,8,true,cc-by,gold
057-356-898-970-922,NDE 4.0—A Design Thinking Perspective,2021-01-03,2021,journal article,Journal of nondestructive evaluation,15734862; 01959298,Springer Science and Business Media LLC,United States,Johannes Vrana; Ripudaman Singh,"Cyber technologies are offering new horizons for quality control in manufacturing and safety assurance in-service of physical assets. The line between non-destructive evaluation (NDE) and Industry 4.0 is getting blurred since both are sensory data-driven domains. This multidisciplinary approach has led to the emergence of a new capability: NDE 4.0. The NDT community is coming together once again to define the purpose, chart the process, and address the adoption of emerging technologies. In this paper, the authors have taken a design thinking approach to spotlight proper objectives for research on this subject. It begins with qualitative research on twenty different perceptions of stakeholders and misconceptions around the current state of NDE. The interpretation is used to define ten value propositions or use cases under ‘NDE for Industry 4.0’ and ‘Industry 4.0 for NDE’ leading up to the clarity of purpose for NDE 4.0—enhanced safety and economic value for stakeholders. To pursue this worthy cause, the paper delves into some of the top adoption challenges, and proposes a journey of managed innovation, conscious skills development, and a new form of leadership required to succeed in the cyber-physical world.",40,1,1,24,Safety assurance; Engineering; Design thinking; Emerging technologies; CLARITY; Quality (business); Use case; Process (engineering); Engineering ethics; Value proposition; Engineering management; Value (ethics),Design thinking; Future of NDE; NDE 4.0; NDT 4.0; Use cases; Value proposition,,,,https://link.springer.com/article/10.1007/s10921-020-00735-9 https://www.ncbi.nlm.nih.gov/pmc/articles/PMC7778845 https://link.springer.com/content/pdf/10.1007/s10921-020-00735-9.pdf,http://dx.doi.org/10.1007/s10921-020-00735-9,33424070,10.1007/s10921-020-00735-9,3120082391; 3101183560,PMC7778845,0,006-932-670-368-970; 011-478-512-491-790; 027-679-268-748-719; 030-167-471-212-062; 032-222-329-370-635; 049-032-422-517-048; 056-396-909-682-900; 063-283-720-654-386; 068-991-479-449-843; 073-302-342-161-499; 075-896-608-921-007; 089-548-076-693-10X; 090-553-353-722-178; 142-032-486-920-646; 147-913-128-146-234; 167-462-779-350-963; 178-911-965-708-666,109,true,cc-by-nd,hybrid
